CeGe;Prog. Finan.;Objetivo;Indicador;Descripción Indicador;Unidad de medida;Presupuestado;Realizado
001216;92001;04;10;AUTORIZACIONES DE OCUPACIÓN DEL DOMINIO PÚBL. SOLICITADAS;NÚMERO;650;688
001216;92001;04;11;AUTORIZACIONES DE OCUPACIÓN DEL DOMINIO PÚBL. RESUELTAS;NÚMERO;468;483
001216;92001;04;12;TIEMPO MEDIO EN LA TRAMITACIÓN DE LICENCIAS;SEMANAS;17;17
001216;92001;04;09;LICENCIAS URBANÍSTICAS RESUELTAS;NÚMERO;660;334
001216;92001;04;08;LICENCIAS URBANÍSTICAS POR PROC. ORDINARIO COMÚN RESUELTAS;NÚMERO;70;52
001216;92001;04;07;LICENCIAS URBANÍSTICAS POR PROC. ORDINARIO ABREV. RESUELTAS;NÚMERO;185;95
001216;92001;04;05;LICENCIAS URBANÍSTICAS POR ACT. COMUNICADA RESUELTAS;NÚMERO;400;186
001216;92001;04;06;LICENCIAS URBANÍSTICAS POR PROCED. SIMPLIFICADO RESUELTAS;NÚMERO;5;1
001216;92001;05;01;CIUDADANOS ATENDIDOS;NÚMERO;73000;76063
001216;92001;05;02;VOLANTES DE EMPADRONAMIENTO EMITIDOS;NÚMERO;85000;79340
001216;92001;05;03;CERTIFICADOS DE EMPADRONAMIENTO EMITIDOS;NÚMERO;8500;8744
001216;92001;05;04;ALTAS EN EL PADRÓN TRAMITADAS;NÚMERO;16000;14757
001216;92001;05;05;BAJAS EN EL PADRÓN TRAMITADAS;NÚMERO;500;390
001216;92001;05;06;MODIFICACIONES EN EL PADRÓN;NÚMERO;20000;16720
001216;92001;06;04;EXPEDIENTES DISCIPLINA URBANÍSTICA INICIADOS;NÚMERO;350;460
001216;92001;06;03;EXPEDIENTES SANCIONADORES RESUELTOS;NÚMERO;180;170
001216;92001;06;01;INSPECCIONES URBANÍSTICAS REALIZADAS;NÚMERO;450;1310
001216;92001;06;02;REL INSPEC URB OFICIO/INSP A SOLICT CIUDADANA;PORCENTAJE;11;11
001216;92001;07;01;PERSONAS ATENDIDAS;NÚMERO;145000;136535
001216;92001;07;02;TIEMPO MEDIO DE ATENCIÓN;MINUTOS;5;5
001216;92001;07;03;TIEMPO MEDIO DE ESPERA;MINUTOS;8;4
001216;92001;07;04;ANOTACIONES EN EL REGISTRO;NÚMERO;47000;44940
001216;92001;07;05;SUGERENCIAS Y RECLAMACIONES RELATIVAS AL DISTRITO;NÚMERO;420;304
001216;92001;07;09;ÍNDICE CONTEST SUGERENCIAS Y RECLAM EN 3 MESES MAX;PORCENTAJE;99;62
001216;92001;07;08;ÍNDICE CONTEST SUGERENCIAS Y RECLAM EN 15 DÍAS;PORCENTAJE;27;20
001216;92001;07;07;TIEMPO MEDIO RESPUESTA A SUGERENCIAS Y RECLAMACIONES;DÍAS;42;47
001216;92001;07;06;SUGERENCIAS Y RECLAM RELATIVAS AL DISTRITO CONTESTADAS;NÚMERO;420;304
001216;92401;01;11;SOLICITUDES INCLUSIÓN PROPOSICIONES ORDEN DÍA PLENOS JUNTA;NÚMERO;6;1
001216;92401;01;10;PARTICIPACIÓN VECINAL EN LOS PLENOS DE LA JUNTA MUNICIPAL;RATIO;8;4
001216;92401;01;09;ASISTENCIA MEDIA VECINOS A PLENOS DE LA JUNTA MUNICIPAL;NÚMERO;15;7
001216;92401;01;08;PROPOS.APROBADAS CONSEJ.TERRIT.PROPUESTAS COMIS.PERMAN.;NÚMERO;5;1
001216;92401;01;07;SOLICITUD INCLUSIÓN PROPOSICIONES COM.PERM.EN CONS.TERRIT.;NÚMERO;8;2
001216;92401;01;06;ASISTENCIA MEDIA MIEMBROS A REUNIONES COMIS.PERMANENTES;RATIO;80;50
001216;92401;01;05;REUNIONES DE COMISIONES PERMANENTES DEL CONS.TERRITORIAL;NÚMERO;12;12
001216;92401;01;04;ASISTENCIA MEDIA VECINOS REUNIONES DEL CONSEJO TERRITORIAL;RATIO;10;1
001216;92401;01;03;ASISTENCIA MEDIA MIEMBROS CONSEJO TERRITORIAL A REUNIONES;RATIO;70;45
001216;92401;01;02;REUNIONES DEL CONSEJO TERRITORIAL DEL DISTRITO;NÚMERO;4;5
001216;92401;01;01;CONVOCATORIAS PLENO JUNTA DIFUNDIDAS ASOCIACIONES DISTRITO;NÚMERO;11;14
001216;92401;02;05;ASOCIACIONES Y ENTIDADES SUBVENCIONADAS;NÚMERO;22;24
001216;92401;02;04;SUBVENCIONES CONCEDIDAS/SUBVENCIONES SOLICITADAS;PORCENTAJE;87;88
001216;92401;02;03;SUBVENCIONES CONCEDIDAS ASOC.DECLARADAS UTILIDAD PÚBLICAS;NÚMERO;27;28
001216;92401;02;02;SUBVENCIONES SOLICITADAS ASOC.DECLARADAS UTILIDAD PÚBLICA;NÚMERO;31;32
001216;92401;02;01;ASOC.INSCRITAS REGISTRO ENTID.CIUD.CON DOMICILIO DISTRITO;NÚMERO;116;73
001216;93302;01;04;INSTALACIONES ELEVACIÓN Y ELECTROMECÁNICAS MANTENIMIENTO A CARGO DISTRITO;NÚMERO;21;22
001216;93302;01;03;SUPERFICIE LIBRE DE EDIFICIOS  MANTENIMIENTO A CARGODISTRITO;M2;13464;13464
001216;93302;01;02;SUPERFICIE CONSTRUIDA EDIFICIOS MANTENIMIENTO A CARGO DISTRITO;M2;34321;34321
001216;93302;01;01;EDIFICIOS CON MANTENIMIENTO A CARGO DEL DISTRITO;NÚMERO;25;25
001216;93302;02;08;INCIDENCIA OBRAS ADAPTACIÓN A NORMATIVA INCENDIOS;PORCENTAJE;20;20
001216;93302;02;07;EDIFICIOS MUNICIPALES DONDE REALIZAN OBRAS DE ADAPTACIÓN A NORMATIVA;NÚMERO;8;9
001216;93302;02;06;EDIFICIOS MUNICIPALES ADAPTADOS TOTALMENTE A NORMATIVA DE INCENDIOS;PORCENTAJE;55;55
001216;93302;02;05;EDIFICIOS MUNICIPALES ADAPTADOS PARCIALMENTE A NORMATIVA INCENDIOS;PORCENTAJE;100;100
001216;93302;02;04;SUPERFICIE EDIFICIOS A REFORMAR SOBRE TOTAL MANTENIMIENTO A CARGO DISTRITO;PORCENTAJE;65;65
001216;93302;02;03;EDIFICIOS REFORMADOS SOBRE TOTAL MANTENIMIENTO A CARGO DISTRITO;PORCENTAJE;55;55
001216;93302;02;02;EDIFICIOS PLANES AUTOPROTECCIÓN IMPLANTADOS SOBRE TOTAL EDIFICIOS.;PORCENTAJE;13;13
001216;93302;02;01;PLANES DE AUTOPROTECCIÓN IMPLANTADOS;NÚMERO;6;6
001217;15502;01;03;INTERVENCION A REALIZAR CON MOTIVO ACONTEC. A CELEBRAR DTO.;NÚMERO;2;0
001217;15502;01;02;SITUADOS Y QUIOSCOS A TRASLADAR;NÚMERO;2;0
001217;15502;01;01;OBRAS A REALIZAR EN VÍAS PÚBLICAS CON CARGO PARTICULARES;NÚMERO;6;2
001217;23102;01;15;BENEFICIARIOS DE AYUDAS ECONÓMICAS PARA COMEDOR ESCOLAR.;NÚMERO;98;234
001217;23102;01;14;BENEFICIARIOS DE AYUDAS ECONÓMICAS PARA ESCUELAS  INFANTILES;NÚMERO;30;68
001217;23102;01;13;BENEFICIARIOS DE AYUDAS ECONÓMICAS PARA NECESIDADES BASIC.;NÚMERO;65;82
001217;23102;01;12;PARTICIPANTES EN LAS ESCUELAS DE PADRES HOMBRES;NÚMERO;5;4
001217;23102;01;11;PARTICIPANTES EN LAS ESCUELAS DE PADRES MUJERES;NÚMERO;35;29
001217;23102;01;10;HORAS DE ESCUELAS DE PADRES;HORAS;64;64
001217;23102;01;09;ESCUELA DE PADRES;NÚMERO;2;2
001217;23102;01;08;HORAS MENSUALES DE AYUDA A DOMICILIO POR DOMICILIO;RATIO;22;24
001217;23102;01;07;USUARIOS DE AYUDA A DOMICILIO PARA MENORES Y FAMILIA;NÚMERO;14;14
001217;23102;01;06;MENORES DERIVADOS A CENTROS DE DÍA DE LA COMUNIDAD;NÚMERO;40;40
001217;23102;01;05;MENORES ATENDIDOS EN CENTROS DE DÍA NIÑAS;NÚMERO;48;39
001217;23102;01;04;MENORES ATENDIDOS EN CENTROS DE DÍA NIÑOS;NÚMERO;32;41
001217;23102;01;03;HORAS DE ATENCIÓN EN LUDOTECAS;HORAS;998;998
001217;23102;01;02;MENORES ATENDIDOS EN LUDOTECAS NIÑOS;NÚMERO;35;31
001217;23102;01;01;MENORES ATENDIDOS EN LUDOTECAS NIÑAS;NÚMERO;25;29
001217;23102;02;12;REUNIONES COMISIÓN ABSENTISMO ESCOLAR;HORAS;40;40
001217;23102;02;11;MENORES ABSENTISTAS EN SEGUIMIENTO NIÑOS;NÚMERO;48;70
001217;23102;02;10;MENORES ABSENTISTAS EN SEGUIMIENTO NIÑAS;NÚMERO;52;60
001217;23102;02;09;MENORES Y ADOLESCENTES ATENDIDOS SERVICIO EDUCACIÓN SOCIAL;NÚMERO;700;900
001217;23102;02;08;ADOLESC. ATENDIDOS PROG. APOYO Y SEGUIM. SOCIOEDUC. MUJ;NÚMERO;20;65
001217;23102;02;07;ADOLESC. ATENDIDOS PROG. APOYO Y SEGUIM. SOCIOEDUC. HOM;NÚMERO;30;70
001217;23102;02;06;MENORES ATENDIDOS PROG. APOYO EMPL. RIESGO EXCLUS. SOC. MUJ;NÚMERO;90;95
001217;23102;02;05;MENORES ATENDIDOS PROG. APOYO EMPL. RIESGO EXCLUS. SOC. HOM;NÚMERO;110;90
001217;23102;02;04;FAMILIAS DERIVADAS SERVIC. APOYO RESIDENCIAL Y SOCIAL MENOR.;NÚMERO;6;10
001217;23102;02;03;REUNIONES EQUIPOS TÉCNICOS DE MENORES Y FAMILIA;HORAS;280;364
001217;23102;02;02;MENORES VALORADOS EN EQUIPOS DE TRABAJO DE MENORES Y FAM.;NÚMERO;700;896
001217;23102;02;01;FAMILIAS DERIVADAS A CENTROS DE ATENC. A LA INFANCIA;NÚMERO;70;82
001217;23106;01;01;PERSONAS ATENDIDAS UNIDADES TRABAJO SOCIAL PRIMERA ATENCIÓN;NÚMERO;7500;4069
001217;23106;01;02;CASOS URGENTES ATENDIDOS UNIDADES TRABAJO SOCIAL;NÚMERO;50;37
001217;23106;01;03;ENTREVISTAS REALIZADAS EN U.T.S. PRIMERA ATENCIÓN;NÚMERO;6500;7960
001217;23106;01;04;UNIDADES FAMILIARES EN SEGUIMIENTO POR UNIDADES DE TRABAJO;NÚMERO;9500;10535
001217;23106;01;05;ENTREVISTAS REALIZADAS EN UNIDADES DE TRABAJO SOCIAL DE ZONA;NÚMERO;8000;15138
001217;23106;02;01;PERSONAS CON DISCAPACIDAD USUARIAS SERVICIO AYUDA DOMICILIO;NÚMERO;70;73
001217;23106;02;02;MEDIA DE HORAS MENSUALES AYUDA A DOMICILIO A DISCAPACITADOS;HORAS/PERSONA;25;37
001217;23106;02;03;PERSONAS DISCAPACITADAS BENEFICIARIAS DE AYUDAS ECONOMICAS;NÚMERO;10;10
001217;23106;03;01;PERCEPTORES DE RENTA MÍNIMA DE INSERCIÓN;NÚMERO;650;786
001217;23106;03;02;PROYECTOS INTEGRACIÓN SOCIOLABORAL DE R.M.I.;NÚMERO;5;5
001217;23106;03;03;PARTICIPANTES PROYECTOS INTEGRACIÓN R.M.I.;NÚMERO;200;200
001217;23106;04;01;PERSONAS SIN HOGAR ATENDIDAS;NÚMERO;8;17
001217;23106;04;02;PERSONAS SIN HOGAR DERIVADAS A SERV. ATENCIÓN SOCIAL ESPECIAL;NÚMERO;6;6
001217;23106;04;03;PERSONAS SIN HOGAR BENEFICIARIAS DE AYUDAS ECONÓMICAS;NÚMERO;7;17
001217;23106;04;04;PERSONAS ALOJADAS EN PENSIÓN;NÚMERO;4;2
001217;23301;01;10;AYUDAS TÉCNICAS PARA LA MOVILIDAD;NÚMERO;37;170
001217;23301;01;09;BENEFICIARIOS AYUDAS PARA ADAPTACIONES GERIÁTRICAS;NÚMERO;40;33
001217;23301;01;08;BENEFICIARIOS AYUDAS ECONÓMICAS PARA NECESIDADES BÁSICAS;NÚMERO;14;10
001217;23301;01;07;PERSONAS MAYORES USUARIAS SERVICIO DE TELEASISTENCIA;NÚMERO;5500;6112
001217;23301;01;06;PERSONAS MAYORES USUARIAS SERVICIO LAVANDERÍA A DOMICILIO;NÚMERO;15;18
001217;23301;01;05;PERSONAS MAYORES USUARIAS SERVICIO DE COMIDA A DOMICILIO;NÚMERO;60;81
001217;23301;01;04;HORAS MENSUALES AYUDA DOMICILIO PARA MAYORES POR DOMICILIO;HORAS;20;20
001217;23301;01;03;SOLIC. PREST. SERVICIO AYUDA A DOMICILIO PARA PERS. MAYORES;NÚMERO;800;710
001217;23301;01;02;ÍNDICE DE ATENCIÓN DOMICILIARIA A MAYORES DE 80 AÑOS;PORCENTAJE;25;40
001217;23301;01;01;PERSONAS MAYORES USUARIAS DEL SERVICIO DE AYUDA A DOMICILIO;NÚMERO;1700;1765
001217;23301;02;01;CENTROS DE MAYORES DEL DISTRITO;NÚMERO;8;8
001217;23301;02;02;SOCIOS DE LOS CENTROS DE MAYORES;NÚMERO;18000;17711
001217;23301;02;03;GRADO DE UTILIZACIÓN DE LOS CENTROS DE MAYORES;PORCENTAJE;60;60
001217;23301;02;04;TALLERES DE ACTIVIDADES REALIZADOS;HORAS;12500;15054
001217;23301;02;05;PARTICIPANTES EN TALLERES MUJERES;NÚMERO;1541;2825
001217;23301;02;06;PARTICIPANTES EN TALLERES HOMBRES;NÚMERO;632;901
001217;23301;02;07;EXCURSIONES Y VISITAS SOCIO-CULTURALES REALIZADAS;NÚMERO;50;28
001217;23301;02;08;PART. EN EXCURSIONES Y VISITAS SOCIO-CULTURALES MUJERES;NÚMERO;1700;807
001217;23301;02;09;PART. EN  EXCURSIONES Y VISITAS SOCIO-CULTURALES HOMBRES;NÚMERO;800;459
001217;23301;02;10;VOLUNTARIOS EN LOS CENTROS DE MAYORES MUJERES;NÚMERO;73;90
001217;23301;02;11;VOLUNTARIOS EN LOS CENTROS DE MAYORES HOMBRES;NÚMERO;87;79
001217;23301;02;12;BENEFICIARIOS  AYUDAS PARA COMEDOR EN CENTR. DE MAYORES;NÚMERO;330;270
001217;23301;02;13;COMIDAS SERVIDAS EN LOS COMEDORES DE LOS CENTROS MAYORES;NÚMERO;50000;49445
001217;23301;03;04;MAYORES CON APOYO PSICOLÓGICO;NÚMERO;80;88
001217;23301;03;03;USUARIOS ACOGIDOS AL PROG. 'RESPIRO FAMILIAR' FINES SEMANA;NÚMERO;3;5
001217;23301;03;02;SESIONES GRUPALES DE GRUPOS CIUDANDO AL CUIDADOR;HORAS;24;24
001217;23301;03;01;PARTICIPANTES EN LOS GRUPOS CIUDANDO AL CUIDADOR;NÚMERO;20;28
001217;23301;04;01;USUARIOS PLAZAS CENTROS ALZHEIMER O DETERIORO COGNITIVO;NÚMERO;60;69
001217;23301;04;02;BENEFICIARIOS AYUDAS TEMPORALES PARA CENTROS DE ALZHEIMER;NÚMERO;1;0
001217;23301;04;03;USUARIOS CENTRO DÍA MAYORES CON DETERIORO FUNCIONAL O FÍSICO;NÚMERO;100;173
001217;23301;05;01;PLAZAS SOLICITADAS EN PISOS TUTELADOS;NÚMERO;2;4
001217;23301;05;02;PLAZAS SOLICITADAS PARA RESIDENCIAS  PÚBLICAS DE LA COMUNIDAD;NÚMERO;7;187
001217;23301;05;03;BENEFICIARIOS DE AYUDAS ECONÓMICAS ALOJAMIENTOS ALTERNAT.;NÚMERO;4;0
001217;31401;01;01;INSPECCIONES. EN MATERIA DE RESTAURACIÓN COLECTIVA;NÚMERO;650;658
001217;31401;01;02;INSPEC. EN MATERIA DE COMERCIO MINORISTA DE ALIMENTACION;NÚMERO;550;1344
001217;31401;01;03;EFICACIA OPERATIVA INSPECCIONES SEGURIDAD ALIMENTARIA;PORCENTAJE;100;173
001217;31401;01;04;TOMA DE MUESTRAS DE ALIMENTOS Y BEBIDAS;NÚMERO;80;77
001217;31401;01;05;EFICACIA OPERATIVA TOMA MUESTRAS DE ALIMENTOS Y BEBIDAS;PORCENTAJE;100;96
001217;31401;01;06;EFICACIA OPERATIVA INSPECC. DENUN., BROTES Y ALERT.TIPO I Y II;PORCENTAJE;100;100
001217;31401;01;07;CONTROL CORREC.DEFICIENCIAS DETECTADAS ESTABLEC EN LOS QUE HA PRODUCIDO BROTE ORIGEN ALIMENTARIO;PORCENTAJE;100;100
001217;31401;01;08;INFORMES SANIT. LICEN. URBANIS., REGISTROS SANITARIOS;NÚMERO;25;30
001217;31401;02;01;INSPECCIONES. EN MATERIA DE CONSUMO NO ALIMENTARIO;NÚMERO;220;324
001217;31401;02;02;EFICACIA OPERATIVA INSPEC. CONSUMO NO ALIMENTARIO;PORCENTAJE;100;147
001217;31401;02;03;EFICACIA OPERATIVA INSP. DENUNCIAS Y ALERTAS NO ALIMENTARIAS;PORCENTAJE;100;100
001217;31401;03;01;RECLAMACIONES QUE SON TRAMITADAS EN UN PLAZO 2 MESES;PORCENTAJE;70;71
001217;31401;03;02;INFORMAC. AL CONSUMIDOR DERIVACION EXPTE OTRO ORGANO COMPETENTE PARA RESOLVER;PORCENTAJE;100;100
001217;31401;03;03;MEDIACION CONFLICTO ENTRE CONSUMIDORES Y USUARIOS;PORCENTAJE;50;58
001217;31401;03;04;ESTABLEC. A LOS QUE SE LES HA GESTIONADO HOJAS RECLAMACION;NÚMERO;150;231
001217;31401;03;05;INFORMES EN MATERIA DE CONSUMO EN TRAMITAC. EXPEDIENTES;NÚMERO;30;47
001217;31401;04;08;EFIC. OPER. INSP. POR DENUNCIAS Y ALERTAS;PORCENTAJE;100;100
001217;31401;04;07;EFICACIA OPERATIVA INSPC. E.I. Y C. CUIDADO Y RECREO INFANTIL ESTABLECIMIENT. PELUQUERÍA, ESTÉTICA/BELLEZ Y ADORNO CORP;PORCENTAJE;100;117
001217;31401;04;06;INSPEC. ESC. INFANTILES Y CENTROS CUIDADO Y RECREO INFANTIL ESTABLECIMIENT. PELUQUERIA, ESTÉTICA/BELLEZA Y ADORNO CORP.;NÚMERO;265;310
001217;31401;04;05;COMUNICACIÓN DE APERTURA DE TEMPORADA DE PISCINAS;NÚMERO;58;58
001217;31401;04;04;EFICACIA OPERATIVA TOMA DE MUESTRAS AGUA PISCINAS;PORCENTAJE;100;210
001217;31401;04;03;TOMA DE MUESTRAS PROGRAMADAS DE AGUA  EN PISCINAS;NÚMERO;10;21
001217;31401;04;02;EFICACIA OPERATIVA INSPECCIONES EN PISCINAS;PORCENTAJE;100;153
001217;31401;04;01;INSPECCIONES  EN PISCINAS;NÚMERO;70;107
001217;31401;05;01;CAMPAÑAS, OBSERVACIONES Y LICENCIAS;NÚMERO;1215;1743
001217;31401;05;02;INSPECCIONES PROGRAMADAS EN MATERIA DE PROTECCIÓN ANIMAL;NÚMERO;10;10
001217;31401;05;03;EFICACIA OPERATIVA INSPECC. EN MAT. PROTECC. ANIMAL;PORCENTAJE;100;100
001217;31401;05;04;DENUNC. SOBRE TENENC. DE ANIMALES Y PROTECC. ANIMAL MOVIMIENTO PECUARIO;NÚMERO;23;45
001217;31401;06;01;PROPUESTAS INICIO EXP. SANCION. EN MATER. DE SALUD PÚBLICA;NÚMERO;150;180
001217;31401;06;02;PROPUESTA INCIO EXP. SANCIONADOR EN MATERIA DE CONSUMO;NÚMERO;10;26
001217;31401;06;03;MEDIDAS CAUTELARES Y PROVISIONALES ADOPTADAS;NÚMERO;10;19
001217;32101;01;10;NIÑOS PARTICIPANTES EN SERVICIO PSICOPEDAGÓGICO;NÚMERO;75;85
001217;32101;01;09;NIÑAS PARTICIPANTES EN SERVICIO PSICOPEDAGÓGICO;NÚMERO;75;85
001217;32101;01;08;NIÑOS PARTICIPANTES EN ESCUELAS DE VERANO;NÚMERO;125;219
001217;32101;01;07;NIÑAS PARTICIPANTES EN ESCUELAS DE VERANO;NÚMERO;125;182
001217;32101;01;06;ALUMNOS DE INSTITUTOS PÚBLICOS PARTICIPANTES EN LAS ACTIVIDADES DEL PLAN  INTEGRAL DE CONV;NÚMERO;500;566
001217;32101;01;01;COLEGIOS DONDE SE HAN REALIZADO ACTIVID. COMPLEMENTARIAS;NÚMERO;20;20
001217;32101;01;02;COLEGIOS DONDE SE HAN REALIZADO ACTIVID. EXTRAESCOLARES;NÚMERO;20;20
001217;32101;01;03;ACTIVIDADES EXTRAESCOLARES REALIZADAS EN CENTROS EDUCAT.;NÚMERO;30;30
001217;32101;01;05;ALUMNAS DE INSTITUTOS PÚBLICOS PARTICIPANTES EN LAS ACTIVIDADES DEL PLAN  INTEGRAL DE CONVIVENCIA;NÚMERO;500;490
001217;32101;01;04;ESCOLARES PARTICIPANTES EN LAS ACTIVIDADES EXTRAESCOLARES;NÚMERO;7500;7500
001217;32101;02;07;CASOS ACTIVOS SEGUIMI.PROGR.PREVENCIÓN ABSENTISMO ESCOLAR NIÑOS;NÚMERO;175;177
001217;32101;02;06;CASOS ACTIVOS SEGUIMI.PROGR.PREVENCIÓN ABSENTISMO ESCOLAR NIÑAS;NÚMERO;195;205
001217;32101;02;08;PREVALENCIA DE ABSENTISMO EN POBLACIÓN ESCOLAR DEL DTO.;RATIO;30;2
001217;32101;02;09;VISITAS DOMICILIARIAS;NÚMERO;1100;1264
001217;32101;02;05; ALUMNADO PARTICIPANTE EN ACTIVIDADES PREVENTIVAS NIÑOS;NÚMERO;75;176
001217;32101;02;04; ALUMNADO PARTICIPANTE EN ACTIVIDADES PREVENTIVAS NIÑAS;NÚMERO;75;172
001217;32101;02;03;ACTIVIDADES PREVENTIVAS;NÚMERO;10;12
001217;32101;02;02;NÚMERO DE COMISIONES DE ABSENTISMO ESCOLAR;NÚMERO;7;7
001217;32101;02;01;CENTROS EDUCATIVOS REMITENTES DE PROTOCOLOS;NÚMERO;70;65
001217;32101;02;10;ENTREVISTAS FAMILIARES;NÚMERO;790;842
001217;32101;02;11;ENTREVISTAS A MENORES NIÑAS;NÚMERO;140;165
001217;32101;02;12;ENTREVISTAS A MENORES NIÑOS;NÚMERO;120;140
001217;32101;02;13;ACOMPAÑAMIENTO A MENORES NIÑAS;NÚMERO;49;34
001217;32101;02;14;ACOMPAÑAMIENTO A MENORES NIÑOS;NÚMERO;33;23
001217;32101;02;15;COMPARECENCIAS;NÚMERO;90;87
001217;32101;02;16;ENTIDAD . DENTRO DTO. COLABORAN PROGRAMA ABSENTISMO ESC.;NÚMERO;10;9
001217;32101;02;17;REUNIONES CON LOS CENTROS EDUCATIVOS;HORAS;300;307
001217;32101;02;18;COORDINACIÓN Y REUNIONES CON OTROS RECURSOS DEL DISTRITO;NÚMERO;500;482
001217;32101;03;02;ALUMNOS ESCOLARIZADOS POR LAS COMISIONES DE ESCOLARIZAC.;NÚMERO;3000;2050
001217;32101;03;01;REUNIONES DE LA COMISIÓN DE ESCOLARIZACIÓN;NÚMERO;50;50
001217;32101;04;03;ALUMNOS ESCOLARIZADOS ESCUELAS INFANTILES TITULARID. MPAL;NÚMERO;290;290
001217;32101;04;02;REUNIONES CON LAS ESCUELAS INFANTILES MUNICIPALES;NÚMERO;15;17
001217;32101;04;01;ESCUELAS INFANTILES TITULARIDAD MUNICIPAL GESTIÓN INDIRECTA;NÚMERO;3;3
001217;32101;05;02;ASESORAMIENTO Y ORIENTACIÓN A LAS AMPAS;NÚMERO;30;30
001217;32101;05;01;INFORMACIÓN Y ATENCIÓN INDIVIDUALIZADA Y COLECTIVA;NÚMERO;4500;4200
001217;32101;06;04;COLEGIOS PARTICIPANTES EN CERTÁMENES Y CONCURS. ARTÍSTICOS;NÚMERO;8;13
001217;32101;06;03;ALUMNOS PARTICIPANTES EN CERTÁMENES Y CONCURS.  ARTISTICOS NIÑOS;NÚMERO;60;109
001217;32101;06;02;ALUMNOS PARTICIPANTES EN CERTÁMENES Y CONCURS.  ARTISTICOS NIÑAS;NÚMERO;60;145
001217;32101;06;01;CERTÁMENES, CONCURSOS Y PREMIOS CONVOCADOS;NÚMERO;1;1
001217;32101;07;02;ALUMNOS PARTICIPANTES EN AULAS DE EDUCACIÓN ADULTOS;NÚMERO;200;200
001217;32101;07;01;AULAS DE EDUCACIÓN DE ADULTOS;NÚMERO;6;6
001217;32101;08;06;ENTIDADES PARTICIPANTES EN LAS COMISIONES PARTICI. INFANTIL;NÚMERO;10;9
001217;32101;08;05;PARTICIPANTES EN LAS COMISIONES DE PARTICIPACIÓN INFANTIL NIÑOS;NÚMERO;25;25
001217;32101;08;04;PARTICIPANTES EN LAS COMISIONES DE PARTICIPACIÓN INFANTIL NIÑAS;NÚMERO;25;25
001217;32101;08;03;COMISIONES DE PARTICIPACIÓN INFANTIL;NÚMERO;9;12
001217;32101;08;02;PARTICIPANTES JORNADAS, M. REDONDAS Y ENCUENTROS FORMATIV;NÚMERO;100;113
001217;32101;08;01;JORNADAS, MESAS REDONDAS Y ENCUENTROS DE CARACT.FORMATIV.;NÚMERO;5;6
001217;32101;09;11;INCIDENCIA OBRAS DE ELIMINACIÓN DE BARRERAS ARQUITECTÓNICAS;PORCENTAJE;10;10
001217;32101;09;10;CENT.EDUC.SIN BARRERAS ARQUITEC.SOBRE ELTOTAL COLEGIOS;PORCENTAJE;43;43
001217;32101;09;09;PLANES DE AUTOPROT.IMPLANT. EN C.EDUCATIVOS MANT. DISTRITO;NÚMERO;23;22
001217;32101;09;08;INCIDENCIA EN OBRAS ADPTACIÓN A LA NORMATIVA INCENDIOS;PORCENTAJE;8;8
001217;32101;09;07;CENTROS EDUCATIVOS OBRAS DE ADAPTACIÓN A NORM.INCENDIOS;NÚMERO;2;2
001217;32101;09;06;CENTROS EDUCATIVOS INFANTILES ADAPTA. TOT. NORM. INCENDIOS;PORCENTAJE;94;94
001217;32101;09;05;CENTROS EDUCATIVOS INFANTILES ADAPTA. PAR. NORM. INCENDIOS;PORCENTAJE;100;100
001217;32101;09;04;SUPERFICIE LIBRE DE CENTROS EDUCATIVOS MANTENIMIENTO DTO.;M2;101219;100479
001217;32101;09;03;SUPERFICIE CONSTRUIDA CENTR. EDUCATIV. MANTENIMIENTO DTO.;M2;72643;73472
001217;32101;09;02;CENTROS EDUCATIVOS CON LIMPIEZA A CARGO DEL DISTRITO;NÚMERO;20;20
001217;32101;09;01;CENTROS EDUCATIVOS CON MANTENIMIENTO A CARGO DEL DISTRITO.;NÚMERO;23;23
001217;33401;01;14;PARTICIPANTES HOMBRES  EN LAS VISITAS CULTURALES;NÚMERO;30;30
001217;33401;01;13;VISITAS CULTURALES;NÚMERO;15;30
001217;33401;01;12;ASISTENTES A CONFERENCIAS;NÚMERO;1000;1455
001217;33401;01;11;CONFERENCIAS;NÚMERO;50;97
001217;33401;01;10;ASISTENCIA A OBRAS DE TEATRO;NÚMERO;9200;11416
001217;33401;01;09;OBRAS DE TEATRO;NÚMERO;65;112
001217;33401;01;15;PARTICIPANTES MUJERES EN LAS VISITAS CULTURALES;NÚMERO;330;570
001217;33401;01;16;ASISTENCIA POBLACIÓN DEL DISTRITO A ACTIVIDADES CULTURALES;RATIO;150;230
001217;33401;01;02;POBLACIÓN DEL DISTRITO POR CENTRO CULTURAL MUNICIPAL;RATIO;24833;24833
001217;33401;01;03;ACTIVIDADES POR CENTRO CULTURAL;RATIO;100;76
001217;33401;01;04;CESIÓN ESPACIOS Y MEDIOS DE CENTROS CULTURALES MUNICIPALES;HORAS;176;179
001217;33401;01;05;EXPOSICIONES;NÚMERO;80;119
001217;33401;01;06;ASISTENCIA A EXPOSICIONES;NÚMERO;7000;9520
001217;33401;01;07;CONCIERTOS;NÚMERO;30;87
001217;33401;01;08;ASISTENCIA A CONCIERTOS;NÚMERO;5000;11350
001217;33401;01;01;CENTROS CULTURALES MUNICIPALES;NÚMERO;6;6
001217;33401;01;17;SUGERENCIAS Y RECLAMACIONES RELACIONADAS ACT. CULTURALES;NÚMERO;12;13
001217;33401;02;01;CURSOS DE ACTIVIDADES SOCIOCULTURALES Y RECREATIVAS;NÚMERO;328;349
001217;33401;02;02;CURSOS ACTIVID. SOCIOCULT. Y REC. POR CENTRO CULTURAL MPAL.;RATIO;54;58
001217;33401;02;03;HORAS DE CURSOS ACTIVIDADES SOCIOCULT. Y RECREATIVAS;HORAS;19548;22169
001217;33401;02;04;MEDIA TRIMESTRAL ASISTENTES CURSOS DE ACT. SOCIOC. Y REC.;NÚMERO;6500;5469
001217;33401;02;05;MEDIA TRIMESTRAL ASISTENTES CURSOS DE ACT. SOCIOC. Y REC.;RATIO;20;16
001217;33401;02;06;ASISTENCIA POBLACIÓN DEL DTO. CURSOS ACT. SOCIOC. Y REC.;RATIO;43;37
001217;33401;02;07;SUFICIENCIA PLAZAS DE CURSOS DE ACTIVI. OFERTADAS;PORCENTAJE;69;68
001217;33401;03;01;FESTEJOS POPULARES;NÚMERO;1;0
001217;34101;01;20;RECLAMACIONES Y QUEJAS REFERIDAS A SERVICIOS DEP. DEL DTO.;NÚMERO;71;86
001217;34101;01;19;MEDIA SEMANAL HORAS APERTURA INS.BÁSICAS ACCES. CONTROLADO;RATIO;60;60
001217;34101;01;18;MEDIA SEMANAL DE HORAS DE APERTURA EN CENTROS DEPORTIVOS;RATIO;50;82
001217;34101;01;17;OCUPACIÓN UNIDADES DEP.INST.DEP.BÁSICAS CON AC.CONTROLADO;PORCENTAJE;50;60
001217;34101;01;16;NIVEL OCUPACIÓN UNIDADES DEPORTIVAS DE CENTROS DEPORTIVOS;PORCENTAJE;20;23
001217;34101;01;15;UNIDADES DEPORTIVAS POR HABITANTE DEL DISTRITO;RATIO;1;1
001217;34101;01;14;UNIDADES DEPORTIVAS TOTALES;NÚMERO;88;118
001217;34101;01;13;UNID. DEPORTIVAS DE INST. DEPORT. BÁSICAS SIN CONTROL ACCESO;NÚMERO;28;62
001217;34101;01;12;UNID. DEPORTIVAS DE INST. DEPORT .BÁSICAS CON CONTROL ACCESO;NÚMERO;19;13
001217;34101;01;11;UNIDADES DEPORTIVAS DE CENTROS DEPORTIVOS;NÚMERO;41;43
001217;34101;01;10;METROS CUADRADOS INSTALAC. DEPORT. POR HABITANTE DEL DTO.;RATIO;1747;1
001217;34101;01;09;TOTAL SUPERFICIE DE INSTALACIONES DEPORTIVAS;M2;253378;165146
001217;34101;01;08;SUPERFICIE INSTALAC. DEPORTIVAS BÁSICAS DE ACCESO LIBRE;M2;60970;39892
001217;34101;01;07;SUPERFICIE INSTALAC. DEPORTIVAS BÁSICAS ACCESO CONTROLADO;M2;65719;19515
001217;34101;01;06;SUPERFICIE DE CENTROS DEPORTIVOS;M2;126689;105739
001217;34101;01;05;INSTALACIONES DEPORTIVAS BÁSICAS SIN CONTROL DE ACCESO;NÚMERO;18;20
001217;34101;01;04;INSTALACIONES DEPORTIVAS BÁSICAS CON CONTROL DE ACCESO;NÚMERO;3;4
001217;34101;01;03;CALLES DE LAS PISCINAS CUBIERTAS;NÚMERO;24;24
001217;34101;01;02;PISCINAS CUBIERTAS;NÚMERO;3;3
001217;34101;01;01;CENTROS DEPORTIVOS MUNICIPALES;NÚMERO;5;5
001217;34101;02;01;NUEVAS ACTIVIDADES DEPORTIVAS OFERTADAS;NÚMERO;12;8
001217;34101;02;02;NUEVAS ACTIVIDADES DEPORT. OFERTADAS/TOTAL ACTIV.OFERTADAS;PORCENTAJE;6;14
001217;34101;02;03;AMPLIACIÓN HORARIO DE ACTIVIDAD;NÚMERO;43;0
001217;34101;02;04;AMPLIACIÓN HORARIO DE ACTIVIDAD/HORAS TOTAL DE ACTIVIDAD;PORCENTAJE;9;0
001217;34101;02;05;MEDIA MENSUAL DE PLAZAS OFERTADAS PARA EDAD INFANTIL;NÚMERO;2727;3196
001217;34101;02;06;MEDIA MENSUAL DE PLAZAS OFERTADAS PARA JÓVENES;NÚMERO;290;280
001217;34101;02;07;MEDIA MENSUAL DE PLAZAS OFERTADAS PARA ADULTOS;NÚMERO;2159;2097
001217;34101;02;08;MEDIA MENSUAL DE PLAZAS OFERTADAS PARA MAYORES;NÚMERO;329;418
001217;34101;02;09;MEDIA MENSUAL DE PLAZAS OFERTADAS PERSONAS CON DISCAPACI.;NÚMERO;17;17
001217;34101;02;10;MEDIA MENSUAL OCUPAC. PLAZAS CLASES ACTIVID.DEP.INFANTILES;PORCENTAJE;89;89
001217;34101;02;11;MEDIA MENSUAL OCUPAC. PLAZAS CLASES ACTIVID.DEPORT.JÓVENES;PORCENTAJE;79;69
001217;34101;02;12;MEDIA MENSUAL OCUPAC. PLAZAS CLASES ACTIVID.DEPORT ADULTOS;PORCENTAJE;88;75
001217;34101;02;13;MEDIA MENSUAL OCUPAC. PLAZAS CLASES ACTIVID.DEPORT MAYORES;PORCENTAJE;91;82
001217;34101;02;14;MEDIA MENSUAL OCUP. PLAZAS CLASES ACTIVID.DEP.DISCAPACITADOS;PORCENTAJE;100;68
001217;34101;02;15;MEDIA MENSUAL PARTICIPANTES ACTIV. FÍSICO DEPORT. INFANTILES;RATIO;1915;2468
001217;34101;02;16;MEDIA MENSUAL PARTICIPANTES ACTIV. FÍSICO DEPORTIVAS JÓVENES;RATIO;207;275
001217;34101;02;17;MEDIA MENSUAL PARTICIPANTES ACTIV. FÍSICO DEPORT. ADULTOS;RATIO;1281;1335
001217;34101;02;18;MEDIA MENSUAL PARTICIPANTES ACTIV. FÍSICO DEPORTIVAS MAYORES;RATIO;179;287
001217;34101;02;19;MEDIA MENSUAL PARTICIP. ACTIV. FÍSICO DEPORT. DISCAPACITADOS;RATIO;13;9
001217;34101;02;20;HORAS ANUALES DE PROFESORES DE ACTIVIDADES DEPORTIVAS;HORAS;19100;34935
001217;34101;02;21;ESCUELAS PROMOCIÓN DEPORTIVAS REALIZADAS CENTR. ESCOLARES;NÚMERO;16;20
001217;34101;02;22;MEDIA MENSUAL PLAZAS OFERTADAS ESC. PROM. DEP. CENT. ESCOL.;NÚMERO;262;287
001217;34101;02;23;MEDIA MENSUAL OCUP. PLAZAS ESCUELAS PROM. DEP CENT. ESCOL.;PORCENTAJE;88;88
001217;34101;02;24;MEDIA MENSUAL PARTICIPANTES ESCUELAS INFANTILES DEPORTIVAS;RATIO;233;245
001217;34101;02;25;UNIDADES DEPORTIVAS UTILIZADAS ENTIDADES DEPORT. FEDERADAS;NÚMERO;10;10
001217;34101;02;26;ENTIDADES DEPOR. FEDERADAS QUE HAN UTILIZADO UNIDADES DEPOR;NÚMERO;7;7
001217;34101;02;27;UNIDAD DE SERVICIOS DE MEDICINA DEPORTIVA;NÚMERO;3;1
001217;34101;03;06;PARTICIPANTES ACTIVID. NO COMPETITIVAS PROMOCIÓN DEPORTE;NÚMERO;1510;372
001217;34101;03;05;ACTIVIDADES NO COMPETITIVAS PARA LA PROMOCIÓN DEL DEPORTE;NÚMERO;151;3
001217;34101;03;04;PARTICIPANTES EN COMPETICIONES Y TORNEOS/POBLACIÓN DISTRITO;RATIO;296;291
001217;34101;03;03;PARTICIPANTES COMPETICION. Y TORNEOS DEPORTIVOS MUNICIPALES;NÚMERO;4419;4221
001217;34101;03;02;EQUIPOS PARTICIPANTES COMPETICION. Y TORNEOS DEPORT. MPLES.;NÚMERO;268;256
001217;34101;03;01;COMPETIC. Y TORNEOS DEPORT. MUNICIPAL. PROMOCIÓN DEPORTE;NÚMERO;7;6
