CeGe;Prog. Finan.;Objetivo;Indicador;Descripción Indicador;Unidad de medida;Presupuestado;Realizado
001202;23301;02;09;BENEFICIARIOS AYUDAS COMEDOR EN LOS CENTROS DE MAYORES;NÚMERO;50;35
001202;23301;02;04;TALLERES DE ACTIVIDADES REALIZADAS;NÚMERO;75;115
001202;23301;02;03;GRADO DE UTILIZACIÓN DE LOS CENTROS DE MAYORES;PORCENTAJE;100;100
001202;23301;03;01;PARTICIPANTES EN LOS GRUPOS CUIDANDO AL CUIDADOR;NÚMERO;50;39
001202;23301;03;02;SESIONES GRUPALES DE LOS GRUPOS CUIDANDO AL CUIDADOR;HORAS;50;48
001202;23301;03;03;USUARIOS DEL PROGRAMA RESPIRO FAMILIAR LOS FINES DE SEMANA;NÚMERO;5;3
001202;23301;03;04;MAYORES CON APOYO PSICOLOGICO;NÚMERO;15;4
001202;23301;04;02;USUARIOS CENTRO DE DÍA MAYORES DETERIORO FUNCIONAL FÍSICO;NÚMERO;135;143
001202;23301;04;01;USUARIOS PLAZAS CENTROS DE ALZHEIMER O DETERIORO COGNITIVO;NÚMERO;145;137
001202;23301;05;02;BENEFICIARIOS DE AYUDAS ECONÓMICAS ALOJAMIENTOS ALTERNATIVOS;NÚMERO;4;0
001202;23301;05;01;PLAZAS SOLICITADAS EN PISOS TUTELADOS;NÚMERO;14;6
001202;31401;01;09;CONTROL CORRECCIÓN DEFICIENCIAS DETECTADAS ESTABLECIMIENTOS QUE SE HA PRODUCIDO UN BROTE DE ORIGEN ALIMENTARIO;PORCENTAJE;90;100
001202;31401;01;08;INFORMES SANITARIOS EN LICENCIAS URBANISTICAS Y REGISTROS;NÚMERO;40;55
001202;31401;01;07;EFICACIA OPERATIVA INSPECCIONES DENUNCIAS BROTES ALERTAS TIPO I Y TIPO II EN SU CASO;PORCENTAJE;100;100
001202;31401;01;06;EFICACIA OPERATIVA TOMA DE MUESTRAS ALIMENTOS Y BEBIDAS;PORCENTAJE;100;79
001202;31401;01;05;TOMA DE MUESTRAS DE ALIMENTOS Y BEBIDAS;NÚMERO;90;71
001202;31401;01;04;EFICACIA OPERATIVA INSPECCIONES SEGURIDAD ALIMENTARIA;PORCENTAJE;100;168
001202;31401;01;03;AUDITORIAS DE SISTEMAS DE AUTOCONTROL (PCH Y APPCC);NÚMERO;50;81
001202;31401;01;02;INSPECCIONES EN MATERIA DE COMERCIO MINORISTA;NÚMERO;420;620
001202;31401;01;01;INSPECCIONES EN MATERIA DE RESTAURACION COLECTIVA;NÚMERO;370;712
001202;31401;02;03;EFICACIA OPERATIVA INSPECCIONES DENUNCIAS ALERTAS;PORCENTAJE;100;100
001202;31401;02;02;EFICACIA OPERATIVA INSPECCIONES CONSUMO NO ALIMENTARIO;PORCENTAJE;100;144
001202;31401;02;01;INSPECCIONES EN MATERIA DE CONSUMO NO ALIMENTARIO;NÚMERO;500;721
001202;31401;03;05;INFORMES CONSUMO CON MOTIVO DE TRAMITACIÓN DE EXPEDIENTES;NÚMERO;700;805
001202;31401;03;04;ESTABLECIMIENTOS QUE HAN GESTIONADO HOJAS DE RECLAMACIONES;NÚMERO;200;385
001202;31401;03;03;MEDIACIÓN EN CONFLICTOS ENTRE CONSUMIDORES Y EMPRESARIOS;PORCENTAJE;50;65
001202;31401;03;02;INFORMACIÓN AL CONSUMIDOR DE LA DERIVACIÓN DE SUS EXPEDIENTES A OTRO ÓRGANO COMPETENTE DE RESOLVER;PORCENTAJE;100;100
001202;31401;03;01;RECLAMACIONES QUE SON TRAMITADAS PLAZO MÁXIMO DOS MESES;PORCENTAJE;85;95
001202;31401;04;08;EFICACIA OPERATIVA INSPECCIÓN DENUNCIAS Y ALERTAS;PORCENTAJE;100;100
001202;31401;04;07;EFICACIA OPERATIVA INSPECCIÓN ESCUELA Y CUIDADO / RECREO;PORCENTAJE;100;127
001202;31401;04;06;INSPECCIONES ESCUELAS Y CUIDADO / RECREO INFANTILES;NÚMERO;70;89
001202;31401;04;05;COMUNICACIÓN APERTURA TEMPORADA DE PISCINAS;NÚMERO;150;189
001202;31401;04;04;EFICACIA OPERATIVA TOMA DE MUESTRAS DE AGUA EN PISCINAS;PORCENTAJE;100;100
001202;31401;04;03;TOMA DE MUESTRAS DE AGUA EN PISCINAS;NÚMERO;10;10
001202;31401;04;02;EFICACIA OPERATIVA DE LAS INSPECCIONES EN PISCINAS;PORCENTAJE;100;137
001202;31401;04;01;INSPECCIONES EN PISCINAS;NÚMERO;40;55
001202;31401;05;04;INFORMES PROTECCIÓN ANIMAL MOVIMIENTO PECUARIO;NÚMERO;80;79
001202;31401;05;03;EFICACIA OPERATIVA INSPECCIONES PROTECCIÓN ANIMAL Y DENUNCIAS TENENCIA ANIMALES;PORCENTAJE;100;131
001202;31401;05;02;INSPECCIONES PROTECCIÓN ANIMAL;NÚMERO;10;15
001202;31401;05;01;CAMPAÑAS OBSERVACIONES Y LICENCIAS;NÚMERO;1600;2099
001202;31401;06;03;MEDIDAS CAUTELARES Y PROVISIONALES ADOPTADAS;NÚMERO;25;3
001202;31401;06;02;PROPUESTAS INICIO EXPEDIENTES SANCIONADOR CONSUMO;NÚMERO;100;57
001202;31401;06;01;PROPUESTAS INICIO EXPEDIENTES SANCIONADOR SALUD PÚBLICA;NÚMERO;200;190
001202;32101;01;01;COLEGIOS EN LOS QUE SE HAN REALIZADO ACTIVIDADES EXTRAESCOLARES;NÚMERO;5;6
001202;32101;01;02;ACTIVIDADES EXTRAESCOLARES REALIZADAS EN LOS CENTROS EDUCATIVOS;NÚMERO;22;20
001202;32101;01;03;ESCOLARES PARTICIPANTES EN LAS ACTIVIDADES EXTRAESCOLARES;NÚMERO;1530;1250
001202;32101;02;01;CENTROS EDUCATIVOS REMITENTES DE PROTOCOLOS;NÚMERO;31;20
001202;32101;02;02;COMISIONES DE ABSENTISMO ESCOLAR;NÚMERO;5;4
001202;32101;02;03;ACTIVIDADES PREVENTIVAS;NÚMERO;3;2
001202;32101;02;04;ALUMNOS PARTICIPANTES EN LAS ACTIVIDADES PREVENTIVAS;NÚMERO;175;527
001202;32101;02;05;CASOS ACTIVOS EN SEGUIMIENTO DESDE EL PROGRAMA DE PREVENCIÓN DEL ABSENTISMO ESCOLAR;NÚMERO;50;45
001202;32101;02;06;PREVALENCIA DEL ABSENTISMO EN LA POBLACION ESCOLAR DISTRITO;NÚMERO;6;5
001202;32101;02;07;VISITAS DOMICILIARIAS;NÚMERO;20;27
001202;32101;02;08;ENTREVISTAS FAMILIARES;NÚMERO;190;150
001202;32101;02;09;ENTREVISTAS A MENORES;NÚMERO;130;100
001202;32101;02;10;ACOMPAÑAMIENTO A MENORES;NÚMERO;5;5
001202;32101;02;11;COMPARECENCIAS;NÚMERO;30;20
001202;32101;02;12;ENTIDADES DENTRO DEL DISTRITO QUE COLABORAN EN EL PROGRAMA DE PREVENCIÓN Y CONTROL DEL ABSENTISMO ESCOLAR;NÚMERO;10;10
001202;32101;02;13;REUNIONES CON LOS CENTROS EDUCATIVOS;HORAS;24;30
001202;32101;02;14;COORDINACION Y REUNIONES CON OTROS RECURSOS DEL DISTRITO;NÚMERO;125;110
001202;32101;03;01;REUNIONES DE LA COMISIÓN DE ESCOLARIZACIÓN;NÚMERO;32;13
001202;32101;03;02;ALUMNOS ESCOLARIZADOS POR LAS COMISIONES DE ESCOLARIZACIÓN;NÚMERO;1900;960
001202;32101;04;01;ESCUELAS INFANTILES DE TITULARIDAD MUNICIPAL DE GESTIÓN INDIRECTA;NÚMERO;3;3
001202;32101;04;02;REUNIONES CON LAS ESCUELAS INFANTILES MUNICIPALES;NÚMERO;30;28
001202;32101;04;03;ALUMNOS ESCOLARIZADOS EN ESCUELAS INFANTILES DE TITULARIDAD MUNICIPAL;NÚMERO;304;304
001202;32101;05;01;INFORMACION Y ATENCION INDIVIDUALIZADA Y COLECTIVA;NÚMERO;3200;2900
001202;32101;05;02;ASESORAMIENTO Y ORIENTACIÓN A LAS AMPAS;NÚMERO;35;30
001202;32101;05;03;PUBLICACIONES EDITADAS;NÚMERO;7;0
001202;32101;05;04;EJEMPLARES DE PUBLICACIONES DISTRIBUIDAS;NÚMERO;3950;0
001202;32101;06;01;CERTÁMENES CONCURSOS Y PREMIOS CONVOCADOS;NÚMERO;2;2
001202;32101;06;02;ALUMNOS PARTICIPANTES EN CERTÁMENES Y CONCURSOS ARTÍSTICOS;NÚMERO;2100;1900
001202;32101;06;03;COLEGIOS PARTICIPANTES EN CERTÁMENES Y CONCURSOS ARTÍSTICOS;NÚMERO;16;16
001202;32101;07;01;AULAS DE EDUCACION DE ADULTOS;NÚMERO;23;22
001202;32101;07;02;ALUMNOS PARTICIPANTES EN LAS AULAS DE PARTICIPACION DE ADULTOS;NÚMERO;406;397
001202;32101;08;01;JORNADAS MESAS REDONDAS Y ENCUENTROS DE CARACTER FORMATIVO;NÚMERO;20;18
001202;32101;08;02;PARTICIPANTES EN JORNADAS MESAS REDONDAS Y ENCUENTROS DE CARACTER FORMATIVO;NÚMERO;200;180
001202;32101;08;03;COMISIONES DE PARTICIPACION INFANTIL;NÚMERO;8;8
001202;32101;08;04;PARTICIPANTES EN LAS COMISIONES DE PARTICIPACIÓN INFANTIL;NÚMERO;180;165
001202;32101;08;05;ENTIDADES PARTICIPANTES EN LAS COMISIONES DE PARTICIPACIÓN INFANTIL;NÚMERO;12;9
001202;33401;01;01;CENTROS CULTURALES MUNICIPALES;NÚMERO;2;2
001202;33401;01;02;CONCIERTOS;NÚMERO;41;44
001202;33401;01;03;PARTICIPANTES CONCIERTOS;NÚMERO;8610;9021
001202;33401;01;04;CINE;NÚMERO;36;32
001202;33401;01;05;ASISTENTES A CINE;NÚMERO;6300;4235
001202;33401;01;06;ACTIVIDADES INFANTILES;NÚMERO;70;39
001202;33401;01;07;ASISTENTES ACTIVIDADES INFANTILES NÚMERO;NÚMERO;8820;8236
001202;33401;01;08;TEATRO Y ESPECTACULOS;NÚMERO;57;36
001202;33401;01;09;ASISTENTES A TEATRO Y ESPECTACULOS;NÚMERO;12286;7760
001202;33401;01;10;OTRAS ACTIVIDADES CULTURALES;NÚMERO;100;62
001202;33401;01;11;ASISTENTES A OTRAS ACTIVIDADES CULTURALES;NÚMERO;65936;10165
001202;33401;02;01;CURSOS DE ACTIVIDADES SOCIOCULTURALES Y RECREATIVAS;NÚMERO;295;286
001202;33401;02;02;CURSOS ACTIVIDADES SOCIOCULTURALES Y RECREATIVAS POR CENTRO;RATIO;147;143
001202;33401;02;03;CURSOS DE ACTIVIDADES SOCIOCULTURALES Y RECREATIVAS;HORAS;23942;23116
001202;33401;02;04;MEDIA TRIMESTRAL ASISTENTES A CURSOS ACTIVIDADES SOCIOCULTURALES Y RECREATIVAS;NÚMERO;4523;5167
001202;33401;03;01;FIESTAS POPULARES;NÚMERO;1;2
001202;33401;04;02;ESTUDIOS DE SATISFACCION;NÚMERO;14;15
001202;33401;04;01;ESTUDIOS DE NECESIDADES;NÚMERO;34;30
001202;34101;01;01;CENTROS DEPORTIVOS MUNICIPALES;NÚMERO;7;7
001202;34101;01;02;UNIDADES DEPORTIVAS DE CENTROS DEPORTIVOS;NÚMERO;29;29
001202;34101;01;03;UNIDADES DEPORTIVAS INSTALACIONES DEPORTIVAS BASICAS SIN CONTROL ACCESO;NÚMERO;12;12
001202;34101;01;04;TOTAL UNIDADES DEPORTIVAS;NÚMERO;42;41
001202;34101;01;05;NIVEL OCUPACION UNIDADES DEPORTIVAS EN CENTROS DEPORTIVOS;PORCENTAJE;48;48
001202;34101;01;06;OCUPACION UNIDADES DEPORTIVAS INSTALACIONES BASICAS CON ACCESO CONTROLADO;PORCENTAJE;31;31
001202;34101;01;07;MEDIA SEMANAL HORAS APERTURA EN CENTROS DEPORTIVOS;RATIO;90;90
001202;34101;01;08;MEDIA SEMANAL HORAS APERTURA INSTALACIONES BÁSICAS ACCESO CONTROLADO;RATIO;90;90
001202;34101;01;09;PISCINAS CUBIERTAS;NÚMERO;4;4
001202;34101;01;10;RECLAMACIONES Y QUEJAS SERVICIO DEPORTIVO DEL DISTRITO;NÚMERO;280;355
001202;34101;01;11;CALLES PISCINAS CUBIERTAS;NÚMERO;14;14
001202;34101;02;11;MEDIA MENSUAL OCUPACIÓN PLAZAS CLASES ACTIVIDADES DEPORTIVAS JÓVENES;PORCENTAJE;94;94
001202;34101;02;10;UNIDADES DE SERVICIOS DE MEDICINA DEPORTIVA;NÚMERO;1;1
001202;34101;02;09;ENTIDADES DEPORTIVAS FEDERADAS QUE HAN UTILIZADO UNIDADES DEPORTIVAS;NÚMERO;57;56
001202;34101;02;08;UNIDADES DEPORTIVAS UTILIZADAS EN ENTIDADES DEPORTIVAS FEDERATIVAS;NÚMERO;9;9
001202;34101;02;07;MEDIA MENSUAL PARTICIPANTES ESCUELAS INFANTILES DEPORTIVAS;RATIO;30;30
001202;34101;02;06;MEDIA MENSUAL OCUPACION PLAZAS ESCUELAS PROMOCIÓN DEPORTES CENTROS ESCOLARES;PORCENTAJE;81;81
001202;34101;02;05;MEDIA MENSUAL PLAZAS OFERTADAS ESCUELA PROMOCION CENTROS ESCOLARES;NÚMERO;180;180
001202;34101;02;04;ESCUELAS PROMOCIÓN DEPORTES REALIZADAS CENTROS ESCOLARES;NÚMERO;65;25
001202;34101;02;03;PROFESORES ACTIVIDADES DEPORTIVAS;HORAS/AÑO;1796;1796
001202;34101;02;02;MEDIA MENSUAL PARTI. ACRIV. FÍSICO DEPORTES DISCAPACITADOS;RATIO;5;5
001202;34101;02;01;MEDIA MENSUAL OCUPACION PLAZAS CLASES  DEPORTES INFANTILES;PORCENTAJE;88;88
001202;34101;03;01;COMPETICIONES Y TORNEOS DEPORTIVOS MUNICIPALES PROMOCION DEPORTE;NÚMERO;15;40
001202;34101;03;02;EQUIPOS PARTICIPANTES COMPETICIONES Y TORNEOS DEPORTIVOS MUNICIPALES;NÚMERO;335;720
001202;34101;03;03;PARTICIPANTES COMPETICIONES Y TORNEOS DEPORTIVOS MUNICIPALES;NÚMERO;7500;7500
001202;34101;03;04;PARTICIPANTES COMPETICIONES Y TORNEOS POBLACIÓN DEL DISTRITO;RATIO;20;23
001202;34101;03;05;ACTIVIDADES NO COMPETITIVAS PARA LA PROMOCIÓN DEL DEPORTE;NÚMERO;15;26
001202;34101;03;06;PARTICIPANTES ACTIVIDADES NO COMPETITIVAS PROMOCIÓN DEL DEPORTE;NÚMERO;8000;7500
001202;34101;04;01;MANTENIMIENTO SUPERFICIE DE INSTALACIONES DEPORTIVAS;M2;75161;75161
001202;34101;04;02;SUPERFICIE DE INSTALACIONES DEPORTIVAS A REFORMAR;M2;750;7977
001202;43110;01;03;COMERCIOS PARTICIPANTES;NÚMERO;100;0
001202;43110;01;02;ESTABLECIMIENTOS A LOS QUE SE DIRIGE LA CAMPAÑA;NÚMERO;100;0
001202;43110;01;01;CAMPAÑAS DE PROMOCION;NÚMERO;1;0
001202;92001;01;03;CONTRATOS TRAMITADOS PROCEDIMIENTO ABIERTO;NÚMERO;30;24
001202;92001;01;04;CONTRATOS MENORES TRAMITADOS;NÚMERO;70;62
001202;92001;01;02;CONTRATOS TRAMITADOS PROCEDIMIENTO NECOCIADO;NÚMERO;15;8
001202;92001;01;01;CONTRATOS TRAMITADOS;NÚMERO;115;96
001202;92001;02;02;DOCUMENTOS CONTABLES REALIZADOS;NÚMERO;2300;2180
001202;92001;02;01;LIQUIDACIONES EMITIDAS;NÚMERO;1500;1270
001202;92001;03;01;PROPUESTAS ACUERDO ELEVADAS A JUNTA DE GOBIERNO;NÚMERO;3;2
001202;92001;03;02;PROPUESTAS DECRETO ELEVADAS AL CONCEJAL;NÚMERO;3000;2820
001202;92001;03;03;PROPUESTAS RESOLUCIÓN ELEVADAS AL GERENTE;NÚMERO;3500;3230
001202;92001;03;04;ASUNTOS ELEVADOS AL CONSEJO TERRITORIAL;NÚMERO;12;9
001202;92001;03;05;PROPUESTAS ACUERDO ELEVADAS A LA JUNTA MUNICIPAL DE DISTRITO;NÚMERO;100;112
001202;92001;03;06;PROPUESTAS ACUERDO ELEVADAS AL PLENO;NÚMERO;3;2
001202;92001;04;01;LICENCIAS URBANISTICAS ACTUACION COMUNICADA;NÚMERO;220;248
001202;92001;04;02;LICENCIAS URBANISTICAS PROCEDIMIENTO ABREVIADO;NÚMERO;80;36
001202;92001;04;03;LICENCIAS URBANISTICAS PROCEDIMIENTO ORDINARIO COMUN;NÚMERO;100;95
001202;92001;04;04;LICENCIAS URBANISTICAS SOLICITADAS;NÚMERO;400;379
001202;92001;04;05;LICENCIAS URBANISTICAS ACTUACION COMUNICADA RESUELTAS;NÚMERO;220;220
001202;92001;04;06;LICENCIAS URBANISTICAS POR PROCEDIMIENTO SIMPLIFICADO RESUELTAS;NÚMERO;10;28
001202;92001;04;07;LICENCIAS URBANISTICAS POR PROCEDIMIENTO ORDINARIO RESUELTAS;NÚMERO;100;0
001202;92001;04;08;LICENCIAS URBANISTICAS POR PROCEDIMIENTO ORDINARIO COMUN RESUELTAS;NÚMERO;100;60
001202;92001;04;09;LICENCIAS URBANISTICAS RESUELTAS;NÚMERO;430;308
001202;92001;04;15;AUTORIZACIÓN TENENCIA ANIMALES POTENCIALMENTE PELIGROSOS;NÚMERO;14;24
001202;92001;04;14;AUTORIZACION PARA VENTA DE BEBIDAS ALCOHOLICAS;NÚMERO;35;0
001202;92001;04;13;TIEMPO MEDIO EN LA RESOLUCION DE LICENCIAS URBANISTICAS;DÍAS;76;75
001202;92001;04;12;AUTORIZACIONES DE OCUPACION DEL DOMINIO PÚBLICO RESUELTAS;NÚMERO;680;390
001202;92001;04;11;AUTORIZACIONES DEL DOMILIO PUBLICO SOLICITADAS;NÚMERO;680;390
001202;92001;04;10;ACTIVIDAD DE LA UNIDAD DE ASISTENCIA PERSONALIZADA;PORCENTAJE;20;9
001202;92001;05;06;MODIFICACIONES EN EL PADRÓN;NÚMERO;12000;10688
001202;92001;05;05;BAJAS EN PADRÓN TRAMITADAS;NÚMERO;300;165
001202;92001;05;04;ALTAS EN PADRÓN TRAMITADAS;NÚMERO;6000;8004
001202;92001;05;03;CERTIFICADOS DE EMPADRONAMIENTO EMITIDOS;NÚMERO;6000;3954
001202;92001;05;02;VOLANTES DE EMPADRONAMIENTO EMITIDOS;NÚMERO;65000;55647
001202;92001;05;01;CIUDADANOS ATENDIDOS;NÚMERO;55000;44235
001202;92001;06;04;EXPEDIENTES DISCIPLINA URBANISTICA INICIADOS;NÚMERO;650;450
001202;92001;06;03;EXPEDIENTES SANCIONADORES RESUELTOS;NÚMERO;650;675
001202;92001;06;02;RELACION INSPECCIONES URBANÍSTICAS DE OFICIO / INSPECCIONES A SOLICITUD CIUDADANA;RATIO;5;1
001202;92001;06;01;INSPECCIONES URBANÍSTICAS REALIZADAS;NÚMERO;700;550
001202;92001;07;09;ÍNDICE DE CONTESTACIÓN A LAS SUGERENCIAS Y RECLAMACIONES RELATIVAS AL DISTRITO EN EL PLAZO DE 3 MESES;PORCENTAJE;10;52
001202;92001;07;08;ÍNDICE DE CONTESTACIÓN A LAS SUGERENCIAS Y RECLAMACIONES RELATIVAS AL DISTRITO EN EL PLAZO DE 15 DÍAS;PORCENTAJE;90;48
001202;92001;07;07;TIEMPO MEDIO DE RESPUESTA A LAS SUGERENCIAS Y RECLAMACIONES CONTESTADAS POR EL DISTRITO;DÍAS;15;24
001202;92001;07;06;SUGERENCIAS Y RECLAMACIONES CONTESTADAS RELATIVAS AL DISTRITO;NÚMERO;550;458
001202;92001;07;05;SUGERENCIAS Y RECLAMACIONES RELATIVAS AL DISTRITO;NÚMERO;550;475
001202;92001;07;04;ANOTACIONES EN EL REGISTRO;NÚMERO;30000;21487
001202;92001;07;03;TIEMPO MEDIO DE ESPERA;MINUTOS/PERSONA;5;4
001202;92001;07;02;TIEMPO MEDIO DE ATENCIÓN;MINUTOS/PERSONA;4;5
001202;92001;07;01;PERSONAS ATENDIDAS;NÚMERO;55000;52185
001202;92401;01;01;CONVOCATORIAS PLENO JUNTA MUNICIPAL;NÚMERO;9;13
001202;92401;01;07;REUNIONES COMISIONES PERMANENTES CONSEJOS TERRITORIALES;NÚMERO;6;6
001202;92401;01;08;ASISTENCIA MEDIA MIEMBROS A REUNIONES COMISIONES PERMANENTES;RATIO;5;5
001202;92401;01;09;ASISTENCIA MEDIA VECINOS/AS A REUNIONES COMISIONES PERMANENTES;RATIO;3;0
001202;92401;01;10;SOLICITUD INCLUSIÓN PROPOSICIONES COMISIONES PERMANENTES EN CONSEJO TERRITORIAL;NÚMERO;3;3
001202;92401;01;02;PARTICIPACION VECINAL EN LOS PLENOS DE LA JUNTA MUNICIPAL;RATIO;3;2
001202;92401;01;03;SOLICITUDES INCLUSIÓN PROPOSICIONES EN EL ORDEN DEL DÍA PLENO DEL DISTRITO;NÚMERO;2;0
001202;92401;01;04;REUNIONES CONSEJO TERRITORIAL DISTRITO;NÚMERO;4;4
001202;92401;01;05;ASISTENCIA MEDIA MIEMBROS CONSEJOS TERRITORIALES;RATIO;14;12
001202;92401;01;06;ASISTENCIA MEDIA VECINOS A CONSEJOS TERRITORIALES;RATIO;10;9
001202;92401;02;01;ASOCIACIONES INSCRITAS EN EL REGISTRO DE ENTIDADES CIUDADANAS CON DOMICILIO SOCIAL Y AMBITO DE ACTUACIONES DEL DISTRITO;NÚMERO;58;60
001202;92401;02;05;POBLACION DEL DISTRITO / ASOCIACIONES;RATIO;3;0
001202;92401;02;04;SUBVENCIONES CONCEDIDAS / SOLICITADAS;PORCENTAJE;100;95
001202;92401;02;03;SUBVENCIONES CONCEDIDAS A ASOCIACIONES DECLARADAS DE UTILIDAD PÚBLICA;NÚMERO;29;19
001202;92401;02;02;SUBVENCIONES SOLICITADAS POR ASOCACIONES DECLARADAS DE UTILIDAD PÚBLICA;NÚMERO;29;21
001202;93302;01;04;INSTALACIONES ELEVACION Y ELECTROMECANICAS CON MANTENIMIENTO;M2;20;20
001202;93302;01;01;EDIFICIOS CON MANTENIMIENTO A CARGO DEL DISTRITO;NÚMERO;13;13
001202;93302;01;02;SUPERFICIE CONSTRUIDA DE EDIFICIOS A CARGO DEL DISTRITO;M2;31125;31125
001202;93302;01;03;SUPERFICIE LIBRE DE EDIFICIOS CON MANTENIMIENTO;M2;4500;4500
001203;15502;01;01;OBRAS A REALIZAR EN VIAS PUBLICAS CON CARGO A PARTICULARES;NÚMERO;12;11
001203;15502;01;02;SITUADOS Y QUIOSCOS A TRASLADAR;NÚMERO;1;0
001203;15502;01;03;INTERVENCIONES A REALIZAR POR ACONTECIMIENTOS A CELEBRAR;NÚMERO;3;2
001203;23102;01;01;MENORES ATENDIDOS EN CENTROS DE DIA;NÚMERO;40;40
001203;23102;01;02;USUARIOS DE AYUDA A DOMICILIO PARA MENORES Y FAMILIA;NÚMERO;15;10
001203;23102;01;03;HORAS MENSUALES DE AYUDA A DOMICILIO POR DOMICILIO;RATIO;19;20
001203;23102;01;09;BENEFICIARIOS DE AYUDAS ECONÓMICAS PARA COMEDOR ESCOLAR;NÚMERO;10;105
001203;23102;01;08;BENEFICIARIOS DE AYUDAS ECONÓMICAS PARA ESCUELAS INFANTILES;NÚMERO;20;14
001203;23102;01;07;FAMILIAS BENEFICIARIAS  AYUDAS ECONÓMICAS NECESIDADES BÁSICAS;NÚMERO;7;5
001203;23102;01;04;ESCUELA DE PADRES;NÚMERO;2;3
001203;23102;01;05;HORAS DE ESCUELAS DE PADRES;HORAS;48;68
001203;23102;01;06;PARTICIPANTES EN LA ESCUELA DE PADRES;NÚMERO;40;64
001203;23102;02;07;MENORES ATENDIDOS PROG. APOYO EMPLEO RIESGO EXCLUSIÓN  SOCIAL;NÚMERO;8;10
001203;23102;02;08;ADOLESCENTES ATENDIDOS PROG. APOYO Y SEGUIM. SOCIOEDUCATIVO;NÚMERO;14;10
001203;23102;02;09;MENORES Y ADOLESCENTES ATENDIDOS SERV.  EDUCACIÓN SOCIAL;NÚMERO;210;995
001203;23102;02;10;MENORES ABSENTISTAS EN SEGUIMIENTO;NÚMERO;14;15
001203;23102;02;11;REUNIONES COMISIÓN ABSENTISMO ESCOLAR;HORAS;30;30
001203;23102;02;01;FAMILIAS DERIVADAS A CENTROS;NÚMERO;50;38
001203;23102;02;02;MENORES VALORADOS Y EQUIPOS DE TRABAJO DE MENORES Y FAMILIA;NÚMERO;220;323
001203;23102;02;03;REUNIONES EQUIPOS TÉCNICOS DE MENORES Y FAMILIA;HORAS;200;240
001203;23102;02;04;FAMILIAS DERIVADAS AL SERVICIO DE IMPLICACIÓN FAMILIAR;NÚMERO;10;0
001203;23102;02;05;FAMILIAS DERIVADAS SERVICIO  APOYO A LOS ACOGIMIENTOS;NÚMERO;14;0
001203;23102;02;06;FAMILIAS DERIVADAS SERV.  APOYO RESIDENCIAL Y SOCIAL A MENORES;NÚMERO;10;9
001203;23102;02;12;BENEFICIARIOS AYUDAS ECONÓM. MENORES EN RIESGO  EXCLUSIÓN;NÚMERO;5;5
001203;23106;01;05;ENTREVISTAS REALIZADAS EN LAS UNIDADES DE TRABAJO SOCIAL DE ZONA;NÚMERO;4000;3150
001203;23106;01;04;UNIDADES FAMILIARES EN SEGUIMIENTO POR LAS UNIDADES DE TRABAJO  SOCIAL;NÚMERO;3700;4276
001203;23106;01;03;ENTREVISTAS REALIZADAS EN UNIDADES DE TRABAJO SOCIAL DE PRIMERA ATENCIÓN;NÚMERO;3800;2850
001203;23106;01;02;CASOS URGENTES ATENDIDOS EN UNIDADES DE TRABAJO SOCIAL;NÚMERO;50;48
001203;23106;01;01;PERSONAS ATENDIDAS EN UNIDADES DE TRABAJO SOCIAL DE  PRIMERA ATENCIÓN;NÚMERO;3500;2600
001203;23106;02;04;TRAMITACIÓN DE SOLICITUDES DE AYUDAS PARA TAXI;NÚMERO;1;0
001203;23106;02;03;PERSONAS DISCAPACITADAS BENEFICIARIAS DE AYUDAS ECONÓMICAS;NÚMERO;4;3
001203;23106;02;02;MEDIA DE HORAS MENSUALES DE AYUDA A DOMICILIO A DISCAPACITADOS;HORAS;25;30
001203;23106;02;01;PERSONAS CON DISCAPACIDAD USUARIAS DEL SERVICIO DE AYUDA A DOMICILIO (S.A.D.);NÚMERO;48;40
001203;23106;03;05;PARTICIPANTES EN PROYECTO DE HABILIDADES SOCIALES;NÚMERO;15;15
001203;23106;03;04;PROYECTO DE HABILIDADES SOCIALES;NÚMERO;1;1
001203;23106;03;03;PARTICIPANTES EN PROYECTO DE INTEGRACIÓN SOCIOLABORPARTICIPANTES EN PROYECTO DE INTEGRACIÓN SOCIOLABORAL;NÚMERO;320;320
001203;23106;03;02;PROYECTO DE INTEGRACIÓN SOCIOLABORAL  DISTRITAL;NÚMERO;1;1
001203;23106;03;01;PERCEPTORES DE  RENTA MÍNIMA DE INSERCIÓN;NÚMERO;54;105
001203;23106;04;03;PERSONAS SIN HOGAR BENEFICIARIAS DE AYUDAS ECONÓMICAS;NÚMERO;2;2
001203;23106;04;02;PERSONAS SIN HOGAR DERIVADAS A SERVICIOS DE ATENCIÓN SOCIAL ESPECIALIZADA;NÚMERO;8;12
001203;23106;04;01;PERSONAS SIN HOGAR ATENDIDAS;NÚMERO;14;15
001203;23301;01;11;INFORMES DE ENTORNO SOCIAL;NÚMERO;300;504
001203;23301;01;10;AYUDAS TÉCNICAS PARA LA MOVILIDAD;NÚMERO;25;97
001203;23301;01;09;BENEFICIARIOS DE AYUDAS PARA ADAPTACIONES GERIÁTRICAS;NÚMERO;7;10
001203;23301;01;08;BENEFICIARIAS AYUDAS ECONÓMICAS PARA NECESIDADES BÁSICAS;NÚMERO;4;7
001203;23301;01;07;PERSONAS MAYORES USUARIAS DEL SERVICIO DE TELEASISTENCIA;NÚMERO;5500;6012
001203;23301;01;06;PERSONAS MAYORES USUARIAS SERVICIO DE LAVANDERÍA A DOMILIO;NÚMERO;6;4
001203;23301;01;05;PERSONAS MAYORES USUARIAS SERVICIO DE COMIDA A DOMICILIO;NÚMERO;65;63
001203;23301;01;04;HORAS MENSUALES AYUDA A DOMICILIO PARA MAYORES POR DOMICILIO;HORAS;14;14
001203;23301;01;03;SOLICITUDES PRESTAC. SERV. AYUDA DOMICILIO PERSONAS MAYORES;NÚMERO;230;156
001203;23301;01;02;INDICE DE ATENCIÓN DOMICILIARIA A MAYORES DE 80 AÑOS;PORCENTAJE;86;88
001203;23301;01;01;PERSONAS MAYORES USUARIAS DEL SERVICIO DE AYUDA A DOMICILIO;NÚMERO;1100;1015
001203;23301;02;09;COMIDAS SERVIDAS COMEDORES DE LOS CENTROS DE MAYORES;NÚMERO;8000;19171
001203;23301;02;08;VOLUNTARIOS EN LOS CENTROS DE MAYORES;NÚMERO;80;85
001203;23301;02;07;PARTICIPANTES EN EXCURSIONES Y VISITAS SOCIO-CULTURALES;NÚMERO;980;1187
001203;23301;02;06;EXCURSIONES Y VISITAS SOCIO-CULTURALES REALIZADAS;NÚMERO;30;55
001203;23301;02;05;PARTICIPANTES EN TALLERES;NÚMERO;3300;4520
001203;23301;02;04;TALLERES DE ACTIVIDADES REALIZADOS;HORAS;6500;9563
001203;23301;02;03;GRADO DE UTILIZACIÓN DE LOS CENTROS DE MAYORES;PORCENTAJE;50;50
001203;23301;02;02;SOCIOS DE LOS CENTROS DE MAYORES;NÚMERO;10550;11839
001203;23301;02;01;CENTROS DE MAYORES DEL DISTRITO;NÚMERO;2;2
001203;23301;03;01;PARTICIPANTES EN LOS GRUPOS CUIDANDO AL CUIDADOR;NÚMERO;20;25
001203;23301;03;02;SESIONES GRUPALES DE LOS GRUPOS CUIDANDO AL CUIDADOR;HORAS;45;48
001203;23301;03;03;USUARIOS ACOGIDOS PROG. 'RESPIRO FAMILIAR'  FINES DE SEMANA;NÚMERO;5;7
001203;23301;03;04;MAYORES CON APOYO PSICOLÓGICO;NÚMERO;9;9
001203;23301;04;01;USUARIOS PLAZAS CENTROS DE ALZHEIMER O DETERIORO COGNITIVO;NÚMERO;118;120
001203;23301;04;02;USUARIOS CENT. DÍA P. MAYORES DETERIORO FUNCIONAL O FÍSICO;NÚMERO;110;110
001203;23301;05;01;PLAZAS SOLICITADAS EN PISOS TUTELADOS;NÚMERO;6;2
001203;23301;05;02;PLAZAS SOLICITUDAS RESIDENCIAS PÚBLICAS COMUNIDAD DE MADRID;NÚMERO;60;67
001203;23301;05;03;BENEFICIARIOS AYUDAS ECONÓMICAS ALOJAMIENTOS ALTERNATIVOS;NÚMERO;2;0
001203;31401;01;01;INSPECCIONES EN MATERIA DE RESTAURACIÓN COLECTIVA;NÚMERO;400;395
001203;31401;01;02;INSPECCIONES EN MATERIA DE COMERCIO MINORISTA;NÚMERO;435;605
001203;31401;01;03;AUDITORIAS DE SISTEMAS DE AUTOCONTROL  (PCH Y APPCC);NÚMERO;6;5
001203;31401;01;04;EFICACIA OPERATIVA INSPECCIONES SEGURIDAD ALIMENTARIA;PORCENTAJE;100;136
001203;31401;01;05;MUESTRAS DE ALIMENTOS Y BEBIDAS;NÚMERO;80;80
001203;31401;01;06;EFICACIA OPERATIVA TOMA MUESTRAS ALIMENTOS Y BEBIDAS;PORCENTAJE;100;100
001203;31401;01;07;EFICACIA OPERATAIVA INSPECCIONES DENUNCIAS BROTES ALERTAS TIPO I Y TIPO II;PORCENTAJE;100;100
001203;31401;01;08;INFORMES SANITARIOS LICENCIAS REGISTROS AUTORIZACIONES;NÚMERO;15;39
001203;31401;01;09;CONTROL DE LA CORRECCIÓN DE DEFICIENCIAS DETECTADAS EN LOS ESTABLECIMIENTOS CON BROTE DE ORIGEN;PORCENTAJE;100;100
001203;31401;02;01;INSPECCIONES EN MATERIA DE CONSUMO NO ALIMENTARIO;NÚMERO;350;552
001203;31401;02;02;EFICACIA OPERATIVA INSPECCIONES CONSUMO NO ALIMENTARIO;PORCENTAJE;80;158
001203;31401;02;03;EFICACIA OPERATIVA INSPECCIONES DENUNCIAS ALERTAS;PORCENTAJE;100;100
001203;31401;03;01;RECLAMACIONES QUE SON TRAMITADAS PLAZO MAX 2 MESES;PORCENTAJE;85;87
001203;31401;03;02;INFORMACION AL CONSUMIDOR DE LA DERIVACIÓN DE SUS EXPTE A OTRO ORGANO COMPETENTE POR RESOLVER;PORCENTAJE;100;100
001203;31401;03;03;MEDIACIÓN EN LOS CONFLICTOS ENTRE CONSUMIDORES Y EMPRESARIOS Y PROFESIONALES PROPICIANDO LA RESOLUCIÓN VOLUNTARIA DE LOS;PORCENTAJE;30;32
001203;31401;03;04;ESTABLECIMIENTOS QUE HAN GESTIONADO HOJAS DE RECLAMACIONES;NÚMERO;140;206
001203;31401;03;05;INFORMES CONSUMO CON MOTIVO DE TRAMITACIÓN DE EXPTES;NÚMERO;2;2
001203;31401;04;01;INSPECCIONES EN PISCINAS;NÚMERO;100;122
001203;31401;04;08;EFICACIA OPERATIVA INSPECC. ESTETICA / BELLEZA ADORNO CORPOR.;PORCENTAJE;100;100
001203;31401;04;07;EFICACIA OPERATIVA INSPECC. ESCUELAS, CUIDADO / RECREO INTANT.;PORCENTAJE;100;139
001203;31401;04;06;INSPECCIONES ESCUELAS Y CUIDADO / RECREO INFANTILES Y ESTABLECIMIENTOS ESTETICA BELLEZA;NÚMERO;95;132
001203;31401;04;05;COMUNICACIÓN APERTURA TEMPORADA DE PISCINAS;NÚMERO;89;89
001203;31401;04;04;EFICACIA OPERATIVA TOMA DE MUESTRAS DE AGUA EN PISCINAS;PORCENTAJE;100;120
001203;31401;04;03;TOMA DE MUESTRAS DE AGUA EN PISCINAS;NÚMERO;10;12
001203;31401;04;02;EFICACIA OPERATIVA DE LAS INSPECCIONES EN PISCINAS;PORCENTAJE;100;122
001203;31401;05;04;DENUNCIAS TENENCIA ANIMALES Y PROTECCIÓN ANIMAL E INFORMES PROTECC ANIMAL. MOV.PECUARIO;NÚMERO;62;56
001203;31401;05;03;EFICACIA OPERATIVA INSPECCIONES PROTECCIÓN ANIMAL;PORCENTAJE;100;200
001203;31401;05;02;INSPECCIONES PROTECCIÓN ANIMAL;NÚMERO;4;8
001203;31401;05;01;CAMPAÑAS, OBSERVACIONES Y LICENCIAS;NÚMERO;500;705
001203;31401;06;01;PROPUESTA INICIO EXPTES SANCIONADOR SALUD PÚBLICA;NÚMERO;80;46
001203;31401;06;02;PROPUESTAS INICIO EXPTES SANCIONADOR CONSUMO;NÚMERO;20;29
001203;31401;06;03;MEDIDAS CAUTELARES Y PROVISIONALES ADOPTADAS;NÚMERO;10;1
001203;32101;01;01;COLEGIOS HAN REALIZADO ACTIVIDADES EXTRAESCOLARES;NÚMERO;2;2
001203;32101;01;02;ACTIVIDADES EXTRAESCOLARES REALIZADAS CENTROS EDUCATIVOS;NÚMERO;13;13
001203;32101;01;03;ESCOLARES PARTICIPANTES EN LAS ACTIVIDADES EXTRAESCOLARES;NÚMERO;325;325
