CeGe;Prog. Finan.;Objetivo;Indicador;Descripción Indicador;Unidad de medida;Presupuestado;Realizado
001209;33401;02;03;HORAS DE CURSOS ACTIV SOCIOCULTURALES Y RECREATIVAS;HORAS;17080;17228
001209;33401;02;04;MEDIA TRIMESTRAL ASISTENTES CURSOS DE ACTV SOCIOC Y RECR;NÚMERO;3913;3015
001209;33401;02;05;MEDIA TRIMESTRAL ASISTENTES CURSO DE ACTIV SOCIOC Y RECR;RATIO;20;16
001209;33401;02;06;ASISTENCIA POBLACIÓN DEL DTO CURSOS ACTIV SOCIOC Y RECR;RATIO;33;26
001209;33401;02;07;SUFICIENCIA PLAZAS DE CURSOS DE ACTIVIDADES OFERTADAS;PORCENTAJE;74;62
001209;33401;03;01;FIESTAS POPULARES CELEBRADAS;NÚMERO;3;3
001209;33401;03;02;FESTEJOS REALIZADOS COLABORACIÓN CON ASOCIAC VECINALES;NÚMERO;2;1
001209;34101;01;15;UNIDADES DEPORTIVAS POR HABITANTE DEL DISTRITO;RATIO;2;3
001209;34101;01;16;NIVEL DE OCUPACIÓN DE LAS UNIDADES DEPORTIVAS DE LOS CENTROS DEPORTIVOS;PORCENTAJE;89;80
001209;34101;01;17;NIVEL DE OCUPACIÓN DE LAS UNIDASDES DEPORTIVAS DE LAS INSTALACIONES DEPORTIVAS BÁSICAS CON ACCESO CONTROLADO;PORCENTAJE;100;100
001209;34101;01;18;MEDIA SEMANAL DE HORAS DE APERTURA EN CENTROS DEPORTIVOS;RATIO;76;76
001209;34101;01;19;RECLAMACIONES Y QUEJAS RECIBIDAS REFERIDAS A LOS SERVICIOS DEPORTIVOS DEL DISTRITO;NÚMERO;400;497
001209;34101;01;06;SUPERFICIE DE CENTROS DEPORTIVOS;M2;182725;182725
001209;34101;01;05;INSTALACIONES DEPORGIVAS BÁSICAS SIN CONTROL DE ACCESO;NÚMERO;22;22
001209;34101;01;04;INSTALACIONES DEPORTIVAS BÁSICAS CON CONTROL DE ACCESO;NÚMERO;1;1
001209;34101;01;03;Nº DE CALLES DE LAS PISCINAS CUBIERTAS;NÚMERO;26;26
001209;34101;01;02;PISCINAS CUBIERTAS;NÚMERO;4;4
001209;34101;01;01;CENTROS DEPORTIVOS MUNICIPALES;NÚMERO;9;9
001209;34101;01;08;SUPERFICIE DE INSTALACIONES DEPORGIVAS BÁSICAS DE ACCESO LIBRE;M2;29182;29182
001209;34101;01;07;SUPERFICIE D EINSTALACIONES DEPORTIVAS BÁSICAS CON ACCESO CONTROLADO;M2;5760;5760
001209;34101;01;14;UNIDADES DEPORTIVAS TOTALES;NÚMERO;59;59
001209;34101;01;13;UNIDADES DEPORTIVAS DE INSTALACIONES DEPORTIVAS BÁSICAS SIN CONTROL DE ACCESO;NÚMERO;22;22
001209;34101;01;12;UNIDADES DEPORTIVAS DE INSTALACIONES DEPORTIVAS BÁSICAS CON CONTROL DE ACCESO;NÚMERO;1;1
001209;34101;01;11;UNIDADES DEPORTIVAS DE CENTROS DEPORTIVOS;NÚMERO;36;36
001209;34101;01;10;METROS CUADRADOS DE INSTALACIONES DEPORTIVAS POR HABITANTE DEL DISTRITO;RATIO;18;18
001209;34101;01;09;TOTAL SUPERFICIE DE INSTALACIONES DEPORTIVAS;M2;217667;217667
001209;34101;02;09;MEDIA MENSUAL DE OCUPACIÓN DE LAS PLAZAS CLASES DE ACTIVIDADES DEPORTIVAS PARA MAYORES;PORCENTAJE;80;71
001209;34101;02;10;MEDIA MENSUAL DE OCUPACIÓN DE LAS PLAZAS CLASES DE ACTIVIDADES DEPORTIVAS PARA PERSONAS CON DISCAPACIDAD;PORCENTAJE;90;81
001209;34101;02;11;MEDIA MENSUAL DE PARTICIPANTES EN LAS ACTIVIDADES FÍSICO DEPORTIVAS INFANTILES;RATIO;2185;1988
001209;34101;02;12;MEDIA MENSUAL DE PARTICIPANTES EN LAS ACTIVIDADES FÍSICO DEPORTIVAS PARA JÓVENES;RATIO;1080;983
001209;34101;02;13;MEDIA MENSUAL DE PARTICIPANTES EN LAS ACTIVIDADES FÍSICO DEPORTIVAS PARA ADULTOS;RATIO;8000;7280
001209;34101;02;01;MEDIA MENSUAL DE PLAZAS OFERTADAS PARA EDAD INFANTIL;NÚMERO;2300;2300
001209;34101;02;02;MEDIA MENSUAL DE PLAZAS OFERTADAS PARA JÓVENES;NÚMERO;1200;1200
001209;34101;02;03;MEDIA MENSUAL DE PLAZAS OFERTADAS PARA EDAD ADULTOS;NÚMERO;10000;10000
001209;34101;02;04;MEDIA MENSUAL DE PLAZAS OFERTADAS PARA MAYORES;NÚMERO;900;900
001209;34101;02;05;MEDIA MENSUAL DE PLAZAS OFERTADAS PARA PERSONAS CON DISCAPACIDAD;NÚMERO;150;150
001209;34101;02;06;MEDIA MENSUAL DE OCUPACION DE LAS PLAZAS CLASES DE ACTIVIDADES DEPORTIVAS INFANTILES;PORCENTAJE;95;86
001209;34101;02;07;MEDIA MENSUAL DE OCUPACIÓN DE LAS PLAZAS CLASES DE ACTIVIDADES DEPORTIVAS PARA JÓVENES;PORCENTAJE;90;81
001209;34101;02;08;MEDIA MENSUAL DE OCUPACIÓN DE LAS PLAZAS CLASES DE ACTIVIDADES DEPORTIVAS PARA ADULTOS;PORCENTAJE;82;73
001209;34101;02;14;MEDIA MENSUAL DE PARTICIPANTES EN LAS ACTIVIDADES FÍSICO DEPORTIVAS PARA MAYORES;RATIO;702;639
001209;34101;02;15;MEDIA MENSUAL DE PARTICIPANTES EN LAS ACTIVIDADES FÍSICO DEPORTIVAS PARA PERSONAS CON DISCAPACIDAD;RATIO;135;123
001209;34101;02;16;HORAS ANUALES DE PROFESORES DE ACTIVIDADES DEPORTIVAS;HORAS;120150;120150
001209;34101;02;17;UNIDADES DEPORTIVAS UTILIZADAS POR ENTIDADES DEPORTIVAS FEDERADAS;NÚMERO;5;5
001209;34101;02;18;ENTIDADES DEPORTIVAS FEDERADAS QUE HAN UTILIZADO LAS UNIDADES DEPORTIVAS;NÚMERO;8;8
001209;34101;02;19;UNIDADES DE SERVICIOS DE MEDICINA DEPORTIVA;NÚMERO;1;1
001209;34101;03;01;COMPETICIONES Y TORNEOS DEPORTIVOS MUNICIPALES PARA LA PROMOCIÓN DEL DEPORTE;NÚMERO;14;14
001209;34101;03;02;EQUIPOS PARTICIPANTES EN COMPETICIONES Y TORNEOS DEPORTIVOS MUNICIPALES;NÚMERO;390;390
001209;34101;03;03;PARTICIPANTES EN COMPETICIONES Y TORNEOS DEPORTIVOS MUNICIPALES;NÚMERO;14800;14800
001209;34101;03;04;PARTICIPANTES EN COMPETICIONES Y TORNEOS/POBLACIÓN DISTRITO;RATIO;925;925
001209;34101;04;01;SUPERFICIE DE INSTALACIONES DEPORTIVAS A MANTENER;M2;217667;257920
001209;34101;04;02;SUPERFICIE DE INSTALACIONES DEPORTIVAS A REFORMAR;M2;10883;3000
001209;34101;04;03;INCIDENCIA DE LAS OBRAS DE REFORMA EN LAS INSTALACIONES DEPORTIVAS;PORCENTAJE;5;100
001209;43110;01;01;PUBLICACIONES INFORMATIVAS Y DIVULGATIVAS;NÚMERO;1;1
001209;43110;01;03;ESTABLECIMIENTOS A LOS QUE SE DIRIGEN LAS CAMPAÑAS;NÚMERO;250;250
001209;43110;01;02;CAMPAÑAS DE PROMOCIÓN;NÚMERO;1;1
001209;92001;01;06;TIEMPO MEDIO TRAMITACIÓN CONTRATOS PROCEDIMIENTO CONCURSO O SUBASTA;DÍAS;150;102
001209;92001;01;05;TIEMPO MEDIO TRAMITACIÓN CONTRATOS PROCEDIMIENTO NEGOCIADO;DÍAS;120;81
001209;92001;01;04;CONTRATOS MENORES TRAMITADOS;NÚMERO;300;267
001209;92001;01;03;CONTRATOS TRAMITADOS POR CONCURSO O SUBASTA;NÚMERO;15;16
001209;92001;01;02;CONTRATOS TRAMITADOS POR PROCEDIMIENTO NEGOCIADO;NÚMERO;11;6
001209;92001;01;01;CONTRATOS TRAMITADOS;NÚMERO;326;289
001209;92001;02;02;DOCUMENTOS CONTABLES REALIZADOS;NÚMERO;3500;3431
001209;92001;02;01;LIQUIDACIONES EMITIDAS;NÚMERO;400;1324
001209;92001;03;06;PROPUESTAS DE ACUERDO ACTIVIDADES AL PLENO;NÚMERO;1;2
001209;92001;03;05;PROPUESTAS DE ACUERDO JUNTA DE DISTRITO;NÚMERO;36;3
001209;92001;03;04;ASUNTOS ELEVADOS AL CONSEJO TERRITORIAL;NÚMERO;4;4
001209;92001;03;03;PROPUESTAS DE RESOLUCIÓN ELEVADAS AL GERENTE;NÚMERO;1650;1790
001209;92001;03;02;PROPUESTAS DE DECRETO ELEVADAS AL CONCEJAL;NÚMERO;2775;2920
001209;92001;03;01;PROPUESTAS DE ACUERDO ELEVADAS A JUNTA DE GOBIERNO;NÚMERO;10;4
001209;92001;04;14;TIEMPO MEDIO EN LA RESOLUCIÓN DE LICENCIAS URBANÍSTICAS;DÍAS;55;50
001209;92001;04;13;AUTORIZACIONES DE OCUPACIÓN DEL DOMINIO PÚBLICO RESUELTAS;NÚMERO;480;490
001209;92001;04;12;AUTORIZACIONES DE OCUPACIÓN DEL DOMINIO PÚBLICO SOLICITADAS;NÚMERO;500;520
001209;92001;04;11;ACTIVIDAD DE LA UNIDAD DE ASISTENCIA PERSONALIZADA;PORCENTAJE;4;0
001209;92001;04;10;LICENCIAS URBANÍSTICAS RESUELTAS;NÚMERO;414;294
001209;92001;04;09;LICENCIAS URBANÍSTICAS POR PROCEDIMIENTO ORDINARIO COMÚN RESUELTAS;NÚMERO;60;34
001209;92001;04;08;LICENCIAS URBANÍSTICAS POR PROCEDIMIENTO ORDINARIO ABREVIADO RESUELTAS;NÚMERO;80;50
001209;92001;04;07;LICENCIAS URBANÍSTICAS POR PROCEDIMIENTO SIMPLIFICADO RESUELTAS;NÚMERO;4;0
001209;92001;04;06;LICENCIAS URBANÍSTICAS POR ACTUACIÓN COMUNICADA RESULETAS;NÚMERO;270;222
001209;92001;04;05;LICENCIAS URBANÍSTICAS SOLICITADAS;NÚMERO;474;972
001209;92001;04;04;LICENCIAS URBANÍSTICAS POR PROCEDIMIENTO ORDINARIO COMÚN SOLICITADAS;NÚMERO;70;45
001209;92001;04;03;LICENCIAS URBANÍSTICAS POR PROCEDIMIENTO ORDINARIO ABREVIADO SOLICITADA;NÚMERO;100;109
001209;92001;04;02;LICENCIAS URBANÍSTICAS POR PROCEDIMIENTO SIMPLIFICADO SOLICITADAS;NÚMERO;4;0
001209;92001;04;01;LICENCIAS URBANÍSTICAS SOLICITADAS POR ACTUACIÓN COMUNICADA;NÚMERO;300;164
001209;92001;05;02;VOLANTES DE EMPADRONAMIENTO EMITIDOS;NÚMERO;63000;56232
001209;92001;05;01;CIUDADANOS ATENDIDOS;NÚMERO;65000;44691
001209;92001;05;06;MODIFICACIONES EN EL PADRÓN;NÚMERO;14200;11697
001209;92001;05;03;CERTIFICADOS DE EMPADRONAMIENTO EMITIDOS;NÚMERO;7100;4817
001209;92001;05;04;ALTAS EN EL PADRÓN TRAMITADAS;NÚMERO;9600;8635
001209;92001;05;05;BAJAS EN EL PADRÓN TRAMITADAS;NÚMERO;300;222
001209;92001;06;04;EXPEDIENTES DE DISCIPLINA URBANÍSTICA INICIADOS;NÚMERO;225;526
001209;92001;06;03;EXPEDIENTES SANCIONADORES RESUELTOS;NÚMERO;300;20
001209;92001;06;02;RELACIÓN INSPECCIONES URBANÍSTICAS DE OFICIO/INSPECCIONES A SOLICITUD CIUDADANA;PORCENTAJE;1;2
001209;92001;06;01;INSPECCIONES URBANÍSTICAS REALIZADAS;NÚMERO;750;600
001209;92001;07;04;ANOTACIONES EN EL REGISTRO;NÚMERO;34500;27659
001209;92001;07;03;TIEMPO MEDIO ESPERA;MINUTOS;4;4
001209;92001;07;02;TIEMPO MEDIO ATENCIÓN;MINUTOS;5;5
001209;92001;07;01;PERSONAS ATENDIDAS;NÚMERO;113200;99139
001209;92401;01;01;REUNIONES  DEL CONSEJO  TERRITORIAL DEL DISTRITO;NÚMERO;1;6
001209;92401;01;02;ASISTENCIA MEDIA MIEMBROS CONSEJO TERRITORIAL A REUNIONES;RATIO;15;13
001209;92401;01;03;ASISTENCIA MEDIA VECINOS REUNIONES DEL CONSEJO TERRITORIAL;RATIO;2;2
001209;92401;01;04;REUNIONES DE COMISIONES PERMANENTES DEL CONS TERRITORIAL;NÚMERO;4;3
001209;92401;01;05;ASISTENCIA MEDIA MIEMBROS A REUNIONES COMIS PERMANENTES;RATIO;5;2
001209;92401;01;06;ASISTEMCIA MEDIA VECINOS/AS REUNIONES COMIS PERMANENTES;RATIO;1;2
001209;92401;02;01;ASOCIACIONES INSCRITAS REGISTRO ENTID CIUD CON DOMICILIO DISTRITO;NÚMERO;72;103
001209;92401;02;02;SUBVENCIONES SOLICITADAS AASOC DECLARADAS UTILIDAD PÚBLICA;NÚMERO;47;34
001209;92401;02;03;SUBVENCIONES CONCEDIDAS ASOC DECLARADAS UTILIDAD PÚBLICA;NÚMERO;37;28
001209;92401;02;04;SUBVENCIONES CONCEDIDAS/SUBVENCIONES SOLICITADAS;PORCENTAJE;79;82
001209;92401;02;05;ASOCIACIONES Y ENTIDADES SUBVENCIONADAS;NÚMERO;24;24
001209;92401;02;06;POBLACIÓN DEL DISTRITO/ASOCIACIONES;RATIO;4;10
001209;93302;01;01;EDIFICIOS CON MANTENIMIENTO A CARGO DEL DISTRITO;NÚMERO;22;22
001209;93302;01;02;SUPERFICIE  CONSTRUIDA EDIFICIOS MANTENIMIENTO CARGO DISTRITO;M2;30588;28540
001209;93302;01;03;SUPERFICIE  LIBRE EDIFICIOS MANTENIMIENTO CARGO DEL DISTRITO;M2;4933;4933
001209;93302;01;04;INSTALACIONES ELEVACIÓN Y ELECTROMECÁNICAS MTO CARGO DTO;NÚMERO;22;10
001209;93302;02;01;PLANES DE AUTOPROTECCIÓN IMPLANTADOS;NÚMERO;39;31
001209;93302;02;02;EDIF. PLANES AUTOPR. IMPLANTADOS SOBRE TOTAL EDIFICIOS;PORCENTAJE;100;5
001209;93302;02;03;EDIF. REFORMADOS SOBRE TOTAL MANTENIMIENTO CARGO DTO;PORCENTAJE;8;30
001209;93302;02;08;INCIDENCIA OBRAS ADAPTACIÓN NORMATIVA DE INCENDIO;PORCENTAJE;1;5
001209;93302;02;07;EDIF. MUNICIPALES DONDE REALIZAN OBRAS ADAPTACIÓN NORMATIVA;NÚMERO;1;1
001209;93302;02;06;EDIF. MUNICIPALES ADAPTADOS TOTALMENTE NORMAT INCENDIOS;PORCENTAJE;80;5
001209;93302;02;05;EDIF. MUNICIPALES ADAPTADOS PARCIALMENTE NORMAT INCENDIO;PORCENTAJE;20;25
001209;93302;02;04;SUPERF EDIF REFORMAR SOBRE TOTAL MANTENIM CARGO DTO;PORCENTAJE;5;25
001210;15502;01;03;INTERVENCIONES A REALIZAR POR ACONTECIMIENTOS A CELEBRAR;NÚMERO;1;1
001210;15502;01;02;SITUADOS Y QUIOSCOS A TRASLADAR;NÚMERO;1;0
001210;15502;01;01;OBRAS A REALIZAR EN VIAS PUBLICAS CON CARGO A PARTICULARES;NÚMERO;25;18
001210;23102;01;08;BENEFICIARIOS DE AYUDAS ECONÓMICAS PARA COMEDOR ESCOLAR;NÚMERO;50;166
001210;23102;01;07;BENEFICIARIOS DE AYUDAS ECONÓMICAS PARA ESCUELAS INFANTILES;NÚMERO;55;33
001210;23102;01;06;BENEFICIARIOS DE AYUDAS ECONÓMICAS PARA NECESIDADES BÁSICAS;NÚMERO;65;65
001210;23102;01;05;HORAS MENSUALES DE AYUDA A DOMICILIO;RATIO;18;18
001210;23102;01;04;USUARIOS DE AYUDA A DOMICILIO PARA MENORES Y FAMILIA;NÚMERO;85;85
001210;23102;01;03;MENORES ATENDIDOS EN CENTROS DE DÍA;NÚMERO;25;25
001210;23102;01;02;HORAS DE ATENCIÓN EN LUDOTECAS;HORAS;120;120
001210;23102;01;01;MENORES ATENDIDOS EN LUDOTECAS;NÚMERO;30;30
001210;23102;02;01;FAMILIAS DERIVADAS A CENTROS DE ATENCIÓN A LA INFANCIA;NÚMERO;100;133
001210;23102;02;02;MENORES VALORADOS  EQUIPOS DE TRABAJO MENORES/FAMILIA;NÚMERO;180;250
001210;23102;02;03;REUNIONES EQUIPOS TÉCNICOS DE MENORES Y FAMILIA;NÚMERO;48;66
001210;23102;02;04;FAMILIAS DERIVADAS AL SERVICIO DE IMPLICACIÓN FAMILIAR;HORAS;75;80
001210;23102;02;05;FAMILIAS DERIVADAS AL SERVICIO DE APOYO A LOS ACOGIMIENTOS;NÚMERO;30;35
001210;23102;02;06;FAMILIAS DERIVADAS SERV. APOYO RESIDENCIAL Y SOCIAL A MENORES;NÚMERO;15;15
001210;23102;02;07;MENORES ATENDIDOS PROG. APOYO EMPLEO RIESGO EXCLUSIÓN SOC.;NÚMERO;25;25
001210;23102;02;08;ADOLESCENTES ATENDIDOS PROG.APOYO/ SIGUIMIENTO SOCIOEDUC.;NÚMERO;60;65
001210;23102;02;09;MENORES Y ADOLESCENTES ATENDIDOS SERVICIO EDUCACIÓN SOCIAL;NÚMERO;60;65
001210;23102;02;10;MENORES ABSENTISTAS EN SEGUIMIENTO;HORAS;30;30
001210;23102;02;11;BENEFICIARIOS AYUDAS ECONÓMICAS MENORES RIESGO EXCLUSIÓN;NÚMERO;50;80
001210;23106;01;01;PERSONAS ATENDIDAS UNIDADES TRABAJO SOCIAL PRIMERA ATENCIÓN;NÚMERO;10000;11150
001210;23106;01;02;CASOS URGENTES ATENDIDOS UNIDADES TRABAJO SOCIAL;NÚMERO;200;210
001210;23106;01;03;ENTREVISTAS REALIZADAS EN U.T.S. PRIMERA ATENCIÓN;NÚMERO;12500;22300
001210;23106;01;04;UNIDADES FAMILIARES EN SEGUIMIENTO POR UNIDADES DE TRABAJO;NÚMERO;16000;16967
001210;23106;01;05;ENTREVISTAS REALIZADAS EN UNIDADES DE TRABAJO SOCIAL DE ZONA;NÚMERO;30000;31931
001210;23106;02;01;PERSONAS CON DISCAPACIDAD USUARIAS SERVICIO AYUDA DOMICILIO;NÚMERO;300;106
001210;23106;02;02;MEDIA DE HORAS MENSUALES AYUDA A DOMICILIO A DISCAPACITADOS;HORAS/PERSONA;25;25
001210;23106;02;03;PERSONAS DISCAPACITADAS BENEFICIARIAS DE AYUDAS ECONOMICAS;NÚMERO;10;13
001210;23106;02;04;TRAMITACIÓN SOLICITUDES PLAZAS CENTROS DE DISCAPACITADOS;NÚMERO;30;35
001210;23106;02;05;TRAMITACIÓN DE SOLICITUDES DE AYUDAS PARA TAXI;NÚMERO;15;0
001210;23106;03;01;PERCEPTORES DE RENTA MÍNIMA DE INSERCIÓN;NÚMERO;800;483
001210;23106;03;02;PROYECTOS INTEGRACIÓN SOCIOLABORAL DE R.M.I.;NÚMERO;5;3
001210;23106;03;03;PARTICIPANTES PROYECTOS INTEGRACIÓN R.M.I.;NÚMERO;250;102
001210;23106;04;01;PERSONAS SIN HOGAR ATENDIDAS;NÚMERO;100;120
001210;23106;04;02;PERSONAS SIN HOGAR DERIVADAS A SERV. ATENCIÓN SOCIAL ESPECIAL;NÚMERO;100;120
001210;23106;04;03;PERSONAS SIN HOGAR BENEFICIARIAS DE AYUDAS ECONÓMICAS;NÚMERO;10;15
001210;23301;01;01;PERSONAS MAYORES USUARIAS DEL SERVICIO DE AYUDA A DOMICILIO;NÚMERO;3000;2300
001210;23301;01;09;BENEFICIARIOS DE AYUDAS PARA ADAPTACIONES GERIÁTRICAS;NÚMERO;10;4
001210;23301;01;10;AYUDAS TÉCNICAS PARA LA MOVILIDAD;NÚMERO;12;6
001210;23301;01;06;PERSONAS MAYORES USUARIAS DEL SERVICIO LAVANDERÍA A DOMICILIO;NÚMERO;10;10
001210;23301;01;07;PERSONAS MAYORES USUARIAS DEL SERVICIO DE TELEASISTENCIA;NÚMERO;10000;12324
001210;23301;01;08;BENEFICIARIOS AYUDAS ECONÓMICAS PARA NECESIDADES BÁSICAS;NÚMERO;90;350
001210;23301;01;02;ÍNDICE DE ATENCIÓN DOMICILIARIA A MAYORES DE 80 AÑOS;PORCENTAJE;10;10
001210;23301;01;03;SOLIC. PREST. SERVICIO AYUDA A DOMICILIO PARA PERSONAS MAYORES;NÚMERO;1200;1200
001210;23301;01;04;HORAS MENSUALES AYUDA DOMICILIO PARA MAYORES POR DOMICILIO;HORAS;16;16
001210;23301;01;05;PERSONAS MAYORES USUARIAS SERVICIO DE COMIDA A DOMICILIO;NÚMERO;180;203
001210;23301;02;04;TALLERES DE ACTIVIDADES REALIZADOS;HORAS;13000;13000
001210;23301;02;05;PARTICIPANTES EN TALLERES;NÚMERO;7500;7500
001210;23301;02;06;VOLUNTARIOS EN LOS CENTROS DE MAYORES;NÚMERO;30;30
001210;23301;02;07;COMIDAS SERVIDAS EN COMEDORES DE CENTROS DE MAYORES;NÚMERO;600;600
001210;23301;02;01;CENTROS DE MAYORES DEL DISTRITO;NÚMERO;4;4
001210;23301;02;02;SOCIOS DE LOS CENTROS DE MAYORES;NÚMERO;22000;21618
001210;23301;02;03;GRADO DE UTILIZACIÓN DE LOS CENTROS DE MAYORES;PORCENTAJE;80;80
001210;23301;03;01;PARTICIPANTES DE LOS GRUPOS 'CUIDANDO AL CUIDADOR';NÚMERO;80;26
001210;23301;03;02;SESIONES GRUPALES DE LOS GRUPOS 'CUIDANDO AL CUIDADOR';HORAS;40;20
001210;23301;03;03;USUARIOS DEL PROGRAMA 'RESPIRO FAMILIAR' LOS FINES DE SEMANA;NÚMERO;20;0
001210;23301;03;04;MAYORES CON APOYO PSICOLÓGICO;NÚMERO;9;8
001210;23301;04;01;USUARIOS PLAZAS CENTROS DE ALZHEIMER O DETERIORO COGNITIVO;NÚMERO;311;190
001210;23301;04;02;USUARIOS CENTRO DÍA MAYORES  DETERIORO FUNCIONAL O FISICO;NÚMERO;180;170
001210;23301;05;01;PLAZAS SOLICITADAS EN PISOS TUTELADOS;NÚMERO;100;20
001210;23301;05;03;BENEFICIARIOS  AYUDAS ECONÓMICAS ALOJAMIENTOS ALTERNATIVOS;NÚMERO;16;0
001210;23301;05;02;PLAZAS SOLICITADAS PARA RESIDENCIAS PÚBLICAS DE LA COMUNIDAD;NÚMERO;150;198
001210;31401;01;02;INSPECCIONES EN MATERIA DE COMERCIO MINORISTA;NÚMERO;300;391
001210;31401;01;01;INSPECCIONES EN MATERIA DE RESTAURACIÓN COLECTIVA;NÚMERO;460;601
001210;31401;01;03;AUDITORIAS DE SISTEMAS DE AUTOCONTROL (PCH Y APPCC);NÚMERO;10;6
001210;31401;01;04;EFICACIA OPERATIVA INSPECCIONES SEGURIDAD ALIMENTARIA;PORCENTAJE;100;129
001210;31401;01;05;TOMA DE MUESTRAS DE ALIMENTOS Y BEBIDAS;NÚMERO;90;47
001210;31401;01;06;EFICACIA OPERATIVA TOMA DE MUESTRAS ALIMENTOS Y BEBIDAS;PORCENTAJE;80;52
001210;31401;01;07;EFICACIA OPERATIVA INSPECCIONES  DENUNCIAS BROTES ALERTAS;PORCENTAJE;100;100
001210;31401;01;08;INFORMES SANITARIOS EN LICENCIAS URBANÍSTICAS;NÚMERO;105;55
001210;31401;01;09;CONTROL CORRECCIÓN DE DEFICIENCIAS DETECTADAS;PORCENTAJE;90;100
001210;31401;02;01;INSPECCIONES EN MATERIA DE CONSUMO NO ALIMENTARIO;NÚMERO;450;530
001210;31401;02;02;EFICACIA OPERATIVA INSPECCIONES CONSUMO NO ALIMENTARIO;PORCENTAJE;100;118
001210;31401;02;03;EFICACIA OPERATIVA INSPECCIONES DENUNCIAS ALERTAS;PORCENTAJE;100;100
001210;31401;03;05;INFORMES CONSUMO CON MOTIVO DE TRAMITACIÓN DE EXPTES.;NÚMERO;1615;1480
001210;31401;03;04;ESTABLECIMIENTOS QUE HAN GESTIONADO HOJAS DE RECLAMACIONES;NÚMERO;400;298
001210;31401;03;03;MEDIACIÓN CONFLICTOS CONSUMIDORES/EMPRESARIOS;PORCENTAJE;80;85
001210;31401;03;02;INFORMACION AL CONSUMIDOR DE LA DERIVACIÓN DE SUS EXPTES.;PORCENTAJE;100;100
001210;31401;03;01;RECLAMACIONES TRAMITADAS PLAZO MAX 2 MESES;PORCENTAJE;75;80
001210;31401;04;08;EFICACIA OPERATIVA INSPECC. DENUNCIAS Y ALERTAS;PORCENTAJE;100;100
001210;31401;04;07;EFICACIA OPERATIVA INSPECC. ESCUELAS Y CUIDADO/RECREO INFANTILES Y EN ESTABLECIMIENTOS ESTETICA/BELLEZA Y ADORNO CORPOR;PORCENTAJE;100;105
001210;31401;04;06;INSPECCIONES ESCUELAS Y CUIDADO/RECREO INFANTILES Y EN ESTABLECIMIENTOS ESTETICA/BELLEZA Y ADORNO CORPORAL;NÚMERO;89;105
001210;31401;04;05;COMUNICACIÓN APERTURA TEMPORADA DE PISCINAS;NÚMERO;57;57
001210;31401;04;04;EFICACIA OPERATIVA TOMA DE MUESTRAS DE AGUA EN PISCINAS;PORCENTAJE;90;33
001210;31401;04;03;TOMA DE MUESTRAS DE AGUA EN PISCINAS;NÚMERO;15;5
001210;31401;04;02;EFICACIA OPERATIVA DE LAS INSPECCIONES EN PISCINAS;PORCENTAJE;100;280
001210;31401;04;01;INSPECCIONES EN PISCINAS;NÚMERO;20;56
001210;31401;05;04;DENUNCIAS TENENCIA ANIMALES Y PROTECCIÓN ANIMAL E INFORMES PROTECCIÓN ANIMAL. MOVIMIENTO PECUARIO;NÚMERO;81;43
001210;31401;05;03;EFICACIA OPERATIVA INSPECCIONES PROTECCIÓN ANIMAL;PORCENTAJE;100;100
001210;31401;05;02;INSPECCIONES PROTECCIÓN ANIMAL;NÚMERO;10;10
001210;31401;05;01;CAMPAÑAS, OBSERVACIONES Y LICENCIAS;NÚMERO;2427;2445
001210;31401;06;03;MEDIDAS CAUTELARES Y PROVISIONALES ADOPTADAS;NÚMERO;10;16
001210;31401;06;02;PROPUESTAS INICIO EXPTES SANCIONADOR CONSUMO;NÚMERO;50;14
001210;31401;06;01;PROPUESTAS INICIO EXPTES SANCIONADOR SALUD PUBLICA;NÚMERO;91;99
001210;32101;01;05;PARTICIPANTES EN ESCUELAS DE NAVIDAD;NÚMERO;70;94
001210;32101;01;04;PARTICIPANTES EN ESCUELAS DE VERANO;NÚMERO;200;592
001210;32101;01;03;ESCOLARES PARTICIPANTES EN LAS ACTIV. EXTRAESCOLARES;NÚMERO;2500;3751
001210;32101;01;02;ACTIVIDADES EXTRAESCOL. REALIZADAS EN CENTROS EDUCATIVOS;NÚMERO;200;258
001210;32101;01;01;COLEGIOS DONDE SE HAN REALIZADO ACTIVIDADES EXTRAESCOL;NÚMERO;20;20
001210;32101;02;14;COORDINACIÓN Y REUNIONES CON OTROS RECURSOS DEL DTO;NÚMERO;300;347
001210;32101;02;13;REUNIONES CON LOS CENTROS EDUCATIVOS;HORAS;220;431
001210;32101;02;12;ENTIDAD DENTRO DTO. COLABORAN PROGR. ABSENTISMO ESCOLAR;NÚMERO;20;25
001210;32101;02;11;COMPARECENCIAS;NÚMERO;160;137
001210;32101;02;10;ACOMPAÑAMIENTO A MENORES;NÚMERO;40;54
001210;32101;02;09;ENTREVISTAS MENORES;NÚMERO;250;381
001210;32101;02;08;ENTREVISTAS FAMILIARES;NÚMERO;350;551
001210;32101;02;07;VISITAS DOMICILIARIAS;NÚMERO;360;715
001210;32101;02;06;PREVALENCIA DE ABSENTISMO EN POBLACIÓN ESCOLAR DEL DISTRITO;RATIO;1;1
001210;32101;02;05;CASOS ACTIVOS SEGUIM. PROGR. PREVENCIÓN ABSENTISMO ESCOLAR;NÚMERO;190;192
001210;32101;02;04;ALUMNOS PARTICIPANTES EN LAS ACTIVIDADES PREVENTIVAS;NÚMERO;200;375
001210;32101;02;03;ACTIVIDADES PREVENTIVAS;NÚMERO;3;4
001210;32101;02;02;NÚMERO DE COMISIONES DE ABSENTISMO ESCOLAR;NÚMERO;8;8
001210;32101;02;01;CENTROS EDUCATIVOS REMITENTES DE PROTOCOLOS;NÚMERO;46;44
001210;32101;03;01;REUNIONES DE LA COMISIÓN DE ESCOLARIZACIÓN;NÚMERO;20;35
001210;32101;03;02;ALUMNOS ESCOLARIZADOS POR LAS COMISIONES ESCOLARIZACIÓN;NÚMERO;2500;2760
001210;32101;04;01;ESCUELAS INFANTILES TITULARIDAD MUNICIPAL GESTIÓN INDIRECTA;NÚMERO;4;4
001210;32101;04;02;REUNIONES CON LAS ESCUELAS INFANTILES MUNICIPALES;NÚMERO;40;47
001210;32101;04;03;ALUMNOS ESCOLARIZADOS POR ESCUELAS INFANTILES TITULARIDAD MUNICIPAL;NÚMERO;540;540
001210;32101;05;01;INFORMACIÓN Y ATENCIÓN INDIVIDUALIZADA Y COLECTIVA;NÚMERO;10000;10300
001210;32101;05;02;ASESORAMIENTO Y ORIENTACIÓN A LAS AMPAS;NÚMERO;110;125
001210;32101;06;01;CERTÁMENES, CONCURSOS Y PREMIOS CONVOCADOS;NÚMERO;2;3
001210;32101;06;02;ALUMNOS PARTICIP. EN CERTÁMENES Y CONCURSOS ARTÍSTICOS;NÚMERO;1800;8605
001210;32101;06;03;COLEGIOS PARTICIP. EN CERTÁMENES Y CONCURSOS ARTÍSTICOS;NÚMERO;14;29
001210;32101;07;01;COMISIONES DE PARTICIPACIÓN INFANTIL;NÚMERO;4;5
001210;32101;07;02;ENTIDADES PARTICIPANTES EN COMISIONES PARTIC. INFANTIL;NÚMERO;7;12
001210;32101;07;03;PARTICIPANTES EN LAS COMISIONES DE PARTICIPACION INFANTIL;NÚMERO;30;45
001210;32101;08;01;CENTROS EDUCATIVOS CON MANTENIMIENTO A CARGO DEL DISTRITO;NÚMERO;26;26
001210;32101;08;02;CENTROS EDUCATIVOS CON LIMPIEZA A CARGO DEL DISTRITO;NÚMERO;22;26
001210;32101;08;03;SUPERF. CONSTRUIDA C. EDUCATIVOS MANTENIMIENTO DISTRITO;M2;113462;113462
001210;32101;08;04;SUPERF. LIBRE DE C. EDUCATIVOS MANTENIMIENTO DISTRITO;M2;69846;69846
001210;32101;08;05;C. EDUCATIVOS ADAPTADOS PARCIALMENTE NORMATIVA INCENDIO;PORCENTAJE;100;100
001210;32101;08;06;C. EDUCATIVOS INFANTILES ADAPTADOS NORMATIVA INCENDIO;PORCENTAJE;81;81
001210;32101;08;07;C. EDUCATIVOS OBRAS DE ADAPTACIÓN NORMATIVA INCENDIO;NÚMERO;4;4
001210;32101;08;08;INCIDENCIA EN OBRAS ADAPTACIÓN A LA NORMATIVA INCENDIOS;PORCENTAJE;15;15
001210;32101;08;09;PLANES AUTOPROTEC. IMPLANTADOS C. EDUC. MANTENIM. DTO;NÚMERO;26;26
001210;32101;08;10;C. EDUCATIVOS SIN BARRERAS ARQUITECTÓNICAS S/TOTAL COLEGIOS;PORCENTAJE;34;34
001210;32101;08;11;INCIDENCIA OBRAS ELIMINACIÓN BARRERAS ARQUITECTÓNICAS;PORCENTAJE;3;3
001210;33401;01;07;CONCIERTOS;NÚMERO;100;174
001210;33401;01;06;ASISTENCIA A EXPOSICIONES;NÚMERO;3200;63278
001210;33401;01;05;EXPOSICIONES;NÚMERO;34;106
001210;33401;01;04;CESIÓN ESPACIOS Y MEDIOS DE C. CULTURALES MUNICIPALES;HORAS;310;902
001210;33401;01;03;ACTIVIDADES POR CENTRO CULTURAL;RATIO;106;285
001210;33401;01;02;POBLACIÓN DEL DISTRITO POR CENTRO CULTURAL MUNICIPAL;RATIO;36571;27800
001210;33401;01;01;CENTROS CULTURALES MUNICIPALES;NÚMERO;8;9
001210;33401;01;08;ASISTENCIA A CONCIERTOS;NÚMERO;10000;23093
001210;33401;01;09;OBRAS DE TEATRO;NÚMERO;50;170
001210;33401;01;16;SUGERENCIAS Y RECLAMACIONES RELACIONADAS ACT. CULTURALES;NÚMERO;20;8
001210;33401;01;15;ASISTENCIA POBLACIÓN DISTRITO A ACTIV. CULTURALES;RATIO;1;1
001210;33401;01;14;PARTICIPANTES EN OTRAS ACTIVIDADES CULTURALES;NÚMERO;4000;4100
001210;33401;01;13;OTRAS ACTIVIDADES CULTURALES;NÚMERO;5;18
001210;33401;01;12;ASISTENCIA A CONFERENCIAS;NÚMERO;640;1444
001210;33401;01;11;CONFERENCIAS;NÚMERO;8;21
001210;33401;01;10;ASISTENCIA A OBRAS DE TEATRO;NÚMERO;5000;21545
001210;33401;02;07;SUFICIENCIA PLAZAS DE CURSOS DE ACTIVIDADES OFERTADAS;PORCENTAJE;80;82
001210;33401;02;06;ASISTENCIA POBLACIÓN DEL DTO. CURSOS ACTIV. SOCIOC. Y RECR;PORCENTAJE;8;36
001210;33401;02;05;MEDIA TRIMESTRAL ASISTENTES CURSO DE ACTIV. SOCIOC. Y RECR.;RATIO;17;22
001210;33401;02;04;MEDIA TRIMESTRAL ASISTENTES CURSOS DE ACTV. SOCIOC. Y RECR;NÚMERO;8222;8972
001210;33401;02;03;HORAS DE CURSOS ACTIV. SOCIOCULTURALES Y RECREATIVAS;HORAS;34714;34240
001210;33401;02;02;CURSOS ACTIV. SOCIOC. Y RECR. POR CENTRO CULTURAL MUNICIPAL;RATIO;66;67
001210;33401;02;01;CURSOS DE ACTIVIDADES SOCIOCULTURALES Y RECREATIVAS;NÚMERO;526;533
001210;33401;03;01;FIESTAS POPULARES CELEBRADAS;NÚMERO;1;1
001210;33401;03;02;FESTEJOS REALIZADOS COLABORACIÓN CON ASOCIAC. VECINALES;NÚMERO;1;4
001210;33401;04;01;SUPERFICIE DE CENTROS CULTURALES A REFORMAR;M2;2000;2000
001210;33401;04;02;INCIDENCIA DE LAS OBRAS DE REFORMA EN LOS C.CULTURALES;PORCENTAJE;10;10
001210;34101;01;10;UNIDADES DEPORT. INSTALAC DEPORT. BÁSICAS CONTROL ACCESO;NÚMERO;14;14
001210;34101;01;11;UNIDADES DEPORT. INSTAL. DEPEORT. BÁSICAS SIN CONTROL ACCESO;NÚMERO;33;33
001210;34101;01;12;UNIDADES DEPORTIVAS TOTALES;NÚMERO;134;181
001210;34101;01;13;UNIDADES DEPORTIVAS POR HABITANTE DEL DISTRITO;RATIO;2;1
001210;34101;01;14;NIVEL OCUPACIÓN UNID. DEPORTIV. DE LOS CENTROS DEPORTIVOS;PORCENTAJE;86;86
001210;34101;01;15;SUPERFICIE DE INSTALACIONES DEPORTIVAS BÁSICAS DE ACCESO CONTROLADO;M2;0;116050
001210;34101;01;09;SUPERF. INSTALAC. DEPORTIVAS POR HABITANTE DISTRITO;RATIO;1;2
001210;34101;01;08;TOTAL SUPERFICIE DE INSTALACIONES DEPORTIVAS;M2;192513;446962
001210;34101;01;07;SUPERFICIE INSTALACIONES DEPORTIVAS BÁSICAS DE ACCESO LIBRE;M2;76463;76463
001210;34101;01;06;SUPERFICIE DE CENTROS DEPORTIVOS;M2;116050;254449
001210;34101;01;05;INSTALACIONES DEPORTIVAS BÁSICAS SIN CONTROL DE ACCESO;NÚMERO;27;27
001210;34101;01;04;INSTALACIONES DEPORTIVAS BÁSICAS CON CONTROL DE ACCESO;NÚMERO;8;8
