CeGe;Prog. Finan.;Objetivo;Actividad por Objetivo;Descripción Actividades
1213;23103;3;A;VALORACIÓN, GESTIÓN Y SEGUIMIENTO DE LAS SOLICITUDES DE PLAZAS EN PISOSTUTELADOS, RESIDENCIAS DE MAYORES DE EMERGENCIA Y
1213;23103;3;B;GESTIÓN Y CONTROL DE LAS AYUDAS ECONÓMICAS CONCEDIDAS.
1213;23106;1;A;ATENCIÓN DE LAS NECESIDADES Y DEMANDAS PLANTEADAS POR LA CIUDADANÍA ENLOS CENTROS DE SERVICIOS SOCIALES, PROPORCIONANDO
1213;23106;1;B;GESTIÓN Y SEGUIMIENTO DE PRESTACIONES SOCIALES, TANTO MUNICIPALES COMODE LA COMUNIDAD DE MADRID.
1213;23106;1;C;SEGUIMIENTO Y APOYO PERSONALIZADO DE LAS PERSONAS Y FAMILIAS EN PROCESODE ATENCIÓN SOCIAL.
1213;23106;2;A;VALORACIÓN, GESTIÓN Y ACOMPAÑAMIENTO SOCIAL PARA PERSONAS INCORPORADASAL PROGRAMA DE LA RENTA MÍNIMA DE INSERCIÓN
1213;23106;2;B;COODINACIÓN DE LAS ACTUACIONES QUE DESARROLLAN PROYECTOS ESPECÍFICOS DEINSERCIÓN SOCIOLABORAL.
1213;23106;2;C;VALORACIÓN, SEGUIMIENTO Y APOYO A LAS PERSONAS BENEFICIARIAS DE AYUDASECONÓMICAS.
1213;23106;3;A;INFORMACIÓN, ORIENTACIÓN, Y ASESORAMIENTO A FAMILIAS EN MATERIA DEVIVIENDA.
1213;23106;3;B;MEDIACIÓN EN COMUNIDADES VECINALES.
1213;23106;3;C;ASESORAMIENTO Y ORIENTACIÓN JURÍDICA.
1213;23106;3;D;VALORACIÓN, ATENCIÓN Y SEGUIMIENTO A SITUACIONES DE EMERGENCIARESIDENCIAL
1213;23106;3;E;GESTIÓN, SUPERVISIÓN, INTERVENCIÓN Y SEGUIMIENTO DE FAMILIAS ALOJADAS ENVIVIENDAS COMPARTIDAS
1213;23106;3;F;COORDINACIÓN Y ORIENTACIÓN CON PROFESIONALES IMPLICADOS
1213;23106;3;G;DESARROLLO DE ACTIVIDADES GRUPALES Y COMUNITARIAS.
1213;31101;1;A;CONTROL OFICIAL EN ESTABLECIMIENTOS DONDE SE ELABORAN, VENDEN O SIRVENALIMENTOS Y BEBIDAS
1213;31101;1;B;TOMA DE MUESTRAS DE ALIMENTOS Y BEBIDAS PARA SU ANÁLISIS EN ELLABORATORIO DE SALUD PÚBLICA
1213;31101;1;C;CONTROL DE LOS BROTES DE ORIGEN ALIMENTARIOS
1213;31101;1;D;AUDITORIAS A LAS IMPLANTACIONES APPCC
1213;31101;2;A;REALIZACIÓN DE INSPECCIONES EN PISCINAS
1213;31101;2;B;TOMA DE MUESTRAS DE AGUA EN PISCINAS PARA SU ANÁLISIS EN EL LABORATORIODE SALUD PÚBLICA.
1213;31101;2;C;TRAMITACIÓN DE LA COMUNICACIÓN DE APERTURA DE TEMPERADA EN PISCINAS
1213;31101;2;D;INSPECCIONES A LOS ESTABLECIMIENTOS DE ESTÉTICA, BELLEZA Y ADORNOCORPORAL, ESCUELAS INFANTILES Y CENTROS DE RECREO Y CUI
1213;31101;3;A;REALIZACIÓN DE INSPECCIONES DE LOS DISTINTOS CENTROS DE ANIMALES DECOMPAÑIA
1213;31101;3;B;GESTIÓN DE LAS DENUNCIAS SOBRE TENENCIA DE ANIMALES DOMÉSTICOS.
1213;31101;3;C;TRAMITACIÓN DE LICENCIAS PARA LA TENENCIA DE ANIMALES POTENCIALMENTEPELIGROSOS
1213;31101;3;D;OBSERVACIONES ANTIRRÁBICAS EN DOMICILIO
1213;31101;4;A;CONTROL DE LA ACTIVIDAD QUE SE DESARROLLA EN LOS MERCADILLOS DE LA VÍAPÚBLICA.
1213;31101;4;B;GESTIÓN DE LA CONTRATACIÓN DE SANITARIOS QUÍMICOS PORTATILES.
1213;31101;4;C;GESTIÓN DE EXPEDIENTES SANCIONADORES.
1213;31101;4;D;ELABORACIÓN DE PROPUESTAS DE SANCIÓN.
1213;31101;4;E;EJECUCIÓN DE MEDIDAS CAUTELARES.
1213;32301;1;A;SUPERVISIÓN DE LA GESTIÓN DE LAS ESCUELAS MUNICIPALES INFANTILES
1213;32301;1;B;REUNIONES DE COORDINACIÓN PARA LA GESTIÓN DE LAS ESCUELAS INFANTILESMUNICIPALES, CON LAS ESCUELAS Y CON EL AREA DE GOBIE
1213;32301;1;C;REPRESENTACIÓN EN EL SERVICIO MUNICIPAL DE APOYO A LA ESCOLARIZACIÓN
1213;32301;2;A;RECOGIDA, TRATAMIENTO Y ANÁLISIS DE DATOS DESAGREGADOS POR SEXO.
1213;32301;2;B;ORGANIZACIÓN Y/O PARTICIPACIÓN EN FOROS DE COORDINACIÓN CON ENTIDADESDEL DISTRITO.
1213;32301;3;A;REPARACIÓN, MANTENIMIENTO Y CONSERVACIÓN
1213;32301;3;B;INSPECCIÓN DE LOS CENTROS DOCENTES ADSCRITOS AL DISTRITO
1213;32301;3;C;CONCRECIÓN DE LAS NECESIDADES MANTENIMIENTO
1213;32301;3;D;COORDINACIÓN Y SEGUIMIENTO DE LOS TRABAJOS DE MANTENIMIENTO QUE REALIZALA CONTRATA MUNICIPAL
1213;32301;3;E;CONTRATACIÓN, DIRECCIÓN, VIGILANCIA Y SEGUIMIENTO DE LAS OBRAS DEMANTENIMIENTO.
1213;32501;1;A;RECEPCIÓN, ANALISIS Y SEGUIMIENTO DE LOS CASOS DE ABSENTISMO.
1213;32501;1;B;INTERVENCIÓN INDIVIDUAL, GRUPAL, FAMILIAR Y COMUNITARIA.
1213;32501;1;C;INFORMACIÓN A LOS CENTROS DOCENTES DE LAS MEDIDAS DESARROLLADAS.
1213;32501;1;D;ELABORACIÓN Y DESARROLLO DE ACTIVIDADES EDUCATIVAS CON PERSPECTIVA DEGÉNERO ENCAMINADAS A LA PREVENCIÓN DEL ABSENTISMO E
1213;32601;1;A;APROBACIÓN Y DESARROLLO DE ACTIVIDADES COMPLEMENTARIAS A LA ENSEÑANZACON PERSPECTIVA DE GÉNERO
1213;32601;1;B;PROGRAMACIÓN Y REALIZACIÓN DE ACTIVIDADES EXTRAESCOLARES APOYO Y ESTUDIODIRIGIDO, REFUERZO DE IDIOMAS, ACTIVIDADES ARTÍS
1213;32601;1;C;PRESTACIÓN DEL SERVICIO DE TRANSPORTE PARA LA REALIZACIÓN DE ACTIVIDADESEDUCATIVAS, CULTURALES Y DEPORTIVAS FUERA DE LOS
1213;32601;2;A;INFORMACIÓN, ORIENTACIÓN Y ASESORAMIENTO EN MATERIA EDUCATIVA
1213;32601;2;B;"DIFUSIÓN Y EJECUCIÓN DE LAS ACTIVIDADES CONTEMPLADAS EN LA ""ESCUELA DEMADRES Y PADRES""."
1213;32601;3;A;DIRECCIÓN, COORDINACIÓN Y SUPERVISIÓN PARA EL DESARROLLO DE CERTÁMENES,CONCURSOS Y PREMIOS
1213;32601;4;A;DESARROLLO DE ACTIVIDADES DE APOYO AL PLAN DE CONVIVENCIA  DE LOSCENTROS EDUCATIVOS  CON PERSPECTIVA DE GÉNERO.
1213;32601;4;B;PROGRAMACION Y REALIZACIÓN DE ACTIVIDADES PARA LA PARTICIPACIÓN INFANTILY ADOLESCENTE DEL DISTRITO
1213;32601;4;C;ORGANIZACIÓN Y SEGUMIENTO DEL PLAN DE INFANCIA Y ADOLESCENCIA EN ELDISTRITO
1213;33401;1;A;PROGRAMACIÓN DE LAS ACTIVIDADES CULTURALES (EXPOSICIONES, CONCIERTOS,OBRAS DE TEATRO, VIAJES CULTURALES, VISITAS CULTURA
1213;33401;1;B;GESTIÓN DEL PROGRAMA DE ACTIVIDADES CULTURALES EN CENTROS CULTURALES,INSTALACIONES DEPORTIVAS Y VIA PUBLICA.
1213;33401;1;C;GESTION DE LAS INFRAESTRUCTURAS PARA EL DESARROLLO DE LOS EVENTOSCULTURALES.
1213;33401;1;D;PROGRAMACION DE ACTIVIDADES CULTURALES INFANTILES (PAYASOS, MAGIA,TITERES, ETC.)
1213;33401;2;A;PROGRAMACIÓN DE CURSOS DE ACTIVIDADES CULTURALES (MÚSICA, IDIOMAS,DANZA, PLASTICA, NUEVAS TECNOLOGÍAS)
1213;33401;2;B;GESTIÓN Y SUPERVISIÓN DE LA REALIZACIÓN DE LOS CURSOS DE ACTIVIDADESCULTURALES.
1213;33401;3;A;PROGRAMACIÓN Y GESTIÓN DE FESTEJOS POPULARES (FIESTAS PATRONALES,CABALGATA NAVIDAD, CARNAVALES, FIESTAS DE PRIMAVERA, ET
1213;33401;3;B;COLABORACIÓN CON ENTIDADES DEL DISTRITO PARA LA CELEBRACIÓN DE FESTEJOSEN EL VECINDARIO.
1213;34101;1;A;PROGRAMACIÓN Y ORGANIZACIÓN DE COMPETICIONES, TORNEOS Y JORNADASDEPORTIVAS EN EL DISTRITO
1213;34101;1;B;PROGRAMACIÓN Y REALIZACIÓN DE ACTIVIDADES NO COMPETITIVAS PARA LAPROMOCIÓN DEL DEPORTE.
1213;34101;1;C;ORGANIZACIÓN DE CARRERAS POPULARES
1213;34201;1;A;PUESTA EN FUNCIONAMIENTO DIARIO DE LAS INSTALACIONES Y DE LAS UNIDADESDEPORTIVAS PARA SU USO
1213;34201;1;B;PREPARACIÓN DEL MATERIAL DEPORTIVO PARA EL DESARROLLO DIARIO DE LASACTIVIDADES
1213;34201;1;C;VIGILANCIA Y SEGURIDAD DE LAS INSTALACIONES DEPORTIVAS
1213;34201;2;A;PLANIFICACIÓN, PROGRAMACIÓN Y GESTIÓN DE LAS CLASES Y ESCUELASDEPORTIVAS.
1213;34201;2;B;PLANIFICACIÓN, PROGRAMACIÓN Y GESTIÓN DE ALQUILERES, CESIONES Y USOSLIBRES DE UNIDADES DEPORTIVAS.
1213;34201;2;C;PLANIFICACIÓN, PROGRAMACIÓN Y GESTIÓN DE LAS ESCUELAS DE PROMOCIÓN DEPORTIVA PARA CENTROS ESCOLARES.
1213;34201;2;D;GESTIÓN DEL PROGRAMA MÉDICO DEPORTIVO.
1213;34201;3;A;PROYECTO Y EJECUCION DE OBRAS DE REFORMA Y ACONDICIONAMIENTO DEINSTALACIONES DEPORTIVAS
1213;34201;3;B;MANTENIMIENTO Y LIMPIEZA DE LAS INSTALACIONES DEPORTIVAS
1213;49300;1;A;INSPECCIONES Y CONTROL DE ESTABLECIMIENTOS EN MATERIA DE CONSUMO NOALIMENTARIO
1213;49300;1;B;ELABORACION DE INFORMES Y REQUERIMIENTOS REFERIDOS A CONSUMO
1213;49300;1;C;TOMA DE MUESTRAS OCASIONALES POR LA INSPECCION DE CAMPAÑAS,RECLAMACIONES PRESENTADAS, O CAMPAÑA DE TOMA DE MUESTRAS DEL
1213;49300;2;A;TRAMITACIÓN DE LAS DENUNCIAS Y RECLAMACIONES.
1213;49300;2;B;INFORMACIÓN Y ASESORAMIENTO AL CONSUMIDOR.
1213;49300;2;C;ELABORACIÓN DE INFORMES EN MATERIA DE CONSUMO.
1213;49300;3;A;AGILIZAR LA GESTIÓN DE EXPEDIENTES DE CONSUMO
1213;91220;1;A;ASISTENCIA A ACTOS INSTITUCIONALES.
1213;91220;1;B;ASISTENCIA Y DEBATE DE ASUNTOS EN LAS SESIONES DEL PLENO DEL AYUNTAMIENTO.
1213;91220;1;C;PRESIDENCIA Y DIRECCIÓN DE LAS SESIONES DEL PLENO DE LA JUNTA MUNICIPALDEL DISTRITO.
1213;91220;1;D;PRESIDENCIA DEL PLENARIO DEL FORO LOCAL Y OTROS ÓRGANOS COLEGIADOS.
1213;91220;2;A;VISITAS A LOS CENTROS Y EQUIPAMIENTOS ADSCRITOS AL DISTRITO.
1213;91220;2;B;REUNIONES CON ASOCIACIONES VECINALES Y ENTIDADES DEL DISTRITO.
1213;92001;1;A;TRAMITACIÓN DE LOS EXPEDIENTES ADMINISTRATIVOS PARA EL SUMINISTRO DEMATERIAL ORDINARIO NO INVENTARIABLES A TRAVÉS DEL PR
1213;92001;1;B;GESTIÓN Y SEGUIMIENTO DE LA CONTRATACIÓN DEL DISTRITO
1213;92001;1;C;GESTIÓN DE LOS SERVICIOS DE LA JUNTA DE DISTRITO
1213;92001;1;D;GESTIÓN DEL PERSONAL
1213;92001;1;E;INFORMACIÓN GENERAL. REGISTRO DE SOLICITUDES Y DOCUMENTACIÓN
1213;92001;1;F;GESTIÓN DE LA RECEPCIÓN DE SUGERENCIAS Y RECLAMACIONES
1213;92001;1;G;ATENCIÓN E INFORMACIÓN AL CIUDADANO
1213;92001;1;H;GESTIÓN, SEGUIMIENTO Y CONTROL DE LA EJECUCIÓN PRESUPUESTARIA Y PAGO DEFACTURAS, CERTIFICACIONES, AYUDAS Y SUBVENCIONES
1213;92001;2;A;ASESORAMIENTO LEGAL PRECEPTIVO AL CONCEJAL PRESIDENTE
1213;92001;2;B;ELABORACIÓN DE INFORMES JURÍDICOS Y PROPUESTA DE RESOLUCIÓN EN EL ÁMBITOCOMPETENCIAL DE LA JUNTA.
1213;92001;2;C;CONVOCATORIA Y NOTIFICACIÓN DE LAS SESIONES ORDINARIAS Y EXTRAORDINARIASDE LA JUNTA MUNICIPAL
1213;92001;2;D;GESTIÓN DE INDEMNIZACIONES A VOCALES VECINOS
1213;92001;3;A;GESTIÓN DE EXPEDIENTES DE LICENCIAS URBANÍSTICAS.
1213;92001;3;B;GESTIÓN DE EXPEDIENTES DE AUTORIZACIÓN DE OCUPACIÓN DEL DOMINIO PÚBLICO.
1213;92001;3;C;REALIZACIÓN DE INSPECCIONES DE OFICIO O A SOLICITUD DE LOS CIUDADANOS.
1213;92001;3;D;REALIZACIÓN INFORMES TÉCNICOS Y JURÍDICOS SOBRE LAS INFRACCIONESCOMETIDAS EN MATERIA URBANÍSTICA CONSUMO, HORARIOS DE AP
1213;92001;3;E;ORDENES DE EJECUCIÓN.
1213;92001;3;F;REALIZACIÓN DE PROPUESTAS DE EXPEDIENTES SANCIONADORES Y TRAMITACIÓN DELOS MISMOS.
1213;92401;1;A;APOYO A LOS FOROS LOCALES
1213;92401;1;B;CONVOCATORIA DE SESIONES DEL FORO LOCAL. COLABORACIÓN Y APOYO.
1213;92401;1;C;COLABORACIÓN Y APOYO A LAS SESIONES DE LA COMISIÓN PERMANENTE.
1213;92401;2;A;GESTIÓN DEL RÉGIMEN DE SUBVENCIONES A FAVOR DE PROYECTOSPRESENTADOS POR LAS ENTIDADES CIUDADANAS DEL DISTRITO.
1213;93302;1;A;SUPERVISIÓN Y CONTROL DE LA PRESTACIÓN DEL SERVICIO DE MANTENIMIENTO YCONSERVACIÓN DE EDIFICIOS PÚBLICOS DEL DISTRITO.
1213;93302;1;B;ELABORACIÓN, DIRECCIÓN Y SUPERVISIÓN DE LOS PROYECTOS DE OBRAS YREFORMAS NECESARIOS EN LOS EDIFICIOS DEL DISTRITO.
1213;93302;1;C;INSPECCIÓN DE LOS EDIFICIOS AL OBJETO DE COMPROBAR LAS NECESIDADES QUEPRESENTAN SUS ELEMENTOS CONSTRUCTIVOS E INSTALACIO
1213;93302;2;A;SUPERVISIÓN Y CONTROL DE LA PRESTACIÓN DEL SERVICIO DE LIMPIEZA ENEDIFICIOS DEL DISTRITO.
1213;93302;2;B;SUPERVISIÓN Y CONTROL DE LA PRESTACIÓN DEL SERVICIO DE VIGILANCIA YSEGURIDAD DE LOS EDIFICIOS DEL DISTRITO.
1213;93302;2;C;SUPERVISIÓN DEL FUNCIONAMIENTO DE LAS MEDIDAS DE SEGURIDAD DE LOSEDIFICIOS.
1213;93302;3;A;ORIENTACIÓN AL PÚBLICO E INFORMACIÓN GENERAL TELEFÓNICA Y PRESENCIAL
1213;93302;3;B;DETECCIÓN DE PEQUEÑAS INCIDENCIAS EN LOS EDIFICIOS
1214;15322;1;A;LAS ACTIVIDADES PREVISTAS EN ESTE INDICADOR SON REALIZAR LAS OBRAS YACTUACIONES NECESARIAS PARA EL ACONDICIONAMIENTO DE
1214;17102;1;A;MEJORA DE LA MOVILIDAD Y ACCESIBILIDAD PEATONAL
1214;23102;1;A;INFORMACIÓN Y COORDINACIÓN SOBRE LOS RECURSOS DE  ATENCIÓN A LA CRIANZADE LOS HIJOS E HIJAS.
1214;23102;1;B;INFORMACIÓN, VALORACIÓN Y SEGUIMIENTO SOBRE LOS RECURSOS DE ATENCIÓN ALA CONCILIACIÓN FAMILIAR: LUDOTECAS, QUEDAMOS AL S
1214;23102;1;C;COORDINACIÓN CON LOS AGENTES INSTITUCIONALES Y ENTIDADES QUE GESTIONANLOS DIFERENTES RECURSOS DE FAMILIA.
1214;23102;1;D;VALORACIÓN, GESTIÓN Y SEGUIMIENTO DE LAS AYUDAS ECONÓMICAS SOLICITADAS.
1214;23102;1;E;VALORACIÓN, GESTIÓN Y SEGUIMIENTO DEL SERVICIO DE AYUDA A DOMICILIO PARAATENCIÓN DE MENORES Y FAMILIA.
1214;23102;1;F;VALORACIÓN, GESTIÓN Y SEGUIMIENTO DE PLAZAS CONCERTADAS EN ESCUELASINFANTILES DEL DISTRITO, PARA MENORES EN SITUACIÓN DE
1214;23102;1;G;INFORMACIÓN, VALORACIÓN Y SEGUIMIENTO DE PLAZAS DE CAMPAMENTOS DE VERANO
1214;23102;2;A;DETECCIÓN, VALORACIÓN E INTERVENCIÓN SOCIAL Y EDUCATIVA CON NIÑOS, NIÑASY ADOLESCENTES EN RIESGO DE EXCLUSIÓN SOCIAL.
1214;23102;2;B;PLANIFICACIÓN, GESTIÓN Y SUPERVISIÓN DE LOS PROGRAMAS DE APOYO SOCIALPARA NIÑOS, NIÑAS Y ADOLESCENTES EN SITUACIÓN DE RI
1214;23102;2;C;COORDINACIÓN CON AGENTES E INSTITUCIONES COMPETENTES QUE INTERVIENEN CONMENORES NIÑOS, NIÑAS Y ADOLESCENTES EN SITUACIÓN
1214;23102;2;D;ACTUACIÓN EN MATERIA DE ACOMPAÑAMIENTO, APOYO Y ASESORAMIENTO A LOSMENORES Y SUS FAMILIAS
1214;23102;2;E;PLANIFICACIÓN GESTIÓN E INTERVENCIÓN EN APOYO ESCOLAR A DOMICILIO
1214;23102;2;F;PROMOCIÓN Y ANIMACIÓN SOCIO-JUVENIL PARA UN OCIO SALUDABLE Y LACONSTRUCCIÓN DE ESPACIOS DE CONVIVENCIA
1214;23103;1;A;DIFUSIÓN DE LOS RECURSOS MUNICIPALES PARA LA ATENCIÓN A LAS NECESIDADESDE LOS MAYORES.
1214;23103;1;B;DETECCIÓN Y VALORACIÓN DE LAS SITUACIONES DE RIESGO PARA LAS PERSONASMAYORES.
1214;23103;1;C;GESTIÓN Y PRESTACIÓN DEL SERVICIO DE AYUDA A DOMICILIO.
1214;23103;1;D;GESTIÓN Y PRESTACIÓN DEL SERVICIO DE TELEASISTENCIA
1214;23103;1;E;GESTIÓN Y PRESTACIÓN DEL SERVICIO DE COMIDAS A DOMICILIO
1214;23103;1;F;GESTIÓN Y PRESTACIÓN DEL SERVIVIO DE LAVANDERÍA
1214;23103;1;G;GESTIÓN Y PRESTACIÓN  DE MEDIOS MECÁNICOS PARA PERSONAS MAYORES CONMOVILIDAD REDUCIDA (CAMAS ARTICULADAS, SILLAS DE RUED
1214;23103;1;H;GESTIÓN Y PRESTACIÓN DE ADAPTACIONES GERIÁTRICAS EN LAS VIVIENDAS DEPERSONAS MAYORES.
1214;23103;2;A;INFORMACIÓN Y ORIENTACIÓN SOBRE LOS SERVICIOS BÁSICOS QUE  PRESTAN LOSCENTROS: TARJETA MADROD MAYOR, PODOLOGÍA, BIBLIOTE
1214;23103;2;B;PROGRAMACIÓN Y DESARROLLO DEL PROGRAMA DE DINAMIZACIÓN SOCIAL: TALLERES,ACTIVIDADES PARTICIPATIVAS, ACTIVIDADES INTERGEN
1214;23103;2;C;ORGANIZACIÓN DEL VOLUNTARIADO EN LOS CENTROS DE MAYORES
1214;23103;3;A;"GESTIÓN DEL PROGRAMA""CUIDAR A QUIEN CUIDA"""
1214;23103;3;B;GESTIÓN DEL PROGRAMA RESPIRO FAMILIAR - FIN DE SEMANA.
1214;23103;4;A;VALORACIÓN GESTIÓN Y SEGUIMIENTO DE LA PRESTACIÓN DE CENTROS DE DÍA(FÍSICO Y COGNITIVO)
1214;23103;5;A;VALORACIÓN, GESTIÓN Y SEGUIMIENTO DE LAS SOLICITUDES DE PLAZAS EN PISOSTUTELADOS, RESIDENCIAS DE MAYORES DE EMERGENCIA Y
1214;23103;5;B;GESTIÓN Y CONTROL DE LAS AYUDAS ECONÓMICAS CONCEDIDAS.
1214;23106;1;A;ATENCIÓN DE LAS NECESIDADES Y DEMANDAS PLANTEADAS POR LOS CIUDADANOS ENLOS CENTROS DE SERVICIOS SOCIALES, PROPORCIONANDO
1214;23106;1;B;GESTIÓN Y SEGUIMIENTO DE PRESTACIONES SOCIALES, TANTO MUNICIPALES COMODE LA COMUNIDAD DE MADRID.
1214;23106;1;C;SEGUIMIENTO Y APOYO PERSONALIZADO DE LAS PERSONAS Y FAMILIAS EN PROCESODE ATENCIÓN SOCIAL
1214;23106;2;A;ATENCIÓN, VALORACIÓN Y GESTIÓN DE LAS DEMANDAS DE ATENCIÓN DOMICILIARIAPARA PERSONAS CON DIVERSIDAD FUNCIONAL.
1214;23106;2;B;GESTIÓN Y PRESTACIÓN DEL SERVICIO DE AYUDA A DOMICILIO
1214;23106;2;C;VALORACIÓN, GESTIÓN Y SEGUIMIENTO DE AYUDAS ECONÓMICAS.
1214;23106;3;A;VALORACIÓN, GESTIÓN Y ACOMPAÑAMIENTO SOCIAL PARA PERSONAS INCORPORADASAL PROGRAMA DE RENTA MÍNIMA DE INSERCIÓN.
1214;23106;3;B;COORDINACIÓN DE LAS ACTUACIONES QUE DESARROLLAN PROYECTOS ESPECÍFICOS DEINSERCIÓN SOCIO LABORAL.
1214;23106;3;C;VALORACIÓN SEGUIMIENTO Y APOYO A LAS PERSONAS BENEFICIARIAS DE AYUDASECONÓMICAS.
1214;23106;4;A;INFORMACIÓN, ORIENTACIÓN, VALORACIÓN Y SEGUIMIENTO CON LOS RECURSOSESPECÍFICOS DE LA RED DE ATENCIÓN A PERSONAS SIN HOGA
1214;23106;4;B;INFORMACIÓN Y DERIVACIÓN A LOS RECURSOS DE ALOJAMIENTOS Y CENTROS DEDÍA PARA PERSONAS SIN HOGAR
1214;23106;4;C;VALORACIÓN, GESTIÓN Y SEGUIMIENTO DE LAS AYUDAS ECONÓMICAS Y OTRASPRESTACIONES GESTIONADAS.
1214;23106;4;D;VALORACIÓN Y ACOMPAÑAMIENTO SOCIOEDUCATIVO EN EL PROGRAMA DEALOJAMIENTOS ALTERNATIVOS.
1214;23106;5;A;VALORACIÓN, SEGUIMIENTO Y APOYO A LAS PERSONAS BENEFICIARIAS DE TARJETASPREPAGO COVID-19.
1214;23106;6;A;INFORMACIÓN Y COORDINACIÓN SOBRE LOS RECURSOS DEL DISTRITO
1214;23106;6;B;INFORMACIÓN VALORACIÓN Y SEGUIMIENTO DE USUARIOS EN MEDIACIÓN SOCIAL
1214;23106;6;C;INFORMACIÓN, VALORACIÓN Y SEGUIMIENTO DE LOS ARBITRAJES VECINALES
1214;23106;6;D;VALORACIÓN, GESTIÓN Y SEGUIMIENTO DE LAS SESIONES GRUPALES
1214;23106;7;A;COORDINACIÓN CON AGENTES Y PERSONAL MUNICIPAL QUE INTERVIENEN EN LOSESPACIOS PÚBLICOS
1214;23106;7;B;VALORACIÓN SEGUIMIENTO DE MENORES Y JÓVENES EN SITUACIÓN DE RIESGOSOCIAL
1214;31101;1;A;CONTROL OFICIAL EN ESTABLECIMIENTOS DONDE SE ELABORAN, VENDEN O SIRVENALIMENTOS Y BEBIDAS.
1214;31101;1;B;TOMA DE MUESTRAS DE ALIMENTOS Y BEBIDAS PARA SU ANÁLISIS EN ELLABORATORIO DE SALUD PÚBLICA
1214;31101;1;C;ELABORACIÓN DE INFORMES SANITARIOS PARA LA CONCESIÓN DE LICENCIASURBANÍSTICAS, REGISTROS Y AUTORIZACIONES SANITARIAS.
1214;31101;1;D;ELABORACIÓN DE INFORMES SANITARIOS, REQUERIMIENTOS Y EN SU CASO,PROPUESTA DE SANCIÓN A LOS ESTABLECIMIENTOS.
1214;31101;2;A;REALIZACIÓN DE INSPECCIONES DE LOS DISTINTOS ESTABLECIMIENTOS
1214;31101;2;B;ELABORACIÓN DE INFORMES SANITARIOS, REQUERIMIENTOS Y EN SU CASO,PROPUESTA DE SANCIÓN A LOS ESTABLECIMIENTOS.
1214;31101;2;C;REALIZACIÓN DE INSPECCIONES EN PISCINAS.
1214;31101;2;D;TOMA DE MUESTRAS DE AGUA EN PISCINAS PARA SU ANÁLISIS EN EL LABORATORIODE SALUD PÚBLICA.
1214;31101;2;E;TRAMITACIÓN DE LA COMUNICACIÓN DE APERTURA DE TEMPORADA DE PISCINAS.
1214;31101;2;F;ELABORACIÓN DE INFORMES SANITARIOS PARA LA CONCESIÓN DE LICENCIASURBANÍSTICAS, REGISTROS Y AUTORIZACIONES SANITARIAS.
1214;31101;2;G;ELABORACIÓN DE INFORMES SANITARIOS, REQUERIMIENTOS, Y EN SU CASOPROPUESTA DE SANCIÓN A LOS ESTABLECIMIENTOS.
1214;31101;3;A;REALIZACIÓN DE INSPECCIONES DE LOS DISTINTOS ESTABLECIMIENTOS.
1214;31101;3;B;REALIZACIÓN DE LAS CAMPAÑAS DE IDENTIFICACIÓN ANIMAL Y VACUNACIÓNANTIRRÁBICA.
1214;31101;3;C;GESTIÓN DE LAS DENUNCIAS SOBRE TENENCIA DE ANIMALES DOMÉSTICOS.
1214;31101;3;D;TRAMITACION DE LICENCIAS PARA TENENCIA ANIMALES POTENCIALMENTEPELIGROSOS.
1214;31101;3;E;ELABORACIÓN DE INFORMES SANITARIOS PARA LA CONCESIÓN DE LICENCIASURBANÍSTICAS Y REGISTROS.
1214;31101;3;F;ELABORACIÓN DE INFORMES SANITARIOS, REQUERIMIENTOS Y EN SU CASOPROPUESTA DE SANCIÓN A LOS ESTABLECIMIENTOS.
1214;31101;4;A;ELABORACIÓN DE PROPUESTA DE SANCIÓN
1214;31101;4;B;EJECUCIÓN DE MEDIDAS CAUTELARES
1214;31101;4;C;AUTORIZACIÓN DE CONCESIONES Y CAMBIOS DE ACTIVIDADES EN MERCADOS DELDISTRITO Y CENTROS COMERCIALES DE BARRIO
1214;32301;1;A;DIRECCIÓN Y SUPERVISIÓN DE LA PRESTACIÓN DEL SERVICIO DE MANTENIMIENTO YLIMPIEZA EN LOS COLEGIOS Y CENTROS EDUCATIVOS PÚ
1214;32301;1;B;REALIZAR LAS OBRAS DE CONSERVACIÓN NECESARIAS EN LOS COLEGIOS Y CENTROSEDUCATIVOS PARA MANTENER EN PERFECTO ESTADO DE US
1214;32301;1;C;ADAPTACIÓN DE LOS COLEGIOS PÚBLICOS A LA NORMATIVA DE SUPRESIÓN DEBARRERAS ARQUITECTÓNICAS.
1214;32301;1;D;FACILITAR MATERIALES EDUCATIVOS Y LÚDICOS PARA EL BUEN FUNCIONAMIENTO DELAS ACTIVIDADES ESCOLARES
1214;32301;2;A;SUPERVISIÓN DE LA GESTIÓN DE LA ESCUELA MUNICIPAL INFANTIL
1214;32301;2;B;PARTICIPAR COMO REPRESENTANTE MUNICIPAL EN EL SERVICIO DE APOYO A LAESCOLARIZCIÓN.
1214;32301;3;A;ASISTENCIA A LAS COMISIONES DE ESCOLARIZCIÓN
1214;32301;3;B;SUPERVISIÓN DEL FUNCIONAMIENTO DE LA COMISIÓN.
1214;32301;3;C;DERIVACIÓN DE LAS SOLICITUDES DE ESCOLARIZACIÓN PRODUCIDAS EN LA JUNTADE DISTRITO A LA COMISIÓN DE ESCOLARIZACIÓN CORRES
1214;32301;4;A;INFORMACIÓN, ORIENTACIÓN Y ASESORAMIENTO EN MATERIA EDUCATIVA.
1214;32301;4;B;"DIFUSIÓN Y EJECUCIÓN DE LAS ACTIVIDADES CONTEMPLADAS EN LA ""ESCUELA DEPADRES/MADRES"""
1214;32301;4;C;EDICIÓN Y DISTRIBUCIÓN DE PUBLICACIONES ESCOLARES (AGENDA ESCOLAR YACUERDOS COPIA).
1214;32301;4;D;REUNIONES DE COORDINACIÓN CON AMPAS, EQUIPOS DIRECTIVOS Y OTROS RECURSOSEDUCATIVOS DEL DISTRITO.
1214;32601;1;A;DESARROLLO DE ACTIVIDADES EXTRAESCOLARES MUNICIPALES EN CENTROSEDUCATIVOS PARA LA CONCILIACIÓN DE LA VIDA LABORAL Y FAMI
1214;32601;1;B;VELAR POR EL CUMPLIMIENTO DE LOS OBJETIVOS DE LAS ACTIVIDADES
1214;32601;1;C;VERIFICAR LA CORRECTA EJECUCIÓN DE LAS ACTIVIDADES PUESTAS EN MARCHA.
1214;32601;2;A;COORDINAR LAS ACTUACIONES NECESARIAS PARA EL DESARROLLO DE LOSCERTÁMENES, CONCURSOS Y PREMIOS.
1214;32601;2;B;FORMAR PARTE DE LOS JURADOS QUE FALLAN LOS PREMIOS DE LOS CERTÁMENESCONCURSOS Y PREMIOS.
1214;32601;3;A;COORDINAR Y PREPARAR LAS ACTIVIDADES NECESARIAS PARA EL DESARROLLO DELAS COMISIONES DE PARTICIPACIÓN.
1214;32601;3;B;COORDINAR Y VERIFICAR LAS ACTIVIDADES PUESTAS EN MARCHA DESDE LAC.O.P.I.A.
1214;33401;1;A;PROGRAMACIÓN DE LAS ACTIVIDADES CULTURALES (EXPOSICIONES, CONCIERTOS,OBRAS DE TEATRO, VIAJES CULTURALES, VISITAS CULTURA
1214;33401;1;B;GESTIÓN DEL PROGRAMA DE ACTIVIDADES CULTURALES
1214;33401;1;C;CESIÓN DE ESPACIOS Y MEDIOS DE LOS CENTROS CULTURALES A ENTIDADESPÚBLICAS Y PRIVADAS.
1214;33401;2;A;PROGRAMACIÓN DE CURSOS DE ACTIVIDADES (MÚSICA, IDIOMAS, DANZA, PLÁSTICA,NUEVAS TECNOLOGÍAS).
1214;33401;2;B;GESTIÓN Y SUPERVISIÓN DE LA REALIZACIÓN DE LOS CURSOS DE ACTIVIDADESCULTURALES.
1214;33401;3;A;PROGRAMACIÓN Y GESTIÓN DE FESTEJOS POPULARES (FIESTAS PATRONALES,CABALGATA DE NAVIDAD, CARNAVALES, FIESTAS PRIMAVERA,ETC
1214;33401;3;B;COLABORACIÓN CON ENTIDADES DEL DISTRITO PARA LA CELEBRACIÓN DE FESTEJOSEN EL VECINDARIO.
1214;33401;4;A;DISEÑO Y REALIZACIÓN DE OPINIÓN (ESTUDIOS DE NECESIDADES, ESTUDIOS DESATISFACCIÓN, ETC.).
1214;33401;4;B;EDICIÓN Y DISTRIBUCIÓN DEL PROGRAMA DE ACTIVIDADES CULTURALES ADESARROLLAR EN LOS CENTROS CULTURALES PARA SU CONOCIMIENT
1214;34101;1;A;PROGRAMACIÓN Y ORGANIZACIÓN DE COMPETICIONES, TORNEOS Y JORNADASDEPORTIVAS EN EL DISTRITO
1214;34101;1;B;PROGRAMACIÓN Y REALIZACIÓN DE ACTIVIDADES NO COMPETITIVAS PARA LAPROMOCIÓN DEL DEPORTE.
1214;34101;2;A;PLANIFICACIÓN, PROGRAMACIÓN Y GESTIÓN DE LAS ESCUELAS DE PROMOCIÓNDEPORTIVA PARA CENTROS ESCOLARES.
1214;34201;1;A;GESTIÓN DE LAS INSTALACIONES DEPORTIVAS MUNICIPALES DEL DISTRITO.
1214;34201;1;B;CONSERVACIÓN Y MANTENIMIENTO DE LAS INSTALACIONES DEPORTIVAS MUNICIPALESDEL DISTRITO
1214;34201;2;A;PLANIFICACIÓN, PROGRAMACIÓN Y GESTIÓN DE LAS CLASES Y ESCUELASDEPORTIVAS.
1214;34201;2;B;PLANIFICACIÓN, PROGRAMACIÓN Y GESTIÓN DE ALQUILERES, CESIONES Y USOSLIBRES DE UNIDADES DEPORTIVAS.
1214;34201;2;C;GESTIÓN DEL PROGRAMA MÉDICO DEPORTIVO
1214;34201;3;A;REDACCIÓN Y EJECUCIÓN DE LAS OBRAS DE REFORMA Y ACONDICIONAMIENTO.
1214;34201;3;B;MANTENIMIENTO DE LAS INSTALACIONES DEPORTIVAS.
1214;43100;1;A;PROMOCION DE LA ACTIVIDAD COMERCIAL
1214;49300;1;A;INSPECCIONES Y CONTROL DE ESTABLECIMIENTO EN MATERIA DE CONSUMO NOALIMENTARIO
1214;49300;1;B;CONTROL DE PRODUCTOS INDUSTRIALES
1214;49300;1;C;ELABORACIÓN DE INFORMES DE CONSUMO ,REQUERIMIENTOS Y, EN SU CASO,PROPUESTA DE SANCIÓN A LOS ESTABLECIMIENTOS
1214;49300;2;A;TRAMITACIÓN DE DENUNCIAS Y RECLAMACIONES RECIBIDAS EN LA OFICINAMUNICIPAL DE INFORMACIÓN AL CONSUMIDOR
1214;49300;2;B;INFORMACIÓN Y ASESORAMIENTO MATERIA DE CONSUNO
1214;49300;2;C;ELABORACIÓN DE INFORMES EN MATERIA DE CONSUMO
1214;49300;3;A;ELABORACIÓN DE PROPUESTAS DE SANCIÓN.
1214;91220;1;A;ACTIVIDADES DE REPRESENTACIÓN Y PROTOCOLO
1214;92001;1;A;TRAMITACIÓN DE LOS EXPEDIENTES ADMINISTRATIVOS PARA EL SUMINISTRO DEMATERIAL ORDINARIO NO INVENTARIABLE A TRAVÉS DEL PRO
1214;92001;1;B;TRAMITACIÓN DE EXPEDIENTES DE CONTRATOS DE OBRAS, ACUERDO MARCO DE OBRASY CONTRATOS DERIVADOS.
1214;92001;1;C;TRAMITACIÓN DE EXPEDIENTES DE CONTRATACIÓN DEL SERVICIO DE GESTION DEEDIFICIOS Y EQUIPAMIENTOS ADSCRITOS AL DISTRITO Y D
1214;92001;1;D;TRAMITACIÓN DE LOS CONTRATOS PARA EL DESARROLLO DE LOS SERVICIOSSOCIALES: SERVICIO INTEGRAL PARA LAS PERSONAS SOCIAS DE
1214;92001;1;E;TRAMITACIÓN DE LOS CONTRATOS PARA EL DESARROLLO DE ACTIVIDADESEDUCATIVAS: GESTIÓN DE ESCUELAS INFANTILES, TRANSPORTE, AC
1214;92001;1;F;TRAMITACIÓN DE LOS CONTRATOS PARA EL DESARROLLO DE ACTIVIDADESCULTURALES: GESTIÓN DE SERVICIOS DE INSTALACIONES DEPORTIV
1214;92001;2;A;GESTION DE LOS INGRESOS RELATIVOS A LAS COMPETENCIAS DEL DISTRITO
1214;92001;2;B;GESTION Y TRAMITACIÓN DE LOS EXPEDIENTES DE GASTO
1214;92001;3;A;ASESORAMIENTO LEGAL PRECEPTIVO AL CONCEJAL PRESIDENTE
1214;92001;3;B;ELABORACIÓN DE INFORMES JURÍDICOS Y PROPUESTA DE RESOLUCIÓN EN EL ÁMBITOCOMPETENCIAL DE LA JUNTA.
1214;92001;3;C;CONVOCATORIA Y NOTIFICACIÓN DE LAS SESIONES ORDINARIAS Y EXTRAORDINARIASDE LA JUNTA MUNICIPAL
1214;92001;4;A;GESTION DE EXPEDIENTES DE LICENCIAS URBANÍSTICAS
1214;92001;4;B;GESTIÓN DE EXPEDIENTES DE AUTORIZACIÓN DE OCUPACIÓN DEL DOMINIO PÚBLICO.
1214;92001;4;C;GESTIÓN DE COMUNICACIONES PREVIAS.
1214;92001;5;A;REALIZACIÓN DE INSPECCIONES DE OFICIO A SOLICITUD DE LOS CIUDADANOS YCIUDADANAS
1214;92001;5;B;REALIZACIÓN DE INFORMES TÉCNICOS Y JURÍDICOS SOBRE LAS INFRACCIONESCOMETIDAS EN MATERIA URBANÍSTICA, CONSUMO, HORARIOS D
1214;92001;5;C;REALIZACIÓN DE PROPUESTAS DE EXPEDIENTES SANCIONADORES Y TRAMITACIÓN DELOS MISMOS.
1214;92401;1;A;DISTRIBUCIÓN DE CONVOCATORIA DE PLENOS A ASOCIACIONES DEL DISTRITO
1214;92401;1;B;DISTRIBUCIÓN DE CONVOCATORIAS DE CONSEJOS TERRITORIALES
1214;92401;1;C;COORDINACIÓN DE LOS FOROS LOCALES
1214;92401;2;A;TRAMITACIÓN DE SUBVENCIONES A LAS ENTIDADES CIUDADANAS DEL DISTRITO PARALA REALIZACIÓN DE ACTIVIDADES COMPLEMENTARIAS A
1214;92401;2;B;REALIZACIÓN DE TALLERES INFORMATIVOS SOBRE SOLICITUD Y JUSTIFICACIÓN DESUBVENCIONES.
1214;92401;2;C;REALIZACIÓN DE ENCUENTRO ASOCIACIONES CIUDADANÍA
1214;92401;3;A;ADJUDICACIÓN Y EJECUCIÓN DEL CONTRATO DE DINAMIZACIÓN DE LAPARTICIPACIÓN CIUDADANA.
1214;92401;3;B;FOMENTO DE LA PARTICIPACIÓN DE LOS HUERTOS URBANOS.
1214;92401;3;C;REALIZACIÓN DE ENCUENTROS COMUNITARIOS
1214;93302;1;A;SUPERVISIÓN Y CONTROL DE LA PRESTACIÓN DEL SERVICIO DE CONSERVACIÓN YLIMPIEZA DE EDIFICIOS PÚBLICOS DEL DISTRITO.
