CeGe;Prog. Finan.;Objetivo;Actividad por Objetivo;Descripción Actividades
1203;92001;2;A;REALIZACIÓN DE INSPECCIONES DE OFICIO O A SOLICITUD DE LOS CIUDADANOS.
1203;92001;2;B;REALIZACIÓN DE INFORMES TÉCNICOS Y JURÍDICOS SOBRE LAS INFRACCIONESCOMETIDAS EN MATERIA URBANÍSTICA, CONSUMO, HORARIOS D
1203;92001;2;C;REALIZACIÓN DE PROPUESTAS DE EXPEDIENTAS SANCIONADORES Y TRAMITACIÓN DELOS MISMOS.
1203;92001;3;A;ASESORAMIENTO LEGAL PRECEPTIVO AL CONCEJAL PRESIDENTE.
1203;92001;3;B;ELABORACIÓN DE INFORMES JURÍDICOS Y PROPUESTA DE RESOLUCIÓN EN EL ÁMBITOCOMPETENCIAL DE LA JUNTA.
1203;92001;3;C;CONVOCATORIA Y NOTIFICACIÓN DE LAS SESIONES ORDINARIAS Y EXTRAORDINARIASDE LA JUNTA MUNICIPAL.
1203;92001;4;A;MEJORAR LA GESTIÓN ECONÓMICA OPTIMIZANDO LA RECAUDACIÓN DE LOSINGRESOSRELATIVOS A LA COMPETENCIA DEL DISTRITO Y LA TRAM
1203;92001;5;A;TRAMITACIÓN DE LOS EXPEDIENTES ADMINISTRATIVOS PARA EL SUMINISTRO DEMATERIAL ORDINARIO NO INVENTARIABLE A TRAVÉS DEL PRO
1203;92001;5;B;TRAMITACIÓN DE CONTRATOS DE RENTING PARA FOTOCOPIADORAS.
1203;92001;5;C;GESTIÓN DEL PERSONAL ADSCRITO AL DISTRITO.
1203;92001;5;D;TRAMITACIÓN DE EXPEDIENTES DE CONTRATACIÓN DE COORDINACIÓN DE REDACCIONDE PROYECTOS DE OBRAS Y PLANES DE AUTOPROTECCION
1203;92001;5;E;PROYECTOS DE OBRAS Y PLANES DE AUTOPROTECCION
1203;92401;1;A;DISTRIBUCIÓN DE CONVOCATORIAS DE PLENOS A ASOCIACIONES DEL DISTRITO
1203;92401;1;B;DISTRIBUCIÓN DE CONVOCATORIAS DE CONSEJOS DE PROXIMIDAD
1203;92401;1;C;COORDINACIÓN DE LOS CONSEJOS DE PROXIMIDAD
1203;92401;2;A;TRAMITACIÓN DE SUBVENCIONES A LAS ENTIDADES CIUDADANAS DEL DISTRITO PARALA REALIZACIÓN DE ACTIVIDADES COMPLEMENTARIAS A
1203;93302;1;A;SUPERVISIÓN Y CONTROL DE LA PRESTACIÓN DEL SERVICIO DE CONSERVACIÓN Y LIMPIEZA DE EDIFICIOS PÚBLICOS DEL DISTRITO.
1203;93302;1;B;ELABORACIÓN, DIRECCIÓN Y SUPERVISIÓN DE LOS PROYECTOS DE OBRAS Y REFORMAS NECESARIOS EN LOS EDIFICIOS DEL DISTRITO.
1203;93302;1;C;INSPECCIÓN DE LOS EDIFICIOS AL OBJETO DE COMPROBAR LAS NECESIDADES QUE PRESENTAN SUS ELEMENTOS CONSTRUCTIVOS E INSTALACI
1203;93302;1;D;ADQUISICIÓN Y SIUSTITUCIÓN DE MOBILIARIO Y EQUIPAMIENTO DE OFICINAS Y EDIFICIOS DEL DISTRITO PARA USOS DIVERSOS.
1203;93302;2;A;REDACCIÓN Y EJECUCIÓN DE PLANES DE AUTOPROTECCIÓN EN EDIFICIOS DEL DISTRITO.
1203;93302;2;B;SUPERVISIÓN DEL BUEN FUNCIONAMIENTO DE LAS MEDIDAS DE SEGURIDADDE LOS EDIFICIOS.
1203;93302;2;C;REDACCIÓN Y EJECUCIÓN DE OBRAS PARA LA ADAPTACIÓN A LA NORMATIVA DE INCENDIOS.
1204;15322;1;A;REALIZACIÓN DE LAS OBRAS Y ACTUACIONES NECESARIAS SOLICITADAS POR PARTICULARES
1204;15322;2;A;DIRECCIÓN Y SUPERVISIÓN DE LOS PROYECTOS DE MEJORA URBANA COMPETENCIADEL DISTRITO
1204;15322;2;B;REALIZACIÓN DE LAS OBRAS DE MEJORA URBANA, QUE SUPONEN INCREMENTO DECAPITAL
1204;15322;2;C;COORDINACIÓN DE SEGURIDAD Y SALUD EN LAS OBRAS DE LA VÍA PÚBLICA,COMPETENCIA DEL DISTRITO
1204;17102;1;A;GARANTIZAR EL CIERRE NOCTURNO DE LOS PARQUES
1204;23102;1;A;INFORMACIÓN Y ORIENTACIÓN SOBRE LOS RECURSOS DE APOYO DISPONIBLES PARALA CRIANZA Y EDUCACIÓN DE LOS HIJOS
1204;23102;1;B;COORDINACIÓN CON LOS AGENTES INSTITUCIONALES Y ENTIDADES QUE GESTIONANLOS DIFERENTES RECURSOS DE FAMILIA
1204;23102;1;C;TRAMITACIÓN Y GESTIÓN DE LAS PRESTACIONES ECONÓMICAS SOLICITADAS YSUPERVISIÓN DE LAS CONCEDIDAS.
1204;23102;1;D;TRAMITACIÓN, GESTIÓN Y SEGUIMIENTO DE LAS SOLICITUDES DE AYUDAS ADOMICILIO PARA ATENCIÓN DE MENORES Y FAMILIA
1204;23102;1;E;SUPERVISIÓN DEL FUNCIONAMIENTO DEL SERVICIO DE AYUDA A DOMICILIODIRIGIDO A MENORES Y FAMILIA.
1204;23102;1;F;VALORACIÓN Y GESTIÓN DE LAS SOLICITUDES PARA RECURSOS SOCIO-EDUCATIVOSEN HORARIO EXTRAESCOLAR.
1204;23102;2;A;DETECCIÓN, VALORACIÓN E INTERVENCIÓN CON MENORES EN SITUACIÓN DE RIESGO.
1204;23102;2;B;PLANIFICACIÓN, GESTIÓN Y SUPERVISIÓN DE LOS PROGRAMAS DE APOYO SOCIALPARA LOS MENORES EN SITUACIÓN DE RIESGO.
1204;23102;2;C;COORDINACIÓN CON AGENTES E INSTITUCIONES COMPETENTES QUE INTERVIENEN CONMENORES Y ADOLESCENTES EN SITUACIÓN DE RIESGO.
1204;23102;3;A;DESARROLLO DEL TRABAJO EN RED Y COMUNITARIO
1204;23103;1;A;DIFUSIÓN DE LOS RECURSOS MUNICIPALES PARA LA ATENCIÓN A LAS NECESIDADESDE LOS MAYORES.
1204;23103;1;B;DETECCIÓN Y VALORACIÓN DE LAS SITUACIONES DE RIESGO PARA LAS PERSONASMAYORES.
1204;23103;1;C;GESTIÓN Y PRESTACIÓN DEL SERVICIO DE AYUDA A DOMICILIO.
1204;23103;1;D;INFORMACIÓN Y ORIENTACIÓN A LOS MAYORES PARA EL ACCESO A LASPRESTACIONES DEL SAAD (SISTEMA PARA LA AUTONOMÍA Y ATENCIÓN
1204;23103;1;E;GESTIÓN Y PRESTACIÓN DEL SERVICIO DE TELEASISTENCIA.
1204;23103;1;F;GESTIÓN Y PRESTACIÓN DEL SERVICIO DE COMIDAS A DOMICILIO.
1204;23103;1;G;GESTIÓN Y PRESTACIÓN DEL SERVICIO DE LAVANDERÍA.
1204;23103;1;H;GESTIÓN Y PRESTACIÓN DE MEDIOS MECÁNICOS PARA LOS MAYORES CON MOVILIDADREDUCIDA (CAMAS ARTICULADAS, GRÚAS,ETC.).
1204;23103;1;I;GESTIÓN Y PRESTACIÓN DE ADAPTACIONES GERIÁTRICAS EN LAS VIVIENDAS DE LOSMAYORES.
1204;23103;1;J;GESTIÓN Y COORDINACIÓN DE PROGRAMAS Y PROTOCOLOS DE COORDINACIÓN SOCIO-SANITARIA Y AISLAMIENTO
1204;23103;1;K;ATENCIÓN Y MATENIMIENTO DE LOS MAYORES EN SU ENTORNO
1204;23103;2;A;PROGRAMACIÓN Y DESARROLLO DE ACTIVIDADES Y TALLERES DE LOS CENTROS DEMAYORES.
1204;23103;2;B;PROGRAMACIÓN Y DESARROLLO DE ACTIVIDADES DE OCIO Y TIEMPO LIBRE(EXCURSIONES, SEMANAS Y SALIDAS CULTURALES) PARA LOS MAYO
1204;23103;2;C;MANTENIMIENTO Y CONSERVACIÓN DE LOS CENTROS DE MAYORES.
1204;23103;2;D;DOTACIÓN DE MEDIOS MATERIALES PARA EL DESARROLLO DE LAS PRESTACIONES YACTIVIDADES PROPIAS DE LOS CENTROS DE MAYORES.
1204;23103;2;E;ORGANIZACIÓN DEL VOLUNTARIADO EN LOS CENTROS DE MAYORES.
1204;23103;3;A;"GESTIÓN DEL PROGRAMA ""CUIDANDO AL CUIDADOR""."
1204;23103;3;B;"GESTIÓN DEL PROGRAMA DE ""RESPIRO FAMILIAR FIN DE SEMANA""."
1204;23103;4;A;GESTIÓN Y SEGUIMIENTO DE LAS SOLICITUDES DE PLAZAS EN LOS CENTROS DE DÍAY ALZHEIMER.
1204;23103;5;A;GESTIÓN, SUPERVISIÓN Y SEGUIMIENTO DE LAS SOLICITUDES DE PLAZAS DERESIDENCIAS DE MAYORES.
1204;23103;5;B;GESTIÓN Y CONTROL DE LAS AYUDAS ECONÓMICAS CONCEDIDAS.
1204;23106;1;A;ATENCIÓN DE LAS NECESIDADES Y DEMANDAS PLANTEADAS POR LOS CIUDADANOS ENLOS CENTROS DE SERVICIOS SOCIALES, PROPORCIONANDO
1204;23106;1;B;GESTIÓN Y TRAMITACIÓN DE PRESTACIONES SOCIALES DEL SISTEMA, TANTOMUNICIPALES COMO DE LA COMUNIDAD DE MADRID.
1204;23106;1;C;SEGUIMIENTO Y APOYO PERSONALIZADO DE LAS PERSONAS Y FAMILIAS EN PROCESODE ATENCIÓN SOCIAL.
1204;23106;2;A;ATENCIÓN DE LAS NECESIDADES Y DEMANDAS PLANTEADAS POR LOS CIUDADANOS ENLOS CENTROS DE SERVICIOS SOCIALES, PROPORCIONANDO
1204;23106;2;B;GESTIÓN Y TRAMITACIÓN DE PRESTACIONES SOCIALES DEL SISTEMA, TANTOMUNICIPALES COMO DE LA COMUNIDAD DE MADRID.
1204;23106;2;C;SEGUIMIENTO Y APOYO PERSONALIZADO DE LAS PERSONAS Y FAMILIAS EN PROCESODE ATENCIÓN SOCIAL.
1204;23106;3;A;TRAMITACIÓN Y GESTIÓN DE LA RENTA MÍNIMA DE INSERCIÓN.
1204;23106;3;B;GESTIÓN DE PROYECTOS DIRIGIDOS A PERSONAS EN RIESGO DE EXCLUSIÓN SOCIAL.
1204;23106;3;C;COORDINACIÓN DE LAS ACTUACIONES CON LA RED DE ATENCIÓN DE PERSONAS SINHOGAR
1204;23106;3;D;TRAMITACIÓN Y GESTIÓN DE AYUDAS ECONÓMICAS TARJETAS FAMILIAS.
1204;23106;4;A;ATENCIÓN DE LAS NECESIDADES Y DEMANDAS PLANTEADAS POR LAS PERSONASAFECTADAS POR LA PÉRDIDA DE VIVIENDA
1204;23106;4;B;GESTIÓN Y TRAMITACIÓN DE PRESTACIONES SOCIALES Y RECURSOS TANTO DELDISTRITO COMO DEL AYUNTAMIENTO Y COMUNIDAD DE MADRID
1204;23106;4;C;SEGUIMIENTO Y APOYO PERSONALIZADO DE LAS PERSONAS Y FAMILIAS ENSITUACIÓN DE EMERGENCIA RESIDENCIAL
1204;23106;5;A;PROMOVER EL TRABAJO COMUNITARIO
1204;23106;6;A;SERVICIO DE MEDIACIÓN INTERCULTURAL
1204;23106;6;B;PARTICIPACIÓN EN LA RED COMUNITARIA DEL DISTRITO
1204;31101;1;A;CONTROL OFICIAL EN ESTABLECIMIENTOS DONDE SE ELABORAN, VENDEN O SIRVENALIMENTOS Y BEBIDAS.
1204;31101;1;B;TOMA DE MUESTRAS DE ALIMENTOS Y BEBIDAS PARA SU ANÁLISIS EN ELLABORATORIO DE SALUD PÚBLICA.
1204;31101;1;C;ELABORACIÓN DE INFORMES SANITARIOS PARA LA CONCESIÓN DE LICENCIASURBANÍSTICAS, REGISTROS Y AUTORIZACIONES SANITARIAS.
1204;31101;1;D;ELABORACIÓN DE INFORMES SANITARIOS, REQUERIMIENTOS Y, EN SU CASO,PROPUESTA DE SANCIÓN, A LOS ESTABLECIMIENTOS.
1204;31101;2;A;REALIZACIÓN DE INSPECCIONES DE LOS DISTINTOS ESTABLECIMIENTOS.
1204;31101;2;B;ELABORACIÓN DE INFORMES SANITARIOS, REQUERIMIENTOS Y, EN SU CASO,PROPUESTA DE SANCIÓN A LOS ESTABLECIMIENTOS.
1204;31101;2;C;REALIZACIÓN DE INSPECCIONES EN PISCINAS.
1204;31101;2;D;TOMA DE MUESTRAS DE AGUA EN PISCINAS PARA SU ANÁLISIS EN EL LABORATORIODE SALUD PÚBLICA.
1204;31101;3;A;REALIZACIÓN DE INSPECCIONES DE LOS DISTINTOS ESTABLECIMIENTOS.
1204;31101;3;B;REALIZACIÓN DE LAS CAMPAÑAS DE IDENTIFICACIÓN ANIMAL Y VACUNACIÓNANTIRRÁBICA.
1204;31101;3;C;GESTIÓN DE LAS DENUNCIAS SOBRE TENENCIA DE ANIMALES DOMÉSTICOS.
1204;31101;3;D;TRAMITACIÓN DE LICENCIAS PARA LA TENENCIA DE ANIMALES POTENCIALMENTEPELIGROSOS.
1204;31101;3;E;ELABORACIÓN DE INFORMES SANITARIOS PARA LA CONCESIÓN DE LICENCIASURBANÍSTICAS Y REGISTROS.
1204;31101;3;F;ELABORACIÓN DE INFORMES SANITARIOS, REQUERIMIENTOS Y, EN SU CASO,PROPUESTA DE SANCIÓN A LOS ESTABLECIMIENTOS.
1204;31101;3;G;ATENDER Y GESTIONAR CON LOS DEPARTAMENTOS MUNICIPALES COMPETENTES LASDENUNCIAS DE LOS CIUDADANOS RELACIONADAS CON PALOMA
1204;31101;4;A;ELABORACIÓN DE PROPUESTAS DE SANCIÓN.
1204;31101;4;B;EJECUCIÓN DE MEDIDAS CAUTELARES.
1204;32301;1;A;SUPERVISIÓN DE LA GESTIÓN DE LA ESCUELA MUNICIPAL INFANTIL DE GESTIÓNINDIRECTA RUIZ JIMÉNEZ.
1204;32301;1;B;TRAMITACIÓN DE LA CONTRATACIÓN Y LA FACTURACIÓN DE LAS ESCUELASINFANTILES MUNICIPALES DEL DISTRITO.
1204;32301;2;A;INFORMACIÓN, ORIENTACIÓN Y ASESORAMIENTO EN MATERIA EDUCATIVA A COLEGIOSY FAMILIAS DEL DISTRITO.
1204;32301;2;B;REUNIONES DE COORDINACIÓN CON AMPAS, EQUIPOS DIRECTIVOS Y OTROS RECURSOSEDUCATIVOS DEL DISTRITO.
1204;32301;2;C;ASISTENCIA Y COLABORACIÓN CON LAS COMISIONES DE ATENCIÓN A LA INFANCIA.
1204;32301;3;A;DIRECCIÓN Y SUPERVISIÓN DE LA PRESTACIÓN DEL SERVICIO DE MANTENIMIENTO YLIMPIEZA EN LOS COLEGIOS Y CENTROS EDUCATIVOS PÚ
1204;32301;3;B;REALIZACIÓN DE LAS OBRAS DE CONSERVACIÓN NECESARIAS EN LOS COLEGIOS YCENTROS EDUCATIVOS, QUE SUPONEN INCREMENTO DE CAPIT
1204;32301;3;C;REALIZACIÓN DE LAS OBRAS DE CONSERVACIÓN Y MANTENIMIENTO NECESARIAS ENLOS COLEGIOS Y CENTROS EDUCATIVOS, PARA
1204;32301;3;D;COORDINACIÓN DE SEGURIDAD Y SALUD EN LAS OBRAS DE LOS COLEGIOS Y CENTROSEDUCATIVOS DEL DISTRITO.
1204;32601;1;A;CONCILIACIÓN DE LA VIDA LABORAL Y FAMILIAR
1204;32601;1;B;COLABORACIÓN CON LA DIRECCIÓN GENERAL DE EDUCACIÓN EN EL SEGUIMIENTO DELOS CENTROS ABIERTOS
1204;32601;1;C;APOYO PSICOSOCIAL Y EDUCATIVO EN CENTROS EDUCATIVOS DE INFANTIL YPRIMARIA
1204;32601;1;D;PROMOVER Y DINAMIZAR LA  PARTICIPACIÓN DE LA INFANCIA Y LA ADOLESCENCIADEL DISTRITO /COPIA
1204;32601;1;E;PROMOVER LA MOTIVACION E INTERES EN EL APRENDIZAJE DE LAS CIENCIAS Y LAEXPERIMENTACIÓN
1204;32601;1;F;CONCILIACIÓN DE LA VIDA LABORAL Y FAMILIAR, EDUCACIÓN AMBIENTAL YEMOCIONAL AL ALUMNADO DE CEIP PÚBLICOS Y  SERVICIOS SOC
1204;32601;1;G;SUMINISTROS PARA DAR APOYO A  PROYECTOS DE LA COMISIÓN DE PARTICIPACIÓNDE INFANCIA Y ADOLESCENCIA COPIA
1204;32601;1;H;PROYECTO DE EDUCACIÓN PARA EVITAR VIOLENCIA DE GÉNERO EN LA POBLACIÓNJUVENIL
1204;32601;1;I;PROMOVER LA EDUCACIÓN AMBIENTAL Y MEJORA DEL ENTORNO CONVIVENCIAL ENCENTROS EDUCATIVOS /PATIOS CEIP
1204;33401;1;A;PROGRAMACIÓN DE LAS ACTIVIDADES CULTURALES (EXPOSICIONES, CONCIERTOS,OBRAS DE TEATRO, DANZA, CINE, CONFERENCIAS, ETC.).
1204;33401;1;B;GESTIÓN Y COORDINACIÓN DEL PROGRAMA DE ACTIVIDADES CULTURALES.
1204;33401;1;C;PROGRAMACIÓN DE ACTIVIDADES CULTURALES INFANTILES (PAYASOS, MAGIA,TÍTERES, ETC.) Y JUVENILES.
1204;33401;1;D;CESIÓN DE ESPACIOS Y MEDIOS DE LOS CENTROS CULTURALES A ENTIDADESPÚBLICAS Y PRIVADAS.
1204;33401;1;E;MEJORAR LOS ESPACIOS CULTURALES MEDIANTE LAS CORRESPONDIENTESACTUACIONES DE REFORMA Y ACONDICIONAMIENTO.
1204;33401;2;A;PROGRAMACIÓN DE CURSOS DE ACTIVIDADES CULTURALES (MUSICAL, IDIOMAS,DANZA, PLÁSTICA, NUEVAS TECNOLOGÍAS).
1204;33401;2;B;GESTIÓN Y SUPERVISIÓN DE LA REALIZACIÓN DE LOS CURSOS DE ACTIVIDADESCULTURALES.
1204;33401;3;A;PROGRAMACIÓN Y GESTIÓN DE FESTEJOS POPULARES (FIESTAS PATRONALES,CABALGATA NAVIDAD, CARNAVALES, FIESTAS DE PRIMAVERA, ET
1204;33401;3;B;COLABORACIÓN CON ENTIDADES DEL DISTRITO PARA LA CELEBRACIÓN DE FESTEJOSEN EL VECINDARIO.
1204;33401;4;A;EDICIÓN DEL PROGRAMA DE ACTIVIDADES CULTURALES.
1204;33401;4;B;DISTRIBUCIÓN DEL PROGRAMA DE ACTIVIDADES CULTURALES A DESARROLLAR EN LOSCENTROS CULTURALES PARA SU CONOCIMIENTO POR LOS
1204;34201;1;A;GESTIÓN DE LAS INSTALACIONES DEPORTIVAS MUNICIPALES.
1204;34201;2;A;PLANIFICACIÓN, PROGRAMACIÓN Y GESTIÓN DE LAS CLASES Y ESCUELASDEPORTIVAS.
1204;34201;2;B;PLANIFICACIÓN, PROGRAMACIÓN Y GESTIÓN DE ALQUILERES, CESIONES Y USOSLIBRES DE UNIDADES DEPORTIVAS.
1204;34201;2;C;PLANIFICACIÓN, PROGRAMACIÓN Y GESTIÓN DE LAS ESCUELAS DE PROMOCIÓNDEPORTIVA PARA CENTROS ESCOLARES.
1204;34201;2;D;GESTIÓN DEL PROGRAMA MÉDICO DEPORTIVO.
1204;34201;2;E;ESTABLECIMIENTO DE RESERVA Y PAGO DE SERVICIOS DEPORTIVOS POR INTERNETQUE EVITARÁ DESPLAZAMIENTOS Y ESPERAS
1204;34201;3;A;REDACCIÓN DE PROYECTOS PARA OBRAS DE REFORMA, REPARACIÓN O CONSERVACIÓNQUE SUPONEN INCREMENTO DE CAPITAL.
1204;34201;3;B;REDACCIÓN DE PROYECTOS PARA OBRAS DE  CONSERVACIÓN O MANTENIMIENTO.
1204;34201;3;C;COORDINACIÓN DE LA SEGURIDAD Y SALUD DE LAS OBRAS EN EDIFICIOS EINSTALACIONES DEPORTIVAS.
1204;34201;3;D;MANTENIMIENTO DE LA INSTALACIÓN DEPORTIVA.
1204;34201;3;E;SEGUMIENTO Y CONTROL DEL MANTENIMIENTO DE LAS INSTALACIONES BÁSICASDEPORTIVAS DEL DISTRITO Y CENTRO DEPORTIVO MUNICIPAL,
1204;34201;3;F;IMPLANTACIÓN DEL PLAN DE AUTOPROTECCIÓN EN LOS EDIFICIOS E INSTALACIONESDEPORTIVAS.
1204;34201;4;A;INCORPORAR LA PERSPECTIVA DE GÉNERO Y EVITAR UN USO DEL LENGUAJE YDE IMÁGENES SEXISTA
1204;34201;4;B;FOMENTAR LOS VALORES DE IGUALDAD, CORRESPONSABILIDAD Y LA ATENCIÓN ALA DIVERSIDAD
1204;34201;4;C;VERIFICAR LA ASISTENCIA DE MUJERES A LAS INSTALACIONES Y ACTIVIDADESDEPORTIVAS DIRIGIDAS, CREANDO LAS HERRAMIENTAS NECES
1204;49300;1;A;INSPECCIONES Y CONTROL DE ESTABLECIMIENTOS EN MATERIA DE CONSUMO NOALIMENTARIO.
1204;49300;1;B;ELABORACIÓN DE INFORMES DE CONSUMO, REQUERIMIENTOS Y, EN SU CASO,PROPUESTA DE SANCIÓN A LOS ESTABLECIMIENTOS.
1204;49300;2;A;TRAMITACIÓN DE LAS DENUNCIAS Y RECLAMACIONES.
1204;49300;2;B;INFORMACIÓN Y ASESORAMIENTO AL CONSUMIDOR.
1204;49300;2;C;ELABORACIÓN DE INFORMES EN MATERIA DE CONSUMO.
1204;49300;2;D;MEDIACIÓN EN LOS CONFLICTOS ENTRE CONSUMIDORES Y EMPRESARIOS PROPICIANDOLA RESOLUCIÓN VOLUNTARIA Y FAVORABLE PARA EL CON
1204;49300;3;A;ELABORACIÓN DE PROPUESTAS DE SANCIÓN.
1204;49300;3;B;EJECUCIÓN DE MEDIDAS CAUTELARES.
1204;92001;1;A;TRAMITACIÓN DE LOS EXPEDIENTES ADMINISTRATIVOS PARA EL SUMINISTRO DEMATERIAL ORDINARIO NO INVENTARIABLE A TRAVÉS DEL PRO
1204;92001;1;B;GESTIÓN DEL PERSONAL ADSCRITO AL DISTRITO.
1204;92001;1;C;TRAMITACIÓN DE EXPEDIENTES DE CONTRATACIÓN DE COORDINACIÓN DE SEGURIDADY SALUD EN LAS OBRAS QUE SE EJECUTAN CON CARGO AL
1204;92001;1;D;TRAMITACIÓN DE EXPEDIENTES DE CONTRATACIÓN (PRENSA EN LOS EDIFICIOSMUNICIPALES, VESTUARIO, DESTRUCCION DE PAPEL, ETC.).
1204;92001;1;E;SUPERVISIÓN DEL BUEN FUNCIONAMIENTO DE LAS MEDIDAS DE SEGURIDAD DE LOSEDIFICIOS.
1204;92001;2;A;GESTIÓN DE LOS INGRESOS RELATIVOS A LAS COMPETENCIAS DEL DISTRITO.
1204;92001;2;B;GESTIÓN Y TRAMITACIÓN DE LOS EXPEDIENTES DE GASTO.
1204;92001;3;A;ASESORAMIENTO LEGAL PRECEPTIVO AL CONCEJAL PRESIDENTE.
1204;92001;3;B;ELABORACIÓN DE INFORMES JURÍDICOS Y PROPUESTA DE RESOLUCIÓN EN EL ÁMBITOCOMPETENCIAL DE LA JUNTA.
1204;92001;3;C;CONVOCATORIA Y NOTIFICACIÓN DE LAS SESIONES ORDINARIAS Y EXTRAORDINARIASDE LA JUNTA MUNICIPAL.
1204;92001;4;A;GESTIÓN DE EXPEDIENTES DE LICENCIAS URBANÍSTICAS.
1204;92001;4;B;GESTIÓN DE EXPEDIENTES DE AUTORIZACIÓN DE OCUPACIÓN DEL DOMINIO PÚBLICO.
1204;92001;5;A;REALIZACIÓN DE INSPECCIONES DE OFICIO O A SOLICITUD DE LOS CIUDADANOS.
1204;92001;5;B;REALIZACIÓN INFORMES TÉCNICOS Y JURÍDICOS SOBRE LAS INFRACCIONESCOMETIDAS EN MATERIA URBANÍSTICA, CONSUMO, HORARIOS DE A
1204;92001;5;C;REALIZACIÓN DE PROPUESTAS DE EXPEDIENTES SANCIONADORES Y TRAMITACIÓN DELOS MISMOS.
1204;92001;6;A;RECEPCIÓN Y RESPUESTA A LAS SUGERENCIAS Y RECLAMACIONES.
1204;92401;1;A;DISTRIBUCIÓN DE CONVOCATORIAS DE PLENOS A ASOCIACIONES DEL DISTRITO.
1204;92401;1;B;DISTRIBUCIÓN DE CONVOCATORIAS DE CONSEJOS TERRITORIALES
1204;92401;1;C;COORDINACIÓN DE LOS CONSEJOS TERRITORIALES.
1204;92401;2;A;TRAMITACIÓN DE SUBVENCIONES A LAS ENTIDADES CIUDADANAS DEL DISTRITO PARALA REALIZACIÓN DE ACTIVIDADES COMPLEMENTARIAS A
1204;92401;3;A;TRAMITACIÓN Y ORGANIZACIÓN DEL CONCURSO DE FACHADAS Y ESCAPARATESNAVIDEÑOS  Y DEL CERTAMEN DE ARTES ESCÉNICAS PARA GRUPO
1204;93302;1;A;SUPERVISIÓN Y CONTROL DE LA PRESTACIÓN DEL SERVICIO DE CONSERVACIÓN YLIMPIEZA DE EDIFICIOS PÚBLICOS DEL DISTRITO.
1204;93302;1;C;INSPECCIÓN DE LOS EDIFICIOS AL OBJETO DE COMPROBAR LAS NECESIDADES QUEPRESENTAN SUS ELEMENTOS CONSTRUCTIVOS E INSTALACIO
1204;93302;1;D;ELABORACIÓN, DIRECCIÓN Y SUPERVISIÓN DE LOS PROYECTOS DE OBRAS DECONSERVACIÓN Y MANTENIMIENTO NECESARIOS EN LOS EDIFICIO
1204;93302;1;F;ADQUISICIÓN Y SUSTITUCIÓN DE MOBILIARIO Y EQUIPAMIENTO DE OFICINAS YEDIFICIOS DEL DISTRITO PARA USOS DIVERSOS
1204;93302;2;A;REVISIÓN, ACTUALIZACIÓN O MANTENIMIENTO DE LOS PLANES DE AUTOPROTECCIÓN,CON IMPLANTACIÓN DE LOS MISMOS, SI PROCEDE.
1204;93302;2;B;ELABORACIÓN, DIRECCIÓN Y SUPERVISIÓN DE LOS PROYECTOS DE OBRAS YREFORMAS NECESARIOS EN LOS EDIFICIOS DEL DISTRITO.
1204;93302;2;C; COORDINACIÓN DE LA SEGURIDAD Y SALUD EN LAS OBRAS
1205;15322;1;A;CONTRATACIÓN DE LOS SERVICIOS A PRESTAR, MEDIANTE LA OPORTUNAADJUDICACIÓN DE LA ACTUACIÓN PARA LA EJECUCIÓN DE LA OBRA
1205;15322;1;B;ESTUDIO Y MEDICIÓN DE LA DEMANDA, MEDIANTE MEDICIÓN IN SITU DE LA OBRAAREALIZAR Y VALORACIÓN A LOS PRECIOS DE LA ORDENA
1205;15322;1;C;APROBACIÓN DE LA LIQUIDACIÓN DE PRECIO PÚBLICO, EN SU CASO, Y TRASLADOAL INTERESADO.
1205;15322;1;D;APROBACIÓN, DIRECCIÓN Y MEDICIÓN DE OBRA.
1205;15322;1;E;LIQUIDACIONES AL CONTRATISTA MEDIANTE LA OPORTUNA RELACIÓN VALORADA YCERTIFICACIÓN, Y AL PARTICULAR MEDIANTE LA LIQUIDAC
1205;17102;1;A;CONTRATACIÓN DE LOS SERVICIOS A PRESTAR, MEDIANTE LA OPORTUNAADJUDICACIÓN DE LA ACTUACIÓN PARA LA EJECUCIÓN DE LA OBRA
1205;17102;1;B;ESTUDIO Y MEDICIÓN DE LA DEMANDA, MEDIANTE MEDICIÓN IN SITU DE LA OBRA AREALIZAR Y VALORACIÓN AL CUADRO DE PRECIOS MUNIC
1205;17102;1;C;APROBACIÓN, DIRECCIÓN Y MEDICIÓN DE OBRA.
1205;17102;1;D;LIQUIDACIONES AL CONTRATISTA MEDIANTE LA OPORTUNA RELACIÓN VALORADA YCERTIFICACIÓN.
1205;23102;1;A;INFORMACIÓN, VALORACIÓN Y SEGUIMIENTO SOBRE LOS RECURSOS DE ATENCIÓN ALA CONCILIACIÓN FAMILIAR: CENTROS DE DÍA.
1205;23102;1;B;COORDINACIÓN CON LOS AGENTES INSTITUCIONALES Y ENTIDADES QUE GESTIONANLOS DIFERENTES RECURSOS DE FAMILIA.
1205;23102;1;C;VALORACIÓN, GESTIÓN Y SEGUIMIENTO DEL SERVICIO DE AYUDA A DOMICILIO PARAATENCIÓN DE MENORES Y FAMILIA
1205;23102;1;D;VALORACIÓN, GESTIÓN Y SEGUIMIENTO DE LAS AYUDAS ECONÓMICAS SOLICITADAS.
1205;23102;1;E;VALORACIÓN Y GESTIÓN DE SOLICITUDES DE RECURSOS SOCIO-EDUCATIVOS ENHORARIO EXTRAESCOLAR.
1205;23102;2;A;DETECCIÓN, VALORACIÓN E INTERVENCIÓN SOCIAL Y EDUCATIVA CON MENORES ENSITUACIÓN DE RIESGO.
1205;23102;2;B;PLANIFICACIÓN, GESTIÓN Y SUPERVISIÓN DE LOS PROGRAMAS DE APOYO SOCIALPARA LOS MENORES EN SITUACIÓN DE RIESGO.
1205;23102;2;C;COORDINACIÓN CON AGENTES E INSTITUCIONES COMPETENTES QUE INTERVIENEN CONMENORES Y ADOLESCENTES EN SITUACIÓN DE RIESGO.
1205;23102;3;A;VALORACIÓN SOCIAL DE LA SITUACION DE NECESIDAD.
1205;23102;3;B;GESTIÓN Y SEGUIMIENTO DE AYUDAS ECONÓMICAS SOLICITADAS.
1205;23103;1;A;DIFUSIÓN DE LOS RECURSOS MUNICIPALES PARA LA ATENCIÓN A LAS NECESIDADESDE LOS MAYORES.
1205;23103;1;B;DETECCIÓN Y VALORACIÓN DE LAS SITUACIONES DE RIESGO PARA LAS PERSONASMAYORES.
1205;23103;1;C;GESTIÓN Y PRESTACIÓN DEL SERVICIO DE AYUDA A DOMICILIO.
1205;23103;1;D;GESTIÓN Y PRESTACIÓN DEL SERVICIO DE TELEASISTENCIA.
1205;23103;1;E;GESTIÓN Y PRESTACIÓN DEL SERVICIO DE COMIDAS A DOMICILIO.
1205;23103;1;F;GESTIÓN Y PRESTACIÓN DEL SERVICIO DE LAVANDERÍA.
1205;23103;1;G;GESTIÓN Y PRESTACIÓN DE MEDIOS MECÁNICOS PARA PERSONAS CON MOVILIDADREDUCIDA (CAMAS ARTICULADAS, SILLAS DE RUEDAS, ETC.)
1205;23103;1;H;GESTIÓN Y PRESTACIÓN DE ADAPTACIONES GERIÁTRICAS EN LAS VIVIENDAS DE LOSMAYORES.
1205;23103;2;A;INFORMACIÓN Y ORIENTACIÓN SOBRE LOS SERVICOS BÁSICOS QUE PRESTAN LOSCENTROS: TARJETA MADRID MAYOR, PODOLOGÍA, BIBLIOTECA
1205;23103;2;B;PROGRAMACIÓN Y DESARROLLO DEL PROGRAMA DE DINAMIZACIÓN SOCIAL: TALLERES,ACTIVIDADES PARTICIPATIVAS, ACTIVIDADES INTERGEN
1205;23103;2;C;ORGANIZACIÓN DEL VOLUNTARIADO EN LOS CENTROS DE MAYORES.
1205;23103;2;D;ORGANIZACIÓN DEL SERVICIO DE COMIDA Y CAFETERIA EN LOS CENTROS DEMAYORES.
1205;23103;3;A;"GESTIÓN DEL PROGRAMA ""CUIDANDO A QUIENES CUIDAN""."
1205;23103;3;B;INFORMACIÓN Y GESTIÓN DE LAS ESTANCIAS TEMPORALES EN RESIDENCIAS DEMAYORES DURANTE LAS VACACIONES FAMILIARES.
1205;23103;4;A;VALORACIÓN, GESTIÓN Y SEGUIMIENTO DE LA PRESTACIÓN DE CENTROS DE DÍA(FÍSICO Y COGNITIVO).
1205;23103;5;A;VALORACIÓN, GESTIÓN Y SEGUIMIENTO DE LAS SOLICITUDES DE PLAZAS EN PISOSTUTELADOS, RESIDENCIAS DE MAYORES DE EMERGENCIA Y
1205;23103;5;B;GESTIÓN Y CONTROL DE LAS AYUDAS ECONÓMICAS CONCEDIDAS.
1205;23106;1;A;ATENCIÓN A LAS NECESIDADES Y DEMANDAS PLANTEADAS POR LOS CIUDADANOS ENLOS CENTROS DE SERVICIOS SOCIALES, PROPORCIONANDO
1205;23106;1;B;GESTIÓN Y TRAMITACIÓN DE PRESTACIONES SOCIALES DEL SISTEMA, TANTOMUNICIPALES COMO DE LA COMUNIDAD DE MADRID.
1205;23106;1;C;SEGUIMIENTO Y APOYO PERSONALIZADO DE LAS PERSONAS Y FAMILIAS EN PROCESODE ATENCIÓN SOCIAL.
1205;23106;1;D;COMPLEMENTAR LA INTERVENCIÓN SOCIAL MEDIANTE LA INCORPORACIÓNPSICOLÓGICA.
1205;23106;1;E;ELABORACIÓN DE PROGRAMAS Y ACTUACIONES EN RED CON ENTIDADES SOCIALES.
1205;23106;2;A;ATENCIÓN, VALORACIÓN Y GESTIÓN DE LAS DEMANDAS DE ATENCIÓN DOMICILIARIAPARA PERSONAS DISCAPACITADAS.
1205;23106;2;B;COORDINACIÓN Y SUPERVISIÓN DEL SERVICIO PRESTADO POR LA EMPRESAADJUDICATARIA PARA ASEGURAR LA CALIDAD EN LA ATENCIÓN.
1205;23106;2;C;TRAMITACIÓN Y SEGUIMIENTO DE AYUDAS ECONÓMICAS.
1205;23106;2;D;GESTIÓN DE LOS RECURSOS DE LA COMUNIDAD DE MADRID: CENTROS PARAMINUSVÁLIDOS FÍSICOS Y PSÍQUICOS.
1205;23106;2;E;SENSIBILIZAR Y VISUALIZAR LA PROBLEMÁTICA Y CONTRIBUIR A SU INTEGRACIÓNEN LA VIDA SOCIAL Y COMUNITARIA DE LAS PERSONAS C
1205;23106;3;A;TRAMITACIÓN Y GESTIÓN DE LA RENTA MÍNIMA DE INSERCIÓN.
1205;23106;3;B;COORDINACIÓN DE LAS ACTUACIONES CON LA RED DE ATENCIÓN DE PERSONAS SINHOGAR QUE DESARROLLAN PROYECTOS ESPECÍFICOS DE INS
1205;23106;4;A;INFORMACIÓN, ORIENTACIÓN Y DERIVACIÓN DE LAS DEMANDAS DETECTADAS HACIALOS RECURSOS ESPECÍFICOS DE LA RED DE ATENCIÓN A P
1205;23106;4;B;ELABORACION DE INFORMES SOCIALES PARA LA DEMORA DE LAS RESOLUCIONES DEDESAHUCIOS
1205;23106;4;C;TRAMITACIÓN DE AYUDAS ECONÓMICAS.
1205;31101;1;A;CONTROL OFICIAL EN ESTABLECIMIENTOS DONDE SE ELABORAN, VENDEN O SIRVENALIMENTOS Y BEBIDAS.
1205;31101;1;B;AUDITORÍAS INICIALES Y/O DE SEGUIMIENTO DE SISTEMAS DE AUTOCONTROL(PRÁCTICAS CORRECTAS DE HIGIENE Y ANÁLISIS DE PELIGROS
1205;31101;1;C;TOMA DE MUESTRAS DE ALIMENTOS Y BEBIDAS PARA SU ANÁLISIS EN ELLABORATORIO DE SALUD PÚBLICA.
1205;31101;1;D;ELABORACIÓN DE INFORMES SANITARIOS PARA LA CONCESIÓN DE LICENCIASURBANÍSTICAS Y AUTORIZACIONES.
1205;31101;1;E;DETERMINACIÓN DE LOS PERFILES DE RIESGO SANITARIO DE CADAESTABLECIMIENTO.
1205;31101;2;A;REALIZACIÓN DE INSPECCIONES DE LOS DISTINTOS ESTABLECIMIENTOS EINTRODUCCIÓN DE LAS FICHAS PROTOCOLOS EN EL SOPORTE INFOR
1205;31101;2;B;ELABORACIÓN DE INFORMES SANITARIOS, REQUERIMIENTOS Y, EN SU CASO,PROPUESTA DE SANCIÓN A LOS ESTABLECIMIENTOS.
1205;31101;2;C;"REALIZACIÓN DE INSPECCIONES EN PISCINAS Y BALNEARIOS. ANÁLISIS ""INSITU""."
1205;31101;2;D;TOMA DE MUESTRAS DE AGUA EN PISCINAS Y BALNEARIOS  PARA SU ANÁLISIS ENEL LABORATORIO DE SALUD PÚBLICA.
1205;31101;2;E;ELABORACIÓN DE INFORMES SANITARIOS PARA LA CONCESIÓN DE LICENCIASURBANÍSTICAS Y AUTORIZACIONES.
1205;31101;3;A;REALIZACIÓN DE INSPECCIONES DE LOS DISTINTOS ESTABLECIMIENTOS QUEDESARROLLAN ACTIVIDADES ECONÓMICO-PECUARIAS.
1205;31101;3;B;GESTIÓN DE LAS DENUNCIAS SOBRE TENENCIA DE ANIMALES DOMÉSTICOS OPOBLACIONES NO CONTROLADAS.
1205;31101;3;C;TRAMITACIÓN DE LICENCIAS PARA LA TENENCIA DE ANIMALES POTENCIALMENTEPELIGROSOS.
1205;31101;3;D;ELABORACIÓN DE INFORMES SANITARIOS PARA LA INSCRIPCIÓN DEL REGISTRO DENÚCLEOS ZOOLÓGICOS.
1205;31101;3;E;ELABORACIÓN DE INFORMES SANITARIOS, REQUERIMIENTOS Y, EN SU CASO,PROPUESTA DE SANCIÓN A LOS ESTABLECIMIENTOS.
1205;31101;4;A;ELABORACIÓN DE PROPUESTAS DE SANCIÓN.
1205;31101;4;B;EJECUCIÓN DE MEDIDAS CAUTELARES.
1205;32301;1;A;GESTIÓN DEL PROGRAMA DE EDUCACIÓN EMOCIONAL (ESCUELA DE FAMILIAS).
1205;32301;1;B;ATENCIÓN AL PÚBLICO PARA INFORMACIÓN, ORIENTACIÓN Y ASESORAMIENTO ENMATERIA EDUCATIVA (PRESENCIAL, TELEFÓNICA Y MEDIANTE
1205;32301;1;C;REUNIONES DE COORDINACIÓN CON AMPAS, EQUIPOS EDUCATIVOS Y OTROS RECURSOS DEL DISTRITO.
1205;32301;2;A;PARTICIPACIÓN EN EL SERVICIO DE APOYO A LA ESCOLARIZACIÓN DE ESCUELASINFANTILES MUNICIPALES DURANTE EL PERÍODO DE ESCOLA
1205;32301;3;A;GESTIÓN DIRECTA ESCUELA INFANTIL EL SOL
1205;32301;3;B;GESTIÓN INDIRECTA ESCUELA INFANTIL LUIS BELLO
1205;32301;4;A;COORDINACIÓN, DIRECCIÓN Y EJECUCIÓN DE LOS PLANES DE AUTOPROTECCIÓN ENLOS COLEGIOS Y CENTROS EDUCATIVOS DEL DISTRITO.
1205;32301;4;B;DIRECCIÓN Y SUPERVISIÓN DE LA PRESTACIÓN DEL SERVICIO DE  MANTENIMIENTOY LIMPIEZA EN LOS COLEGIOS Y CENTROS EDUCATIVOS P
