5;FONDO DE REEQUILIBRIO TERRITORIAL;1;150;17213;60999;2023/003004;2023/003004;CAMPOS DE FÚTBOL EN VALDEBEBAS (INSTALACIONES SOTENIBLES). CONSTRUCCIÓN (ID 21: 17695);216;HORTALEZA;11;DEPORTES, JUVENTUD  Y ESPARCIMIENTO;2;PISTAS DEPORTIVAS ELEMENTALES;;;;;18;PRESUPUESTOS PARTICIPATIVOS;1800000;0;1800000;1800000;0;0;0;0;0;0
;;1;151;16001;60914;2015/000224;2015/000224;AUMENTO DE LA CAPACIDAD DEL DESAGÜE DEL TRAMO INFERIOR ARROYO DE LOS MIGUELES;219;VICALVARO;9;MEDIO AMBIENTE;3;ALCANTARILLADO Y COLECTORES;;;;;;;300000;0;300000;300000;0;0;0;0;0;0
;;1;151;16001;60914;2021/000235;2021/000235;INTERVENCIONES EN COLECTORES, ACTUACIONES DE DRENAJE Y DESAGÜE;998;VARIOS DISTRITOS;9;MEDIO AMBIENTE;3;ALCANTARILLADO Y COLECTORES;;;;;;;50000;-958;49042;49042;0;0;0;0;0;0
;;1;151;16001;60914;2023/001138;2023/001138;COLECTORES DE VICÁLVARO B Y LA DEHESA. OBRAS DE CONEXIÓN;219;VICALVARO;9;MEDIO AMBIENTE;3;ALCANTARILLADO Y COLECTORES;;;;;;;1273366;0;1273366;2,31;0;1273363,69;1273363,69;28246,74;0;4742,96
;;1;151;16001;60914;2023/001139;2023/001139;PLAZA DE MANUEL BECERRA. HOMOLOGACIÓN SISTEMA DE DRENAJE DE AGUAS PLUVIALES;204;SALAMANCA;9;MEDIO AMBIENTE;3;ALCANTARILLADO Y COLECTORES;;;;;;;162104;958;163062;0,75;0;163061,25;163061,25;0;0;0
;;1;151;16001;60914;2023/001140;2023/001140;RÍO MANZANARES. OBRAS DE DEMOLICIÓN DE ALIVIADEROS EN DESUSO;998;VARIOS DISTRITOS;9;MEDIO AMBIENTE;3;ALCANTARILLADO Y COLECTORES;;;;;;;599108;0;599108;599108;0;0;0;0;0;0
;;1;151;16001;60914;2024/001005;2024/001005;REDACCIÓN PROYECTOS INGENIERÍA DEL AGUA;998;VARIOS DISTRITOS;9;MEDIO AMBIENTE;3;ALCANTARILLADO Y COLECTORES;;;;;;;50000;0;50000;50000;0;0;0;0;0;0
1;INCORPORACIONES REMANENTES OBLIGATORIAS;1;151;16001;60914;2015/000224;2015/000224;AUMENTO DE LA CAPACIDAD DEL DESAGÜE DEL TRAMO INFERIOR ARROYO DE LOS MIGUELES;219;VICALVARO;9;MEDIO AMBIENTE;3;ALCANTARILLADO Y COLECTORES;;;;;;;0;4388429,75;4388429,75;4388429,75;0;0;0;0;0;0
;;1;151;16001;60916;2023/001348;2023/001348;OBRAS EJECUCIÓN DE INSTALACIONES HIDRAULICAS DE FUENTES BEBEDERO EN LA CIUDAD DE MADRID;998;VARIOS DISTRITOS;9;MEDIO AMBIENTE;2;FUENTES Y ESTANQUES;;;;;;;500000;0;500000;500000;0;0;0;0;0;0
;;1;151;16001;60916;2024/000225;2024/000225;FUENTES ORNAMENTALES EN LA CIUDAD DE MADRID. INSTALACIÓN;998;VARIOS DISTRITOS;9;MEDIO AMBIENTE;2;FUENTES Y ESTANQUES;;;;;;;90000;0;90000;90000;0;0;0;0;0;0
;;1;151;16001;60999;2024/001005;2024/001005;REDACCIÓN PROYECTOS INGENIERÍA DEL AGUA;998;VARIOS DISTRITOS;9;MEDIO AMBIENTE;3;ALCANTARILLADO Y COLECTORES;;;;;;;50000;0;50000;50000;0;0;0;0;0;0
;;1;151;16001;61999;2019/004321;2019/004321;DEPURADORA DE BUTARQUE CONSOLIDACIÓN DE LOS TERRENOS;217;VILLAVERDE;9;MEDIO AMBIENTE;4;INSTALACIONES PARA LA DEPURACIÓN DEL AGUA;;;;;;;2838288;0;2838288;99995,38;0;2738292,62;2738292,62;0;0;0
;;1;151;16001;61999;2019/004339;2019/004339;RIEGO DE ZONAS VERDES EN SANCHINARRO CON AGUA REGENERADA;216;HORTALEZA;9;MEDIO AMBIENTE;7;DESARROLLO MEDIO AMBIENTAL, SOSTENIBILIDAD;;;;;;;336912;-45735;291177;257778,65;0;33398,35;33398,35;0;0;0
;;1;151;16001;61999;2022/001389;2022/001389;PARQUE DE VALDEBERNARDO. OBRAS DE REHABILITACIÓN INSTALACIONES DE APROVECHAMIENTO AGUAS FREÁTICAS;219;VICALVARO;9;MEDIO AMBIENTE;4;INSTALACIONES PARA LA DEPURACIÓN DEL AGUA;;;;;;;574169;0;574169;1,2;0;574167,8;574167,8;206942,45;0;206942,45
;;1;151;16001;61999;2022/001626;2022/001626;MEJORA RED DE AGUA REGENERADA PARA LAS ZONAS VERDES DEL ESTADIO CÍVITAS METROPOLITANO;220;SAN BLAS-CANILLEJAS;9;MEDIO AMBIENTE;7;DESARROLLO MEDIO AMBIENTAL, SOSTENIBILIDAD;;;;;;;223272;29735;253007;2,34;0;253004,66;253004,66;68288,48;0;68288,48
;;1;151;16001;61999;2023/000442;2023/000442;CANTONES DE LIMPIEZA. ACOMETIDAS DE AGUA REGENERADA;998;VARIOS DISTRITOS;9;MEDIO AMBIENTE;7;DESARROLLO MEDIO AMBIENTAL, SOSTENIBILIDAD;;;;;;;625882;-625880,5;1,5;1,5;0;0;0;0;0;0
;;1;151;16001;61999;2023/000442;2023/010442;CANTONES DE LIMPIEZA DEL DISTRITO DE FUENCARRAL-EL PARDO. ACOMETIDAS DE AGUA REGENERADA;208;FUENCARRAL-EL PARDO;9;MEDIO AMBIENTE;7;DESARROLLO MEDIO AMBIENTAL, SOSTENIBILIDAD;;;;;;;0;417253,97;417253,97;0;0;417253,97;417253,97;0;0;0
;;1;151;16001;61999;2023/000442;2023/020442;CANTÓN DE LIMPIEZA DEL DISTRITO VILLA DE VALLECAS. ACOMETIDA DE AGUA REGENERADA;218;VILLA DE VALLECAS;9;MEDIO AMBIENTE;7;DESARROLLO MEDIO AMBIENTAL, SOSTENIBILIDAD;;;;;;;0;138580,82;138580,82;0;0;138580,82;138580,82;55998,6;0;16062,76
;;1;151;16001;61999;2023/000442;2023/030442;CANTÓN DE LIMPIEZA DEL DISTRITO DE CIUDAD LINEAL. ACOMETIDA DE AGUA REGENERADA;215;CIUDAD LINEAL;9;MEDIO AMBIENTE;7;DESARROLLO MEDIO AMBIENTAL, SOSTENIBILIDAD;;;;;;;0;75105,71;75105,71;0;0;75105,71;75105,71;0;0;0
;;1;151;16001;61999;2024/000228;2024/000228;MARGEN IZQUIERDA DEL RÍO MANZANARES A LA ALTURA DE LA C/ADELINA PATTI. OBRAS DE REGENERACIÓN;208;FUENCARRAL-EL PARDO;9;MEDIO AMBIENTE;7;DESARROLLO MEDIO AMBIENTAL, SOSTENIBILIDAD;;;;;;;140000;0;140000;140000;0;0;0;0;0;0
;;1;151;16001;61999;2024/001005;2024/001005;REDACCIÓN PROYECTOS INGENIERÍA DEL AGUA;998;VARIOS DISTRITOS;9;MEDIO AMBIENTE;3;ALCANTARILLADO Y COLECTORES;;;;;;;50000;-47893,74;2106,26;2106,26;0;0;0;0;0;0
;;1;151;16001;61999;2024/001014;2024/001014;ARROYO POZUELO. REPARACIÓN DE TALUDES Y SOLERA DEL CAUCE;209;MONCLOA-ARAVACA;9;MEDIO AMBIENTE;7;DESARROLLO MEDIO AMBIENTAL, SOSTENIBILIDAD;;;;;;;0;47893,74;47893,74;0;0;47893,74;47893,74;47893,74;0;0
;;1;151;16001;61999;2024/001052;2024/001052;DEPÓSITO DE AGUA REGENERADA DE ARROYO DEL FRESNO. OBRAS DE REHABILITACIÓN Y MEJORA;208;FUENCARRAL-EL PARDO;9;MEDIO AMBIENTE;7;DESARROLLO MEDIO AMBIENTAL, SOSTENIBILIDAD;;;;;;;0;10940;10940;891,12;0;10048,88;10048,88;0;0;0
5;FONDO DE REEQUILIBRIO TERRITORIAL;1;151;16001;61999;2023/001425;2023/001425;SENDA PEATONAL MARGEN DERECHA RÍO ENTRE PRESA 9 Y PARQUE LINEAL. MEJORA ACCESIBILIDAD;212;USERA;9;MEDIO AMBIENTE;7;DESARROLLO MEDIO AMBIENTAL, SOSTENIBILIDAD;;;17;FONDO REEQUILIBRIO TERRITORIAL;;;877695;0;877695;838360,32;0;39334,68;39334,68;0;0;0
;;1;151;16001;62700;2019/000544;2019/000544;ESTACIÓN REGENERADORA DE AGUAS RESIDUALES DE REJAS. OBRAS ADECUACIÓN Y MEJORA;221;BARAJAS;9;MEDIO AMBIENTE;4;INSTALACIONES PARA LA DEPURACIÓN DEL AGUA;;;;;;;15221668;0;15221668;0,77;0;15221667,23;15221667,23;143920,99;0;11937,38
;;1;151;16001;62700;2019/000545;2019/000545;ESTACIÓN REGENERADORA DE AGUAS RESIDUALES DE VALDEBEBAS. OBRAS DE ADECUACIÓN Y MEJORA;221;BARAJAS;9;MEDIO AMBIENTE;4;INSTALACIONES PARA LA DEPURACIÓN DEL AGUA;;;;;;;18380942;0;18380942;0,12;0;18380941,88;18380941,88;2598862,25;0;2598862,25
;;1;151;16001;62700;2019/003811;2019/003811;ESTANQUE DEL PARQUE DEL RETIRO. ACONDICIONAMIENTO ESTACIÓN DE TRATAMIENTO DE AGUAS;203;RETIRO;9;MEDIO AMBIENTE;7;DESARROLLO MEDIO AMBIENTAL, SOSTENIBILIDAD;;;;;;;25000;0;25000;80,47;0;24919,53;24919,53;0;0;0
;;1;151;16001;62700;2024/001005;2024/001005;REDACCIÓN PROYECTOS INGENIERÍA DEL AGUA;998;VARIOS DISTRITOS;9;MEDIO AMBIENTE;3;ALCANTARILLADO Y COLECTORES;;;;;;;50000;0;50000;50000;0;0;0;0;0;0
;;1;151;16001;62799;2019/003809;2019/003809;RÁPIDO DE LA RED DE ALCANTARILLADO DE LA CUENCA DE BUTARQUE. APROVECHAMIENTO ENERGÉTICO;217;VILLAVERDE;9;MEDIO AMBIENTE;3;ALCANTARILLADO Y COLECTORES;;;;;;;130000;-78000;52000;52000;0;0;0;0;0;0
;;1;151;16001;62799;2022/001332;2022/001332;ENTORNO RÍO MANZANARES. ALUMBRADO MONUMENTAL;202;ARGANZUELA;8;MANTENIMIENTO URBANO;0;ALUMBRADO PÚBLICO;;;;;;;297814;39000;336814;307236,76;0;29577,24;29577,24;0;0;0
;;1;151;16001;62799;2022/001332;2022/001332;ENTORNO RÍO MANZANARES. ALUMBRADO MONUMENTAL;210;LATINA;8;MANTENIMIENTO URBANO;0;ALUMBRADO PÚBLICO;;;;;;;297815;39000;336815;307237,76;0;29577,24;29577,24;0;0;0
;;1;151;16001;63200;2024/000226;2024/000226;EDIFICIO CENTRO DE CONTROL RÍO MANZANARES. OBRAS DE REMODELACIÓN PLANTA INFERIOR;209;MONCLOA-ARAVACA;9;MEDIO AMBIENTE;7;DESARROLLO MEDIO AMBIENTAL, SOSTENIBILIDAD;;;;;;;300000;0;300000;300000;0;0;0;0;0;0
;;1;151;16070;61999;2024/000227;2024/000227;ALIVIADEROS DE LOS ESTANQUES DE TORMENTAS DE ABROÑIGALES Y LA GAVIA. ADECUACIÓN Y ACONDICIONAMIENTO;218;VILLA DE VALLECAS;9;MEDIO AMBIENTE;3;ALCANTARILLADO Y COLECTORES;;;;;;;1000000;0;1000000;975730,03;0;24269,97;24269,97;0;0;0
;;1;151;16230;62701;2019/000344;2019/000344;NUEVA PLANTA DE MATERIA ORGÁNICA EN EL PARQUE TECNOLÓGICO DE VALDEMINGÓMEZ;218;VILLA DE VALLECAS;9;MEDIO AMBIENTE;5;TRATAMIENTO DE RESIDUOS;;;;;;;163979;0;163979;0,26;0;163978,74;163978,74;54659,6;0;54659,6
;;1;151;16230;62701;2021/000001;2021/000001;CENTRO DE TRATAMIENTO  LAS DEHESAS. SISTEMAS DE DESODORIZACIÓN;218;VILLA DE VALLECAS;9;MEDIO AMBIENTE;5;TRATAMIENTO DE RESIDUOS;;;;;;;6502948;0;6502948;0,63;584614,97;5918332,4;5918332,4;0;0;0
;;1;151;16278;62701;2019/000344;2019/000344;NUEVA PLANTA DE MATERIA ORGÁNICA EN EL PARQUE TECNOLÓGICO DE VALDEMINGÓMEZ;218;VILLA DE VALLECAS;9;MEDIO AMBIENTE;5;TRATAMIENTO DE RESIDUOS;;;;;;;11558643;0;11558643;1,57;7399597,14;4159044,29;4159044,29;0;0;0
5;FONDO DE REEQUILIBRIO TERRITORIAL;1;151;16301;60913;2023/003025;2023/003025;NUEVOS BANCOS EN PLAZAS, PARQUES, JARDINES Y ÁREAS SINGULARES. INSTALACIÓN (ID 21: 18994);998;VARIOS DISTRITOS;8;MANTENIMIENTO URBANO;1;MOBILIARIO URBANO;;;;;18;PRESUPUESTOS PARTICIPATIVOS;300000;0;300000;300000;0;0;0;0;0;0
5;FONDO DE REEQUILIBRIO TERRITORIAL;1;151;16301;60913;2023/003052;2023/003052;ÁREAS INFANTILES DE INTEGRACIÓN. ACTUACIONES DE TRANSFORMACIÓN E INSTALACIÓN (ID 21: 17328);998;VARIOS DISTRITOS;8;MANTENIMIENTO URBANO;1;MOBILIARIO URBANO;;;;;18;PRESUPUESTOS PARTICIPATIVOS;2500000;0;2500000;2500000;0;0;0;0;0;0
5;FONDO DE REEQUILIBRIO TERRITORIAL;1;151;16301;60913;2023/003053;2023/003053;ÁREA INFANTIL SINGULAR PARQUE ENRIQUE TIERNO GALVÁN. TRANSFORMACIÓN E INSTALACIÓN (ID 21: 17669);202;ARGANZUELA;8;MANTENIMIENTO URBANO;1;MOBILIARIO URBANO;;;;;18;PRESUPUESTOS PARTICIPATIVOS;450000;0;450000;450000;0;0;0;0;0;0
5;FONDO DE REEQUILIBRIO TERRITORIAL;1;151;16301;60913;2023/003054;2023/003054;ÁREA DE MAYORES EN EL BARRIO DE GOYA, DISTRITO DE LATINA. INSTALACIÓN (ID 21: 17698);210;LATINA;8;MANTENIMIENTO URBANO;1;MOBILIARIO URBANO;;;;;18;PRESUPUESTOS PARTICIPATIVOS;35000;0;35000;35000;0;0;0;0;0;0
5;FONDO DE REEQUILIBRIO TERRITORIAL;1;151;16301;60913;2023/003055;2023/003055;ÁREA INFANTIL SINGULAR EN EL PARQUE DE INGENIEROS. TRANSFORMACIÓN E INSTALACIÓN (ID 21: 18676);217;VILLAVERDE;8;MANTENIMIENTO URBANO;1;MOBILIARIO URBANO;;;;;18;PRESUPUESTOS PARTICIPATIVOS;350000;0;350000;350000;0;0;0;0;0;0
5;FONDO DE REEQUILIBRIO TERRITORIAL;1;151;16301;60913;2023/003057;2023/003057;ÁREA INFANTIL SINGULAR EN EL CAÑAVERAL. INSTALACIÓN (ID 21: 19126);219;VICALVARO;8;MANTENIMIENTO URBANO;1;MOBILIARIO URBANO;;;;;18;PRESUPUESTOS PARTICIPATIVOS;400000;0;400000;400000;0;0;0;0;0;0
5;FONDO DE REEQUILIBRIO TERRITORIAL;1;151;17101;61913;2023/003039;2023/003039;PARQUE DEHESA DE LA VILLA. MODERNIZACIÓN ÁREAS INFANTILES (ID 21: 18084);209;MONCLOA-ARAVACA;8;MANTENIMIENTO URBANO;1;MOBILIARIO URBANO;;;;;18;PRESUPUESTOS PARTICIPATIVOS;650000;0;650000;650000;0;0;0;0;0;0
;;1;151;17101;61920;2017/000244;2017/000244;PARQUE DE LA CASA DE CAMPO. ACTUACIONES DE REHABILITACIÓN;209;MONCLOA-ARAVACA;9;MEDIO AMBIENTE;0;PARQUES;;;;;;;1818129;72940,2;1891069,2;0;0;1891069,2;1891069,2;410706,2;0;410706,2
;;1;151;17101;61920;2019/003805;2019/003805;PARQUE ENRIQUE TIERNO GALVÁN. OBRAS DE MEJORA Y RECUPERACIÓN;202;ARGANZUELA;9;MEDIO AMBIENTE;0;PARQUES;;;;;;;205000;-109292,37;95707,63;95707,63;0;0;0;0;0;0
;;1;151;17101;61920;2021/001304;2021/001304;ROSALEDA DEL PARQUE DEL OESTE. REHABILITACIÓN PÉRGOLA Y REPARACIÓN DE DAÑOS;209;MONCLOA-ARAVACA;9;MEDIO AMBIENTE;0;PARQUES;;;;;;;61516;26558,83;88074,83;0;0;88074,83;88074,83;0;0;0
;;1;151;17101;61920;2022/000162;2022/000162;MUSEO ESTUFAS RETIRO. INSTALACIÓN;203;RETIRO;9;MEDIO AMBIENTE;0;PARQUES;;;;;;;314059;0;314059;294,86;0;313764,14;35705,89;0;0;0
;;1;151;17101;61920;2022/001341;2022/001341;PARQUE GALIANA. OBRAS DE REHABILITACIÓN;212;USERA;9;MEDIO AMBIENTE;0;PARQUES;;;;;;;550424;0;550424;3,19;0;550420,81;550420,81;0;0;0
;;1;151;17101;61920;2022/001432;2022/001432;JARDÍN HISTÓRICO EL CAPRICHO ALAMEDA DE OSUNA. RESTAURACIÓN FORTÍN Y CASINO DE BAILE;221;BARAJAS;9;MEDIO AMBIENTE;0;PARQUES;;;;;;;100000;-18150;81850;81850;0;0;0;0;0;0
;;1;151;17101;61920;2024/001023;2024/001023;PARQUE DE LA QUINTA DE TORRE ARIAS.OBRAS DE APEO Y PROTECCIÓN DEL MURO OESTE;220;SAN BLAS-CANILLEJAS;9;MEDIO AMBIENTE;0;PARQUES;;;;;;;0;9793,34;9793,34;0;0;9793,34;9793,34;0;0;0
;;1;151;17101;61920;2024/001099;2024/001099;VIVERO MUNICIPAL DE MIGAS CALIENTES. REHABILITACIÓN DE INFRAESTRUCTURAS;209;MONCLOA-ARAVACA;9;MEDIO AMBIENTE;0;PARQUES;;;;;;;0;18150;18150;18150;0;0;0;0;0;0
1;INCORPORACIONES REMANENTES OBLIGATORIAS;1;151;17101;61920;2022/000632;2022/000632;PARQUES DE LA CIUDAD DE MADRID. PLANTACIONES ARBÓREAS PARA COMPENSACIÓN EMISIONES CO2;998;VARIOS DISTRITOS;9;MEDIO AMBIENTE;0;PARQUES;;;;;;;0;8626,59;8626,59;8626,59;0;0;0;0;0;0
5;FONDO DE REEQUILIBRIO TERRITORIAL;1;151;17101;61920;2022/001342;2022/001342;PARQUE DE LAS CATARATAS. OBRAS DE REHABILITACIÓN;218;VILLA DE VALLECAS;9;MEDIO AMBIENTE;0;PARQUES;;;17;FONDO REEQUILIBRIO TERRITORIAL;;;40000;0;40000;40000;0;0;0;0;0;0
5;FONDO DE REEQUILIBRIO TERRITORIAL;1;151;17101;61920;2023/001128;2023/001128;PARQUES QUINTAS TORRE ARIAS-MOLINOS. ADECUACIÓN PUERTA CERRAMIENTO NO HISTÓRICO Y CONEXIÓN PEATONAL;220;SAN BLAS-CANILLEJAS;9;MEDIO AMBIENTE;0;PARQUES;;;17;FONDO REEQUILIBRIO TERRITORIAL;;;402870;0;402870;623,58;0;402246,42;402246,42;0;0;0
;;1;151;17101;61921;2021/000332;2021/000332;ZONAS VERDES AVDA. RAFAELA YBARRA Y AVDA. LOS POBLADOS, DISTRITO USERA. REHABILITACIÓN;212;USERA;9;MEDIO AMBIENTE;1;ZONAS AJARDINADAS;;;;;;;205000;-18089,5;186910,5;186910,5;0;0;0;0;0;0
;;1;151;17101;61921;2024/000428;2024/000428;REPOBLACIÓN CON ESPECIES ARBÓREAS FORESTALES EN DIVERSAS PARCELAS DE LA CIUDAD DE MADRID;998;VARIOS DISTRITOS;9;MEDIO AMBIENTE;1;ZONAS AJARDINADAS;;;;;;;0;18089,5;18089,5;18089,5;0;0;0;0;0;0
;;1;151;17101;63300;2023/001522;2023/001522;PARQUES HISTÓRICOS Y VIVEROS DE LA CIUDAD DE MADRID. MAQUINARIA;998;VARIOS DISTRITOS;9;MEDIO AMBIENTE;0;PARQUES;;;;;;;592035;-463834,92;128200,08;128200,08;0;0;0;0;0;0
;;1;151;17101;63300;2023/001522;2023/011522;PARQUE DE LA CASA DE CAMPO. MAQUINARIA;209;MONCLOA-ARAVACA;9;MEDIO AMBIENTE;0;PARQUES;;;;;;;0;221217,58;221217,58;0;0;221217,58;200302,34;0;0;0
;;1;151;17101;63300;2023/001522;2023/021522;JARDINES DE EL BUEN RETIRO. MAQUINARIA;203;RETIRO;9;MEDIO AMBIENTE;0;PARQUES;;;;;;;0;129471,06;129471,06;0;0;129471,06;122862,97;0;0;0
;;1;151;17101;63300;2023/001522;2023/031522;QUINTA DE TORRE ARIAS. MAQUINARIA;220;SAN BLAS-CANILLEJAS;9;MEDIO AMBIENTE;0;PARQUES;;;;;;;0;7710,61;7710,61;0;0;7710,61;6398,29;0;0;0
;;1;151;17101;63300;2023/001522;2023/041522;VIVERO DE LA CASA DE CAMPO. MAQUINARIA;209;MONCLOA-ARAVACA;9;MEDIO AMBIENTE;0;PARQUES;;;;;;;0;45782,09;45782,09;0;0;45782,09;44546,52;0;0;0
;;1;151;17101;63300;2023/001522;2023/051522;VIVERO ESRUFAS DE EL RETIRO. MAQUINARIA;203;RETIRO;9;MEDIO AMBIENTE;0;PARQUES;;;;;;;0;916,66;916,66;0;0;916,66;760,65;0;0;0
;;1;151;17101;63300;2023/001522;2023/061522;VIVERO DE MIGAS CALIENTES. MAQUINARIA;209;MONCLOA-ARAVACA;9;MEDIO AMBIENTE;0;PARQUES;;;;;;;0;58736,92;58736,92;0;0;58736,92;51235,89;0;0;0
;;1;151;17102;61000;2024/000430;2024/000430;HUERTOS URBANOS ECOLÓGICOS EN LA CIUDAD DE MADRID. ADECUACIÓN;998;VARIOS DISTRITOS;9;MEDIO AMBIENTE;7;DESARROLLO MEDIO AMBIENTAL, SOSTENIBILIDAD;;;;;;;0;18000;18000;18000;0;0;0;0;0;0
;;1;151;17102;61920;2019/003822;2019/003822;REFORMA PARQUE ISABEL CLARA EUGENIA Y CREACIÓN ÁREA CANINA EN PARQUE ALFREDO KRAUS;216;HORTALEZA;9;MEDIO AMBIENTE;0;PARQUES;;;;;;;20000;0;20000;10,45;0;19989,55;19989,55;0;0;0
;;1;151;17102;61920;2022/000553;2022/000553;PARQUE PINAR DEL REY. OBRAS DE REMODELACIÓN INTEGRAL;216;HORTALEZA;9;MEDIO AMBIENTE;0;PARQUES;;;;;;;205000;0;205000;205000;0;0;0;0;0;0
;;1;151;17102;61920;2022/001461;2022/001461;PARQUE DE CARAMUEL. OBRAS DE REHABILITACIÓN;210;LATINA;9;MEDIO AMBIENTE;0;PARQUES;;;;;;;205000;-86500;118500;118500;0;0;0;0;0;0
;;1;151;17102;61920;2022/001463;2022/001463;PARQUE LA VIÑA. OBRAS DE REHABILITACIÓN;213;PUENTE DE VALLECAS;9;MEDIO AMBIENTE;0;PARQUES;;;;;;;205000;0;205000;205000;0;0;0;0;0;0
;;1;151;17102;61920;2022/001464;2022/001464;PARQUE DE VALDEBERNARDO. OBRAS DE REMODELACIÓN;219;VICALVARO;9;MEDIO AMBIENTE;0;PARQUES;;;;;;;205000;0;205000;205000;0;0;0;0;0;0
;;1;151;17102;61920;2022/001467;2022/001467;PARQUE PINAR DE LA ELIPA. OBRAS DE MEJORA;215;CIUDAD LINEAL;9;MEDIO AMBIENTE;0;PARQUES;;;;;;;205000;0;205000;205000;0;0;0;0;0;0
;;1;151;17102;61920;2023/000451;2023/000451;PLANTACIONES ARBÓREAS EN LOS PARQUES DE LA CIUDAD DE MADRID. MEJORA ESTÉTICA Y MEDIO AMBIENTAL;998;VARIOS DISTRITOS;9;MEDIO AMBIENTE;0;PARQUES;;;;;;;1000000;0;1000000;1000000;0;0;0;0;0;0
;;1;151;17102;61920;2024/000216;2024/000216;PARQUE DE CANILLEJAS. OBRAS DE REFORMA INTEGRAL;220;SAN BLAS-CANILLEJAS;9;MEDIO AMBIENTE;0;PARQUES;;;;;;;20000;0;20000;10,45;0;19989,55;19989,55;0;0;0
;;1;151;17102;61920;2024/000218;2024/000218;PARQUE DE  AYERBE EN EL CASCO HISTÓRICO DE BARAJAS. OBRAS DE REHABILITACION;221;BARAJAS;9;MEDIO AMBIENTE;0;PARQUES;;;;;;;20000;-20000;0;0;0;0;0;0;0;0
;;1;151;17102;61920;2024/001078;2024/001078;PARQUE CUÑA VERDE LATINA. ELIMINACIÓN ESTRUCTURA EN RAMPA Y REHABILITACIÓN;210;LATINA;9;MEDIO AMBIENTE;0;PARQUES;;;;;;;0;11500;11500;11500;0;0;0;0;0;0
;;1;151;17102;61920;2024/001079;2024/001079;PARQUE CERRO ALMODÓVAR. OBRAS DE REHABILITACIÓN INTEGRAL;210;LATINA;9;MEDIO AMBIENTE;0;PARQUES;;;;;;;0;25000;25000;25000;0;0;0;0;0;0
;;1;151;17102;61920;2024/001080;2024/001080;PARQUE ARROYO FONTARRÓN. OBRAS DE REMODELACIÓN;214;MORATALAZ;9;MEDIO AMBIENTE;0;PARQUES;;;;;;;0;35000;35000;35000;0;0;0;0;0;0
;;1;151;17102;61920;2024/001081;2024/001081;PARQUE INGENIEROS, C/ EDUARDO BARREIROS. REHABILITACIÓN;217;VILLAVERDE;9;MEDIO AMBIENTE;0;PARQUES;;;;;;;0;35000;35000;35000;0;0;0;0;0;0
5;FONDO DE REEQUILIBRIO TERRITORIAL;1;151;17102;61920;2019/003546;2019/003546;PARQUE DEL PARAÍSO. OBRAS DE ADECUACIÓN Y MEJORA (ID 18: 409);220;SAN BLAS-CANILLEJAS;9;MEDIO AMBIENTE;0;PARQUES;;;17;FONDO REEQUILIBRIO TERRITORIAL;18;PRESUPUESTOS PARTICIPATIVOS;2076214;0;2076214;197030,02;0;1879183,98;1879183,98;45180,84;0;45180,84
5;FONDO DE REEQUILIBRIO TERRITORIAL;1;151;17102;61920;2019/004348;2019/004348;PARQUE OLOF PALME. REHABILITACIÓN;212;USERA;9;MEDIO AMBIENTE;0;PARQUES;;;17;FONDO REEQUILIBRIO TERRITORIAL;;;61000;0;61000;61000;0;0;0;0;0;0
5;FONDO DE REEQUILIBRIO TERRITORIAL;1;151;17102;61920;2019/004355;2019/004355;PARQUE AGUSTÍN RODRÍGUEZ SAHAGÚN. REHABILITACIÓN (ID 18: 9888);206;TETUAN;9;MEDIO AMBIENTE;0;PARQUES;;;;;18;PRESUPUESTOS PARTICIPATIVOS;551289;0;551289;59000,21;0;492288,79;492288,79;61910,19;0;61910,19
5;FONDO DE REEQUILIBRIO TERRITORIAL;1;151;17102;61920;2021/000347;2021/000347;"PARQUE DE LAS CRUCES, DISTRITO DE CARABANCHEL. REHABILITACIÓN (ID 19: 9283;11756)";211;CARABANCHEL;9;MEDIO AMBIENTE;0;PARQUES;;;17;FONDO REEQUILIBRIO TERRITORIAL;18;PRESUPUESTOS PARTICIPATIVOS;60000;0;60000;60000;0;0;0;0;0;0
5;FONDO DE REEQUILIBRIO TERRITORIAL;1;151;17102;61920;2022/001465;2022/001465;PARQUE DUQUE DE AHUMADA. OBRAS DE REHABILITACIÓN;219;VICALVARO;9;MEDIO AMBIENTE;0;PARQUES;;;17;FONDO REEQUILIBRIO TERRITORIAL;;;56000;0;56000;56000;0;0;0;0;0;0
5;FONDO DE REEQUILIBRIO TERRITORIAL;1;151;17102;61920;2022/001466;2022/001466;PARQUE FORESTAL RONDA DEL SUR-SANTA CATALINA. OBRAS DE MEJORA;213;PUENTE DE VALLECAS;9;MEDIO AMBIENTE;0;PARQUES;;;17;FONDO REEQUILIBRIO TERRITORIAL;;;39000;0;39000;39000;0;0;0;0;0;0
5;FONDO DE REEQUILIBRIO TERRITORIAL;1;151;17102;61920;2022/001468;2022/001468;PARQUE PUERTO RICO IGLESIA. OBRAS DE REHABILITACIÓN (ID 19: 12151);205;CHAMARTIN;9;MEDIO AMBIENTE;0;PARQUES;;;17;FONDO REEQUILIBRIO TERRITORIAL;18;PRESUPUESTOS PARTICIPATIVOS;489464;0;489464;61000,98;0;428463,02;428463,02;72962,02;0;72962,02
5;FONDO DE REEQUILIBRIO TERRITORIAL;1;151;17102;61920;2023/003030;2023/003030;ÁREA VERDE EL CAÑAVERAL. ADECUACIÓN ÁREA CANINA Y REVEGETACIÓN (ID 21: 17395);219;VICALVARO;9;MEDIO AMBIENTE;1;ZONAS AJARDINADAS;;;;;18;PRESUPUESTOS PARTICIPATIVOS;390000;0;390000;375051,51;0;14948,49;14948,49;0;0;0
5;FONDO DE REEQUILIBRIO TERRITORIAL;1;151;17102;61920;2023/003032;2023/003032;ZONA FORESTAL MONTECARMELO: M-607 KM.13-GTA.VENTISQUERO DE LA CONDESA.REHABILITACIÓN (ID 21: 17548);208;FUENCARRAL-EL PARDO;9;MEDIO AMBIENTE;0;PARQUES;;;;;18;PRESUPUESTOS PARTICIPATIVOS;22000;0;22000;19,03;0;21980,97;21980,97;0;0;0
5;FONDO DE REEQUILIBRIO TERRITORIAL;1;151;17102;61920;2023/003078;2023/003078;PARQUES ARRIAGA, LOS TILOS Y LA ALMUDENA. ITINERARIOS EN FOMENTO DE LA BIODIVERSIDAD (ID 21: 18475);215;CIUDAD LINEAL;9;MEDIO AMBIENTE;7;DESARROLLO MEDIO AMBIENTAL, SOSTENIBILIDAD;;;;;18;PRESUPUESTOS PARTICIPATIVOS;178123;0;178123;178123;0;0;0;0;0;0
;;1;151;17102;61921;2022/001339;2022/001339;ZONA VERDE CALLE LUISA MURIEL. OBRAS DE ACONDICIONAMIENTO;210;LATINA;9;MEDIO AMBIENTE;1;ZONAS AJARDINADAS;;;;;;;582729;8413,25;591142,25;582729;0;8413,25;8413,25;0;0;0
;;1;151;17102;61921;2022/001340;2022/001340;ZONA VERDE ALBATANA, CALLE SANTA SUSANA. OBRAS DE ACONDICIONAMIENTO;216;HORTALEZA;9;MEDIO AMBIENTE;1;ZONAS AJARDINADAS;;;;;;;618247;0;618247;8,71;0;618238,29;618238,29;0;0;0
;;1;151;17102;61921;2022/001345;2022/001345;ZONA VERDE PLAZA LUGAR DE LOS POETAS, ANEXA PARQUE LUISA CARNÉS. OBRAS DE ADECUACIÓN;209;MONCLOA-ARAVACA;9;MEDIO AMBIENTE;1;ZONAS AJARDINADAS;;;;;;;391263;0;391263;24,68;0;391238,32;391238,32;0;0;0
;;1;151;17102;61921;2022/001456;2022/001456;CAMINOS PARA SENDA CICLABLE ENTRE LOS BARRIOS DE SANTA MARÍA Y MANOTERAS. ACONDICIONAMIENTO;216;HORTALEZA;9;MEDIO AMBIENTE;1;ZONAS AJARDINADAS;;;;;;;640230;0;640230;8,19;0;640221,81;640221,81;0;0;0
;;1;151;17102;61921;2022/001457;2022/001457;ZONA VERDE C/ SAN MÁXIMO, 10. OBRAS DE AJARDINAMIENTO Y ADECUACIÓN;212;USERA;9;MEDIO AMBIENTE;1;ZONAS AJARDINADAS;;;;;;;364993;6871,71;371864,71;364993;0;6871,71;6871,71;0;0;0
;;1;151;17102;61921;2024/000220;2024/000220;MICRORESERVAS DE BIODIVERSIDAD,ZONAS VERDES DISTRITOS DE MADRID.SOLUCIONES BASADAS EN LA NATURALEZA;998;VARIOS DISTRITOS;9;MEDIO AMBIENTE;1;ZONAS AJARDINADAS;;;;;;;50000;0;50000;50000;0;0;0;0;0;0
;;1;151;17102;61921;2024/000224;2024/000224;MICRORESERVAS DE BIODIVERSIDAD, ZONAS VERDES CIUDAD DE MADRID. SOLUCIONES BASADAS EN LA NATURALEZA;998;VARIOS DISTRITOS;9;MEDIO AMBIENTE;0;PARQUES;;;;;;;32000;0;32000;32000;0;0;0;0;0;0
;;1;151;17102;61921;2024/001068;2024/001068;ZONA VERDE ENTRE LA AVENIDAD DE NIZA Y LA CALLE SUECIA. REHABILITACIÓN;220;SAN BLAS-CANILLEJAS;9;MEDIO AMBIENTE;1;ZONAS AJARDINADAS;;;;;;;0;20000;20000;20000;0;0;0;0;0;0
;;1;151;17102;61921;2024/001069;2024/001069;ZONA VERDE JUNTO A M-30 EN AVENIDA DE BURGOS, ENTRE PIO XII Y MANOTERAS. REHABILITACIÓN;205;CHAMARTIN;9;MEDIO AMBIENTE;1;ZONAS AJARDINADAS;;;;;;;0;20000;20000;20000;0;0;0;0;0;0
;;1;151;17102;61921;2024/001070;2024/001070;ZONA VERDE EN LA CALLE TRESPADERNE. REHABILITACIÓN;221;BARAJAS;9;MEDIO AMBIENTE;1;ZONAS AJARDINADAS;;;;;;;0;18000;18000;18000;0;0;0;0;0;0
5;FONDO DE REEQUILIBRIO TERRITORIAL;1;151;17102;61921;2019/009152;2019/009152;JARDÍN CON ESPECIES DE ECOSISTEMAS MEDITERRÁNEOS ENTRE C/GÉMINIS Y ORIÓN. PLANTACIÓN (ID: 11330);221;BARAJAS;9;MEDIO AMBIENTE;1;ZONAS AJARDINADAS;;;;;18;PRESUPUESTOS PARTICIPATIVOS;0;160000;160000;160000;0;0;0;0;0;0
5;FONDO DE REEQUILIBRIO TERRITORIAL;1;151;17102;61921;2023/003023;2023/003023;ZONA VERDE EN EL Bº DE BUTARQUE ENTRE C/HULLA Y HUERTAS DEL RÍO. RECUPERACIÓN (ID 21: 18000);217;VILLAVERDE;9;MEDIO AMBIENTE;1;ZONAS AJARDINADAS;;;;;18;PRESUPUESTOS PARTICIPATIVOS;670000;0;670000;670000;0;0;0;0;0;0
5;FONDO DE REEQUILIBRIO TERRITORIAL;1;151;17102;61921;2023/003031;2023/003031;ZONAS VERDES ENSANCHE DE VALLECAS. CAMINOS, ZONAS ESTANCIALES Y OTRAS MEJORAS(ID 21: 17461);218;VILLA DE VALLECAS;9;MEDIO AMBIENTE;1;ZONAS AJARDINADAS;;;;;18;PRESUPUESTOS PARTICIPATIVOS;25000;0;25000;41,75;0;24958,25;24958,25;0;0;0
5;FONDO DE REEQUILIBRIO TERRITORIAL;1;151;17102;61921;2023/003036;2023/003036;ZONA VERDE EN EL BARRIO DE REJAS. OBRAS DE ACONDICIONAMIENTO (ID 21: 17683);220;SAN BLAS-CANILLEJAS;9;MEDIO AMBIENTE;1;ZONAS AJARDINADAS;;;;;18;PRESUPUESTOS PARTICIPATIVOS;20000;0;20000;10,45;0;19989,55;19989,55;0;0;0
5;FONDO DE REEQUILIBRIO TERRITORIAL;1;151;17102;61921;2023/003038;2023/003038;ZONA VERDE ENTRE EL DEPORTIVO MARÍA VILLOTA Y COLEGIO PÚBLICO EL GRECO.REMODELACIÓN (ID 21: 18078);217;VILLAVERDE;9;MEDIO AMBIENTE;1;ZONAS AJARDINADAS;;;;;18;PRESUPUESTOS PARTICIPATIVOS;670000;-160000;510000;510000;0;0;0;0;0;0
5;FONDO DE REEQUILIBRIO TERRITORIAL;1;151;17102;61921;2023/003040;2023/003040;MURO Y TERRAPLÉN EN ZONA VERDE CALLE MIRASIERRA. REPARACIÓN Y TRATAMIENTO DE TALUD (ID 21:18593);212;USERA;9;MEDIO AMBIENTE;1;ZONAS AJARDINADAS;;;;;18;PRESUPUESTOS PARTICIPATIVOS;18000;0;18000;184,54;0;17815,46;17815,46;0;0;0
;;1;161;15230;60913;2024/000416;2024/000416;ELEMENTOS APOYO A LA PRÁCTICA AGRÍCOLA EN HUERTOS DE LA CIUDAD DE MADRID. PROTOTIPADO;998;VARIOS DISTRITOS;6;URBANISMO;1;URBANIZACIÓN SUELO A CARGO DEL AYUNTAMIENTO;;;;;;;40000;0;40000;40000;0;0;0;0;0;0
;;1;161;15230;61904;2022/000469;2022/000469;OBRAS DE URBANIZACIÓN ESPACIOS INTERBLOQUE PLAN ESPECIAL ROGER DE FLOR;211;CARABANCHEL;6;URBANISMO;1;URBANIZACIÓN SUELO A CARGO DEL AYUNTAMIENTO;;;17;FONDO REEQUILIBRIO TERRITORIAL;;;851357;0;851357;851357;0;0;0;0;0;0
;;1;161;15230;61904;2023/001398;2023/001398;COLONIA CASA DE CAMPO, ÁREA PREFERENTE DE IMPULSO A LA REGENERACIÓN URBANA 10.04 . RENOVACIÓN;210;LATINA;6;URBANISMO;1;URBANIZACIÓN SUELO A CARGO DEL AYUNTAMIENTO;;;;;;;703820;-46077,22;657742,78;637669,47;0;20073,31;20073,31;0;0;0
