2018/005136;ZONA LAS CAROLINAS, BARRIOS DE ALMENDARALES Y ORCASUR. PAVIMENTACIÓN;1190;15321;61910;8;MANTENIMIENTO URBANO;2;VÍAS PÚBLICAS;212;USERA;211.144,00
2018/005138;CONEXIÓN PEATONAL BARRIO LEGAZPI CON MÉNDEZ ÁLVARO. MEJORA (ID 17: 4885);1190;15321;61910;8;MANTENIMIENTO URBANO;2;VÍAS PÚBLICAS;202;ARGANZUELA;210.392,00
2018/005142;PASEO DE RECOLETOS. REURBANIZACIÓN Y MEJORA DE PAVIMENTOS;1190;15321;61910;8;MANTENIMIENTO URBANO;2;VÍAS PÚBLICAS;998;VARIOS DISTRITOS;463.222,00
2018/005146;DIVERSAS CALLES EN BARRIOS DEL DISTRITO FUENCARRAL-EL PARDO. REURBANIZACIÓN;1190;15321;61910;8;MANTENIMIENTO URBANO;2;VÍAS PÚBLICAS;208;FUENCARRAL-EL PARDO;868.288,00
2018/006029;DIVERSAS CALLES DISTRITO DE TETUÁN. MEJORA CONDICIONES DE ACCESIBILIDAD UNIVERSAL;1190;15321;61910;8;MANTENIMIENTO URBANO;2;VÍAS PÚBLICAS;206;TETUAN;34.569,00
2018/006030;ÁREA VULNERABLE DE MORATALAZ 14.02. RECUALIFICACIÓN DE ESPACIOS PÚBLICOS URBANOS;1190;15321;61910;8;MANTENIMIENTO URBANO;2;VÍAS PÚBLICAS;214;MORATALAZ;76.690,00
2018/006031;MEJORA SEGURIDAD VIAL EN EL PAU DE CARABANCHEL Y SU ENTORNO;1190;15321;61910;8;MANTENIMIENTO URBANO;2;VÍAS PÚBLICAS;211;CARABANCHEL;612.250,00
2018/006525;PAVIMENTO ACERAS EN EL BARRIO DE MORATALAZ. MEJORA (ID 2017: 5724);1190;15321;61910;8;MANTENIMIENTO URBANO;2;VÍAS PÚBLICAS;214;MORATALAZ;460.041,00
2018/006526;PAVIMENTO ACERAS DEL POBLADO DIRIGIDO DE ORCASITAS. MEJORA (ID 2017: 6876);1190;15321;61910;8;MANTENIMIENTO URBANO;2;VÍAS PÚBLICAS;212;USERA;147.823,00
2018/006527;ACERAS Y CALLES DEL DISTRITO DE CARABANCHEL. ACONDICIONAMIENTO (ID 2017: 5556);1190;15321;61910;8;MANTENIMIENTO URBANO;2;VÍAS PÚBLICAS;211;CARABANCHEL;268.160,00
2018/006548;REHABILITACIÓN PAVIMENTO CALZADAS DE DIVERSAS CALLES DE LA CIUDAD DE MADRID;1190;15321;61910;8;MANTENIMIENTO URBANO;2;VÍAS PÚBLICAS;998;VARIOS DISTRITOS;650.813,00
2018/006733;OBRAS DE MEJORA EN ACERAS, PAVIMENTOS Y ALCORQUES. PLANES INTEGRALES DE BARRIO;1190;15321;61910;8;MANTENIMIENTO URBANO;2;VÍAS PÚBLICAS;998;VARIOS DISTRITOS;27.618,00
2018/008128;ACERAS EN EL ENTORNO DE PROSPERIDAD. OBRAS DE MEJORA (ID: 875);1190;15321;61910;8;MANTENIMIENTO URBANO;2;VÍAS PÚBLICAS;205;CHAMARTIN;328.240,00
2018/008289;CALZADAS BARRIO DE ORCASITAS. REHABILITACIÓN (ID: 1480);1190;15321;61910;8;MANTENIMIENTO URBANO;2;VÍAS PÚBLICAS;212;USERA;233.145,00
2019/000396;OBRAS REPARACIÓN CALZADAS. PLANES INTEGRALES DE BARRIO. DISTRITOS DE CENTRO Y TETUÁN;1190;15321;61910;8;MANTENIMIENTO URBANO;2;VÍAS PÚBLICAS;998;VARIOS DISTRITOS;38.563,00
2018/005126;REMODELACION TÚNEL BAJO GRAN VIA VILLAVERDE Y ESTACION CERCANÍAS VILLAVERDE BAJO  (ID 17: 4091 );1190;15321;61911;8;MANTENIMIENTO URBANO;4;CONSERVACIÓN  PASOS A DISTINTO NIVEL;217;VILLAVERDE;369.796,00
2018/005128;CONEXION PEATONAL TUNEL SUR DE LAS TABLAS CON ESTACIÓN DE CERCANÍAS;1190;15321;61911;8;MANTENIMIENTO URBANO;4;CONSERVACIÓN  PASOS A DISTINTO NIVEL;208;FUENCARRAL-EL PARDO;417.996,00
2018/005129;ACONDICIONAMIENTO Y RENOVACIÓN DE TÚNELES Y OBRAS DE PASO EN LA CIUDAD DE MADRID;1190;15321;61911;8;MANTENIMIENTO URBANO;4;CONSERVACIÓN  PASOS A DISTINTO NIVEL;998;VARIOS DISTRITOS;2.211.560,00
2016/000519;APR 13.01 SIERRA TOLEDANA. URBANIZACIÓN;1190;15321;68101;6;URBANISMO;6;URBANIZACIÓN SUELO PATRIMONIAL;213;PUENTE DE VALLECAS;3.565.960,00
2020/000292;CUBRICIÓN DE LA M-30 EN EL ÁMBITO DEL VICENTE CALDERÓN;1190;15340;60999;7;INFRAESTRUCTURAS;1;CIRCUNVALACIÓN M-30;202;ARGANZUELA;750.000,00
2015/000207;PLAZA DE ESPAÑA. OBRAS DE REMODELACIÓN;1190;15340;61904;6;URBANISMO;1;URBANIZACIÓN SUELO A CARGO DEL AYUNTAMIENTO;998;VARIOS DISTRITOS;30.000.000,00
2018/005147;REURBANIZACIÓN DE CALLES Y ESPACIOS EN EL ENTORNO DEL PASEO DE LA DIRECCIÓN;1190;15340;61904;6;URBANISMO;1;URBANIZACIÓN SUELO A CARGO DEL AYUNTAMIENTO;206;TETUAN;528.995,00
2018/005148;CONEXIÓN PEATONAL C/ MENDEZ ALVARO - AVDA. SAN DIEGO. MEJORA (ID 17: 1211 );1190;15340;61904;6;URBANISMO;1;URBANIZACIÓN SUELO A CARGO DEL AYUNTAMIENTO;213;PUENTE DE VALLECAS;210.734,00
2018/005157;CARRERA DE SAN JERÓNIMO, CEDACEROS, ARLABAN Y VIRGEN DE LOS PELIGROS. REMODELACIÓN;1190;15340;61904;6;URBANISMO;1;URBANIZACIÓN SUELO A CARGO DEL AYUNTAMIENTO;201;CENTRO;1.956.614,00
2018/006529;APARCAMIENTO DISUASORIO EN VILLAVERDE BAJO (ID 2017: 4403);1190;15340;61904;7;INFRAESTRUCTURAS;2;CONSTRUCCIÓN Y/O ADQUISICIÓN DE APARCAMIENTOS;217;VILLAVERDE;119.769,00
2018/006531;REURBANIZACIÓN DE DIVERSOS VIALES DE LA CIUDAD DE MADRID;1190;15340;61904;6;URBANISMO;1;URBANIZACIÓN SUELO A CARGO DEL AYUNTAMIENTO;998;VARIOS DISTRITOS;120.765,00
2020/000291;CALLE EDUARDO BARREIROS. REURBANIZACIÓN;1190;15340;61904;6;URBANISMO;1;URBANIZACIÓN SUELO A CARGO DEL AYUNTAMIENTO;217;VILLAVERDE;500.000,00
2020/000294;CALLE AYERBE. REMODELACIÓN URBANIZACIÓN;1190;15340;61904;6;URBANISMO;1;URBANIZACIÓN SUELO A CARGO DEL AYUNTAMIENTO;221;BARAJAS;950.000,00
2020/000295;CONEXIÓN DE LA CALLE FÁVILA CON LA CALLE TEJARES;1190;15340;61904;6;URBANISMO;1;URBANIZACIÓN SUELO A CARGO DEL AYUNTAMIENTO;211;CARABANCHEL;450.000,00
2018/005145;ENTORNO DE LA AVDA. ARCENTALES . ADECUACIÓN DE VIALES;1190;15340;61910;8;MANTENIMIENTO URBANO;2;VÍAS PÚBLICAS;220;SAN BLAS - CANILLEJAS;1.442.325,00
2018/005127;MEJORA DE INSTALACIONES DE VENTILACIÓN Y SEGURIDAD EN PASOS A DISTINTO NIVEL;1190;16501;61911;8;MANTENIMIENTO URBANO;4;CONSERVACIÓN  PASOS A DISTINTO NIVEL;998;VARIOS DISTRITOS;687.957,00
2016/000277;CENTRO DE SERVICIOS SOCIALES ENTREVIAS, C/ YUSTE, 8. AMPLIACIÓN;1190;93301;62200;3;PROTECCIÓN Y PROMOCIÓN SOCIAL;2;CENTROS DE SERVICIOS SOCIALES;213;PUENTE DE VALLECAS;1.815.647,00
2016/000341;INSTALACIÓN DEPORTIVA ENSANCHE DE VALLECAS (PAU VALLECAS). CONSTRUCCIÓN;1190;93301;62200;11;DEPORTES, JUVENTUD  Y ESPARCIMIENTO;1;POLIDEPORTIVOS;218;VILLA DE VALLECAS;8.036.143,00
2016/000427;CENTRO CULTURAL EN VALDERRIVAS, C/ TITANIO. CONSTRUCCIÓN;1190;93301;62200;10;CULTURA;3;CENTROS CULTURALES;219;VICALVARO;686.122,00
2016/000470;CENTRO DEPORTIVO C/COSTANILLA DESAMPARADOS, 15 C/V A C/FÚCAR, 6. CONSTRUCCIÓN;1190;93301;62200;11;DEPORTES, JUVENTUD  Y ESPARCIMIENTO;1;POLIDEPORTIVOS;201;CENTRO;5.785.164,00
2016/000475;CENTRO DE MAYORES Y SERVICIOS SOCIALES TRAVESÍA CAÑO, 5. CONSTRUCCIÓN;1190;93301;62200;3;PROTECCIÓN Y PROMOCIÓN SOCIAL;1;CENTROS DE MAYORES;209;MONCLOA-ARAVACA;3.403.993,00
2016/000505;FACTORÍA INDUSTRIAL EN VILLAVERDE (LA RESINA). CONSTRUCCIÓN;1190;93301;62200;14;SECTORES PRODUCTIVOS;1;PROMOCIÓN ECONÓMICA;217;VILLAVERDE;4.389.840,00
2016/000529;CENTRO DE MAYORES C/ BLAS CABRERA. CONSTRUCCIÓN (ID 17: 5177);1190;93301;62200;3;PROTECCIÓN Y PROMOCIÓN SOCIAL;1;CENTROS DE MAYORES;210;LATINA;2.189.223,00
2016/000533;CENTRO DEPORTIVO LA CEBADA. CONSTRUCCIÓN;1190;93301;62200;11;DEPORTES, JUVENTUD  Y ESPARCIMIENTO;1;POLIDEPORTIVOS;201;CENTRO;4.999.693,00
2016/000537;CENTRO JUVENIL ZOFIO. CONSTRUCCIÓN;1190;93301;62200;11;DEPORTES, JUVENTUD  Y ESPARCIMIENTO;3;CENTROS JUVENILES;212;USERA;3.291.007,00
2016/000538;CENTRO DE SERVICIOS SOCIALES ENSANCHE DE VALLECAS. CONSTRUCCIÓN;1190;93301;62200;3;PROTECCIÓN Y PROMOCIÓN SOCIAL;2;CENTROS DE SERVICIOS SOCIALES;218;VILLA DE VALLECAS;5.454.721,00
2017/000187;CENTRO JUVENIL C/BRONCE. CONSTRUCCIÓN;1190;93301;62200;11;DEPORTES, JUVENTUD  Y ESPARCIMIENTO;3;CENTROS JUVENILES;202;ARGANZUELA;442.921,00
2017/000189;UNIDAD INTEGRAL POLICÍA DISTRITO RETIRO Y CENTRO DE SALUD COMUNITARIO. CONSTRUCCIÓN;1190;93301;62200;1;PROTECCIÓN CIVIL Y SEGURIDAD CIUDADANA;0;POLICIA MUNICIPAL;203;RETIRO;3.113.433,00
2017/000191;PISCINA CUBIERTA C/CEA BERMUDEZ. CONSTRUCCIÓN;1190;93301;62200;11;DEPORTES, JUVENTUD  Y ESPARCIMIENTO;1;POLIDEPORTIVOS;207;CHAMBERI;2.755.347,00
2017/000456;ESCUELA INFANTIL PARQUE INGENIEROS. CONSTRUCCIÓN;1190;93301;62200;5;EDUCACIÓN;1;ESCUELAS INFANTILES;217;VILLAVERDE;1.022.886,00
2017/000597;CENTRO DE SERVICIOS SOCIALES EN SAN BLAS, C/POBLADURA DEL VALLE, 13. CONSTRUCCIÓN;1190;93301;62200;3;PROTECCIÓN Y PROMOCIÓN SOCIAL;2;CENTROS DE SERVICIOS SOCIALES;220;SAN BLAS - CANILLEJAS;2.114.654,00
2017/001498;UNIDAD INTEGRAL POLICÍA MUNICIPAL HORTALEZA. C/ AREQUIPA, 2. CONSTRUCCIÓN;1190;93301;62200;1;PROTECCIÓN CIVIL Y SEGURIDAD CIUDADANA;0;POLICIA MUNICIPAL;216;HORTALEZA;3.789.280,00
2018/000113;EDIFICIO EN C/ PRAT 59, C/V C/ APEADERO 1. (MARES DE MADRID). CONSTRUCCION;1190;93301;62200;14;SECTORES PRODUCTIVOS;1;PROMOCIÓN ECONÓMICA;219;VICALVARO;720.267,00
2018/001065;CASA DE LA JUVENTUD C/ RÍO ESMERALDA, 15. CONSTRUCCIÓN;1190;93301;62200;11;DEPORTES, JUVENTUD  Y ESPARCIMIENTO;3;CENTROS JUVENILES;213;PUENTE DE VALLECAS;1.505.847,00
2018/001090;PARQUE DE BOMBEROS Y EDIFICIO SAMUR C/ SANTERAS, 39. CONSTRUCCIÓN;1190;93301;62200;1;PROTECCIÓN CIVIL Y SEGURIDAD CIUDADANA;1;BOMBEROS;219;VICALVARO;4.937.883,00
2018/001118;CENTRO MAYORES Y SERVICIOS SOCIALES C/CANAL DE PANAMÁ C/V.CANAL MOZAMBIQUE . CONSTRUCCIÓN;1190;93301;62200;3;PROTECCIÓN Y PROMOCIÓN SOCIAL;1;CENTROS DE MAYORES;215;CIUDAD LINEAL;200.000,00
2018/006012;ESCUELA INFANTIL C/ RODAS, 20-22. CONSTRUCCIÓN;1190;93301;62200;5;EDUCACIÓN;1;ESCUELAS INFANTILES;201;CENTRO;1.000.000,00
2018/008294;ESCUELA INFANTIL EN CANILLEJAS. CONSTRUCCIÓN (ID: 539);1190;93301;62200;5;EDUCACIÓN;1;ESCUELAS INFANTILES;220;SAN BLAS - CANILLEJAS;220.000,00
2019/000302;CENTRO DE SERVICIOS SOCIALES SAN DIEGO. AMPLIACIÓN;1190;93301;62200;3;PROTECCIÓN Y PROMOCIÓN SOCIAL;2;CENTROS DE SERVICIOS SOCIALES;213;PUENTE DE VALLECAS;1.854.680,00
2020/000150;ESTUDIOS Y TRABAJOS TECNICOS. EDIFICIOS DE NUEVA PLANTA;1190;93301;62200;0;INVERSIONES DE CARÁCTER GENERAL;3;EDIFICIOS PARA EL USO GENERAL;998;VARIOS DISTRITOS;500.000,00
2020/000252;CENTRO CULTURAL Y BIBLIOTECA EN MONTECARMELO. CONSTRUCCIÓN;1190;93301;62200;10;CULTURA;3;CENTROS CULTURALES;208;FUENCARRAL-EL PARDO;150.000,00
2020/000253;CENTRO CULTURAL Y BIBLIOTECA EN LAS TABLAS. CONSTRUCCIÓN;1190;93301;62200;10;CULTURA;3;CENTROS CULTURALES;208;FUENCARRAL-EL PARDO;150.000,00
2020/000256;CENTRO DE MAYORES EN EL BARRIO DE MIRASIERRA. CONSTRUCCIÓN;1190;93301;62200;3;PROTECCIÓN Y PROMOCIÓN SOCIAL;1;CENTROS DE MAYORES;208;FUENCARRAL-EL PARDO;150.000,00
2020/000257;CENTRO DE ATENCIÓN A LA FAMILIA EN MONTECARMELO. CONSTRUCCIÓN;1190;93301;62200;3;PROTECCIÓN Y PROMOCIÓN SOCIAL;3;INFANCIA Y FAMILIA;208;FUENCARRAL-EL PARDO;150.000,00
2020/000259;CENTRO CULTURAL EN EL PAU DE CARABANCHEL. CONSTRUCCIÓN;1190;93301;62200;10;CULTURA;3;CENTROS CULTURALES;211;CARABANCHEL;150.000,00
2020/000260;EDIFICIO SEDE DEL DISTRITO DE PUENTE DE VALLECAS. CONSTRUCCIÓN;1190;93301;62200;0;INVERSIONES DE CARÁCTER GENERAL;2;SERVICIOS ADMINISTRATIVOS  TERRITORIALES;213;PUENTE DE VALLECAS;300.000,00
2020/000261;INIDAD INTEGRAL DE POLICIA MUNICIPAL Y SAMUR PUENTE DE VALLECAS. CONSTRUCCIÓN;1190;93301;62200;1;PROTECCIÓN CIVIL Y SEGURIDAD CIUDADANA;0;POLICIA MUNICIPAL;213;PUENTE DE VALLECAS;450.000,00
2020/000262;UNIDAD INTEGRAL DE POLICÍA MUNICIPAL VILLA DE VALLECAS. CONSTRUCCIÓN;1190;93301;62200;1;PROTECCIÓN CIVIL Y SEGURIDAD CIUDADANA;0;POLICIA MUNICIPAL;218;VILLA DE VALLECAS;150.000,00
2020/000263;UNIDAD INTEGRAL DE POLICÍA MUNICIPAL CIUDAD LINEAL. CONSTRUCCIÓN;1190;93301;62200;1;PROTECCIÓN CIVIL Y SEGURIDAD CIUDADANA;0;POLICIA MUNICIPAL;215;CIUDAD LINEAL;150.000,00
2020/000264;ESCUELA INFANTIL EN EL CAÑAVERAL. CONSTRUCCIÓN;1190;93301;62200;5;EDUCACIÓN;1;ESCUELAS INFANTILES;219;VICALVARO;150.000,00
2020/000296;BIBLIOTECA EN EL DISTRITO DE MONCLOA. CONSTRUCCIÓN;1190;93301;62200;10;CULTURA;0;BIBLIOTECAS Y PATRIMONIO BIBLIOGRÁFICO;209;MONCLOA-ARAVACA;150.000,00
2020/000297;BIBLIOTECA EN EL DISTRITO DE CARABANCHEL. CONSTRUCCIÓN;1190;93301;62200;10;CULTURA;0;BIBLIOTECAS Y PATRIMONIO BIBLIOGRÁFICO;211;CARABANCHEL;150.000,00
2017/001143;EDIFICIO C/ FRANCISCO LAGUNA, 38. ADECUACIÓN PARA CENTRO PROMOCIÓN ECONOMÍA SOCIAL;1190;93301;63200;14;SECTORES PRODUCTIVOS;1;PROMOCIÓN ECONÓMICA;213;PUENTE DE VALLECAS;5.252,00
2017/004710;CENTRO DEPORTIVO CASA DE CAMPO. SUBSANACIÓN PATOLOGÍAS EN LA PISCINA CLIMATIZADA;1190;93301;63200;11;DEPORTES, JUVENTUD  Y ESPARCIMIENTO;1;POLIDEPORTIVOS;209;MONCLOA-ARAVACA;23.906,00
2017/004712;UNIDAD LOGÍSTICA POLICÍA MUNICIPAL, AVENIDA DE VALLADOLID, 6. SUBSANACIÓN DE PATOLOGÍAS;1190;93301;63200;1;PROTECCIÓN CIVIL Y SEGURIDAD CIUDADANA;0;POLICIA MUNICIPAL;209;MONCLOA-ARAVACA;1.621.187,00
2018/005005;CENTRO DEPORTIVO JOSÉ Mª CAGIGAL. SUBSANACIÓN PATOLOGÍAS SALA POLIVALENTE Y EDIFICIO VESTUARIOS;1190;93301;63200;11;DEPORTES, JUVENTUD  Y ESPARCIMIENTO;1;POLIDEPORTIVOS;209;MONCLOA-ARAVACA;500.000,00
2018/005007;CENTRO DEPORTIVO SAN BLAS. SUBSANACIÓN DE PATOLOGÍAS EN PISCINA CUBIERTA;1190;93301;63200;11;DEPORTES, JUVENTUD  Y ESPARCIMIENTO;1;POLIDEPORTIVOS;220;SAN BLAS - CANILLEJAS;815.000,00
2018/005045;EDIFICIO VALLEHERMOSO, 47 C/V.FERNÁNDEZ DE LOS RÍOS. REHABILITACIÓN PARA CENTRO DE MAYORES;1190;93301;63200;3;PROTECCIÓN Y PROMOCIÓN SOCIAL;1;CENTROS DE MAYORES;207;CHAMBERI;150.000,00
2018/005047;CENTRO DEPORTIVO CASA DE CAMPO.SUBSANACIÓN PATOLOGÍAS ENVOLVENTE PISCINA CUBIERTA INVIERNO;1190;93301;63200;11;DEPORTES, JUVENTUD  Y ESPARCIMIENTO;1;POLIDEPORTIVOS;209;MONCLOA-ARAVACA;600.000,00
2018/005049;UNIDAD DE LOGÍSTICA POLICÍA MUNICIPAL AV. VALLADOLID, 6. SUBSANACIÓN DE PATOLOGÍAS NAVE;1190;93301;63200;1;PROTECCIÓN CIVIL Y SEGURIDAD CIUDADANA;0;POLICIA MUNICIPAL;209;MONCLOA-ARAVACA;500.000,00
2018/005057;PALACIO TORRE ARIAS. SUBSANACIÓN DE PATOLOGÍAS Y CONSOLIDACIÓN FORJADOS Y MUROS;1190;93301;63200;0;INVERSIONES DE CARÁCTER GENERAL;3;EDIFICIOS PARA EL USO GENERAL;220;SAN BLAS - CANILLEJAS;1.518.372,00
2018/005062;CENTRO DEPORTIVO ALUCHE. SUBSANACIÓN PATOLOGÍAS DEL PABELLÓN GRANDE;1190;93301;63200;11;DEPORTES, JUVENTUD  Y ESPARCIMIENTO;1;POLIDEPORTIVOS;210;LATINA;730.000,00
2018/005072;CENTRO DEPORTIVO VICÁLVARO. SUBSANACIÓN DE PATOLOGÍAS EN GALERÍA PISCINA DE VERANO;1190;93301;63200;11;DEPORTES, JUVENTUD  Y ESPARCIMIENTO;1;POLIDEPORTIVOS;219;VICALVARO;1.717.108,00
2018/006011;CENTRO DEPORTIVO MUNICIPAL JOSÉ MARÍA CAGIGAL. REHABILITACIÓN;1190;93301;63200;11;DEPORTES, JUVENTUD  Y ESPARCIMIENTO;1;POLIDEPORTIVOS;209;MONCLOA-ARAVACA;1.354.000,00
2018/006115;NUEVA ESCUELA INFANTIL EN EL BARRIO DE PACÍFICO. OBRAS DE REFORMA Y AMPLIACIÓN DE NAVE;1190;93301;63200;5;EDUCACIÓN;1;ESCUELAS INFANTILES;203;RETIRO;200.000,00
2018/006707;CENTRO DEPORTIVO DE SAN BLAS. SUBSANACIÓN DE PATOLOGÍAS EN VESTUARIOS Y ALMACÉN;1190;93301;63200;11;DEPORTES, JUVENTUD  Y ESPARCIMIENTO;1;POLIDEPORTIVOS;220;SAN BLAS - CANILLEJAS;670.000,00
2019/000501;EDIFICIO CALLE ALBERTO PALACIOS, 13. OBRAS DE MEJORA;1190;93301;63200;0;INVERSIONES DE CARÁCTER GENERAL;3;EDIFICIOS PARA EL USO GENERAL;217;VILLAVERDE;49.997,00
2019/000585;CASA DE CISNEROS. PLAZA DE LA VILLA, 4. SUBSANACIÓN PATOLOGÍAS EN EL ARTESONADO;1190;93301;63200;0;INVERSIONES DE CARÁCTER GENERAL;1;SERVICIOS ADMINISTRATIVOS CENTRALES;201;CENTRO;164.806,00
2019/000697;CENTRO DEPORTIVO SAN BLAS. OBRAS ADECUACIÓN PAVIMENTO;1190;93301;63200;11;DEPORTES, JUVENTUD  Y ESPARCIMIENTO;1;POLIDEPORTIVOS;220;SAN BLAS - CANILLEJAS;405.000,00
2020/000158;OBRAS DE CONSERVACION Y MANTENIMIENTO EN EDIFICIOS MUNICIPALES;1190;93301;63200;0;INVERSIONES DE CARÁCTER GENERAL;3;EDIFICIOS PARA EL USO GENERAL;998;VARIOS DISTRITOS;3.000.000,00
2020/000159;OBRAS DE SUBSANACIÓN DE PATOLOGÍAS EN EDIFICIOS MUNICIPALES;1190;93301;63200;0;INVERSIONES DE CARÁCTER GENERAL;3;EDIFICIOS PARA EL USO GENERAL;998;VARIOS DISTRITOS;2.000.000,00
2020/000161;ESTUDIOS Y TRABAJOS TECNICOS. REFORMA DE EDIFICIOS;1190;93301;63200;0;INVERSIONES DE CARÁCTER GENERAL;3;EDIFICIOS PARA EL USO GENERAL;998;VARIOS DISTRITOS;150.000,00
2020/000265;CENTRO CULTURAL BUENAVISTA. OBRAS DE AMPLIACIÓN;1190;93301;63200;10;CULTURA;3;CENTROS CULTURALES;204;SALAMANCA;150.000,00
2020/000266;CENTRO DE MAYORES VALLEHERMOSO. ADECUACIÓN PARA SAMUR- PROTECCIÓN CIVIL;1190;93301;63200;1;PROTECCIÓN CIVIL Y SEGURIDAD CIUDADANA;2;SAMUR - PROTECCIÓN CIVIL;207;CHAMBERI;150.000,00
2020/000267;CENTRO DEPORTIVO CASA DE CAMPO. SUBSANACIÓN PATOLOGÍAS LOCALES ANEJO PISCINA INVIERNO;1190;93301;63200;11;DEPORTES, JUVENTUD  Y ESPARCIMIENTO;1;POLIDEPORTIVOS;209;MONCLOA-ARAVACA;700.000,00
2020/000268;CENTRO DEPORTIVO JOSÉ MARÍA CAGIGAL. SUBSANACIÓN PATOLOGÍAS VESTUARIOS Y PABELLÓN;1190;93301;63200;11;DEPORTES, JUVENTUD  Y ESPARCIMIENTO;1;POLIDEPORTIVOS;209;MONCLOA-ARAVACA;1.900.000,00
2020/000276;EDIFICIO C/ FRANCOS RODRIGUEZ, 77.CONSOLIDACION ESTRUCTURAL Y ADAPTACION A NORMATIVA;1190;93301;63200;0;INVERSIONES DE CARÁCTER GENERAL;2;SERVICIOS ADMINISTRATIVOS  TERRITORIALES;209;MONCLOA-ARAVACA;3.500.000,00
2020/000279;BIBLIOTECA LA CHATA. SUBSANACIÓN DE PATOLOGÍAS;1190;93301;63200;10;CULTURA;0;BIBLIOTECAS Y PATRIMONIO BIBLIOGRÁFICO;211;CARABANCHEL;350.000,00
2020/000281;CENTRO DEPORTIVO PEPU HERNÁNDEZ. SUBSANACIÓN DE PATOLOGIAS FACHADA;1190;93301;63200;11;DEPORTES, JUVENTUD  Y ESPARCIMIENTO;1;POLIDEPORTIVOS;220;SAN BLAS - CANILLEJAS;350.000,00
2019/000580;REPARACIÓN CALZADAS.PLANES INTEGRALES BARRIO. DISTRITOS DE CARABACHEL, USERA Y VILLAVERDE;1190;15321;61910;8;MANTENIMIENTO URBANO;2;VÍAS PÚBLICAS;998;VARIOS DISTRITOS;465.915,00
2016/000724;PASARELA PEATONAL ACCESO CERCANÍAS SAN CRISTÓBAL DE LOS ÁNGELES DESDE Bº DE BUTARQUE;1190;15340;60911;7;INFRAESTRUCTURAS;4;CONSTRUCCIÓN PASARELAS PEATONALES;217;VILLAVERDE;950.000,00
2017/000195;EDIFICIO DOTACIONAL C/EDUARDO MORALES, 28. CONSTRUCCIÓN;1190;93301;62200;0;INVERSIONES DE CARÁCTER GENERAL;3;EDIFICIOS PARA EL USO GENERAL;211;CARABANCHEL;3.307.423,00
2017/000198;ESCUELA DE MÚSICA C/CORREGIDOR DIEGO VALDERRÁBANO. CONSTRUCCIÓN;1190;93301;62200;5;EDUCACIÓN;3;ESCUELAS DE MÚSICA;214;MORATALAZ;2.616.326,00
2017/000317;BIBLIOTECA DE VILLAVERDE. CONSTRUCCIÓN;1190;93301;62200;10;CULTURA;0;BIBLIOTECAS Y PATRIMONIO BIBLIOGRÁFICO;217;VILLAVERDE;150.000,00
2020/000067;ZONAS AJARDINADAS DEL DISTRITO CENTRO. OBRAS DE REMODELACIÓN;1201;17102;61921;9;MEDIO AMBIENTE;1;ZONAS AJARDINADAS;201;CENTRO;150.000,00
2020/000059;EQUIPAMIENTO CENTRO DE MAYORES Y SERVICIOS SOCIALES DISTRITO CENTRO;1201;23103;63599;3;PROTECCIÓN Y PROMOCIÓN SOCIAL;1;CENTROS DE MAYORES;201;CENTRO;15.000,00
2020/000015;OBRAS DE CONSERVACION CENTROS DOCENTES DE ENSEÑANZA DISTRITO DE CENTRO;1201;32301;63200;5;EDUCACIÓN;0;COLEGIOS;201;CENTRO;600.000,00
2020/000016;EQUIPAMIENTO ESCUELAS INFANTILES DISTRITO CENTRO;1201;32301;63599;5;EDUCACIÓN;1;ESCUELAS INFANTILES;201;CENTRO;5.000,00
2020/000017;EQUIPAMIENTO PROGRAMACIÓN CULTURAL DISTRITO CENTRO;1201;33401;62599;10;CULTURA;5;PROMOCIÓN DE LA CULTURA;201;CENTRO;10.000,00
2020/000018;OBRAS DE CONSERVACIÓN INSTALACIONES DEPORTIVAS DISTRITO DE CENTRO;1201;34201;63200;11;DEPORTES, JUVENTUD  Y ESPARCIMIENTO;1;POLIDEPORTIVOS;201;CENTRO;48.000,00
2020/000019;OBRAS DE CONSERVACIÓN DE EDIFICIOS DISTRITO CENTRO;1201;93302;63200;0;INVERSIONES DE CARÁCTER GENERAL;3;EDIFICIOS PARA EL USO GENERAL;201;CENTRO;105.000,00
2020/000114;OBRAS DE CONSERVACION CENTROS DOCENTES DE ENSEÑANZA DISTRITO DE ARGANZUELA;1202;32301;63200;5;EDUCACIÓN;0;COLEGIOS;202;ARGANZUELA;139.461,00
2020/000116;OBRAS CONSERVACION EDIFICIOS SERVICIOS COMPLEMENTARIOS EDUCACION ARGANZUELA;1202;32601;63200;5;EDUCACIÓN;3;ESCUELAS DE MÚSICA;202;ARGANZUELA;8.900,00
2020/000117;OBRAS DE CONSERVACIÓN INSTALACIONES DEPORTIVAS DISTRITO DE ARGANZUELA;1202;34201;63200;11;DEPORTES, JUVENTUD  Y ESPARCIMIENTO;1;POLIDEPORTIVOS;202;ARGANZUELA;139.462,00
2020/000119;EQUIPAMIENTO SERVICIOS ADMINISTRATIVOS DISTRITO ARGANZUELA;1202;92001;62302;0;INVERSIONES DE CARÁCTER GENERAL;2;SERVICIOS ADMINISTRATIVOS  TERRITORIALES;202;ARGANZUELA;500
2020/000118;OBRAS DE CONSERVACIÓN EDIFICIOS DISTRITO DE ARGANZUELA;1202;93302;63200;0;INVERSIONES DE CARÁCTER GENERAL;3;EDIFICIOS PARA EL USO GENERAL;202;ARGANZUELA;60.000,00
2020/000122;OBRAS DE CONSERVACION CENTROS DOCENTES DE ENSEÑANZA DISTRITO DE SALAMANCA;1204;32301;63200;5;EDUCACIÓN;0;COLEGIOS;204;SALAMANCA;65.000,00
2020/000125;OBRAS DE CONSERVACION INSTALACIONES DEPORTIVAS DISTRITO DE SALAMANCA;1204;34201;63200;11;DEPORTES, JUVENTUD  Y ESPARCIMIENTO;1;POLIDEPORTIVOS;204;SALAMANCA;90.000,00
2019/000368;GIMNASIO MOSCARDÓ. REPOSICIÓN MÁQUINA DESHUMECTADORA PISCINA;1204;34201;63301;11;DEPORTES, JUVENTUD  Y ESPARCIMIENTO;1;POLIDEPORTIVOS;204;SALAMANCA;500
2020/000127;OBRAS DE CONSERVACIÓN EDIFICIOS DISTRITO DE SALAMANCA;1204;93302;63200;0;INVERSIONES DE CARÁCTER GENERAL;3;EDIFICIOS PARA EL USO GENERAL;204;SALAMANCA;115.426,00
2020/000024;SERVICIOS DE SALUBRIDAD DISTRITO DE CHAMARTÍN. EQUIPOS DE ANÁLISIS Y CONTROL;1205;31101;62302;4;SALUD PÚBLICA;0;PROMOCIÓN DE LA SALUD Y AT. SANITARIA;205;CHAMARTIN;900
2020/000134;PISTA DE PATINAJE LIBRE EN C/COLOMBIA, 59. OBRAS DE ACONDICIONAMIENTO;1205;34201;61999;11;DEPORTES, JUVENTUD  Y ESPARCIMIENTO;2;PISTAS DEPORTIVAS ELEMENTALES;205;CHAMARTIN;97.726,00
2020/000062;EQUIPAMIENTO CENTRO DEPORTIVO MUNICIPAL PRADILLO;1205;34201;62500;11;DEPORTES, JUVENTUD  Y ESPARCIMIENTO;1;POLIDEPORTIVOS;205;CHAMARTIN;765
2020/000062;EQUIPAMIENTO CENTRO DEPORTIVO MUNICIPAL PRADILLO;1205;34201;62599;11;DEPORTES, JUVENTUD  Y ESPARCIMIENTO;1;POLIDEPORTIVOS;205;CHAMARTIN;3.010,00
2019/000435;RAMPA COMUNICACIÓN CALLE MAURICIO LEGENDRE CON CALLE PABLO LUNA. CONSTRUCCIÓN;1205;15322;61910;8;MANTENIMIENTO URBANO;2;VÍAS PÚBLICAS;205;CHAMARTIN;110.983,00
2020/000128;ZONAS AJARDINADAS DEL DISTRITO DE TETUÁN. REMODELACIÓN;1206;17102;61921;9;MEDIO AMBIENTE;1;ZONAS AJARDINADAS;206;TETUAN;20.000,00
2020/000028;EQUIPAMIENTO CENTROS DE MAYORES DISTRITO DE TETUAN;1206;23103;62599;3;PROTECCIÓN Y PROMOCIÓN SOCIAL;1;CENTROS DE MAYORES;206;TETUAN;10.000,00
2020/000132;EQUIPAMIENTO CENTRO DE SERVICIOS SOCIALES VICENTE FERRER;1206;23106;62599;3;PROTECCIÓN Y PROMOCIÓN SOCIAL;2;CENTROS DE SERVICIOS SOCIALES;206;TETUAN;4.000,00
2020/000206;OBRAS DE CONSERVACION CENTROS DOCENTES DE ENSEÑANZA DISTRITO DE TETUAN;1206;32301;63200;5;EDUCACIÓN;0;COLEGIOS;206;TETUAN;100.000,00
2018/005159;LOCALES MERCADO SAN ENRIQUE. REFORMA Y ACONDICIONAMIENTO;1206;93302;63200;12;OTROS BIENES PÚBLICOS DE CARÁCTER SOCIAL;1;PARTICIPACIÓN CIUDADANA;206;TETUAN;1.379.966,00
2020/000208;OBRAS DE CONSERVACIÓN EDIFICIOS DISTRITO DE TETUAN;1206;93302;63200;0;INVERSIONES DE CARÁCTER GENERAL;3;EDIFICIOS PARA EL USO GENERAL;206;TETUAN;67.954,00
2018/001108;BARRIOS DE ALMENARA Y VENTILLA. PLAN INTEGRAL DE REMODELACIÓN;1206;17102;61921;9;MEDIO AMBIENTE;1;ZONAS AJARDINADAS;206;TETUAN;1.253,00
2020/000144;CENTRO DE MAYORES SANTA ENGRACIA. LAVAVAJILLAS;1207;23103;62599;3;PROTECCIÓN Y PROMOCIÓN SOCIAL;1;CENTROS DE MAYORES;207;CHAMBERI;2.000,00
2020/000145;EQUIPAMIENTO SERVICIOS ADMINISTRATIVOS DISTRITO CHAMBERÍ;1207;92001;62500;0;INVERSIONES DE CARÁCTER GENERAL;2;SERVICIOS ADMINISTRATIVOS  TERRITORIALES;207;CHAMBERI;5.000,00
2020/000111;EQUIPAMIENTO CENTROS DE MAYORES DISTRITO FUENCARRAL-EL PARDO;1208;23103;63599;3;PROTECCIÓN Y PROMOCIÓN SOCIAL;1;CENTROS DE MAYORES;208;FUENCARRAL-EL PARDO;30.000,00
2020/000171;EQUIPAMIENTO CENTROS DE SERVICIOS SOCIALES DISTRITO FUENCARRAL-EL PARDO;1208;23106;63599;3;PROTECCIÓN Y PROMOCIÓN SOCIAL;2;CENTROS DE SERVICIOS SOCIALES;208;FUENCARRAL-EL PARDO;20.000,00
2020/000012;OBRAS DE CONSERVACION CENTROS DOCENTES DE ENSEÑANZA DISTRITO DE FUENCARRAL-EL PARDO;1208;32301;63200;5;EDUCACIÓN;0;COLEGIOS;208;FUENCARRAL-EL PARDO;50.000,00
2020/000054;EQUIPAMIENTO CENTROS CULTURALES DISTRITO FUENCARRAL-EL PARDO;1208;33401;62599;10;CULTURA;3;CENTROS CULTURALES;208;FUENCARRAL-EL PARDO;5.000,00
2020/000054;EQUIPAMIENTO CENTROS CULTURALES DISTRITO FUENCARRAL-EL PARDO;1208;33401;63599;10;CULTURA;3;CENTROS CULTURALES;208;FUENCARRAL-EL PARDO;10.000,00
2020/000124;EQUIPAMIENTO CENTROS DEPORTIVOS MUNICIPALES DEL DISTRITO DE FUENCARRAL-EL PARDO;1208;34201;62300;11;DEPORTES, JUVENTUD  Y ESPARCIMIENTO;1;POLIDEPORTIVOS;208;FUENCARRAL-EL PARDO;10.000,00
2020/000124;EQUIPAMIENTO CENTROS DEPORTIVOS MUNICIPALES DEL DISTRITO DE FUENCARRAL-EL PARDO;1208;34201;62302;11;DEPORTES, JUVENTUD  Y ESPARCIMIENTO;1;POLIDEPORTIVOS;208;FUENCARRAL-EL PARDO;5.000,00
2020/000124;EQUIPAMIENTO CENTROS DEPORTIVOS MUNICIPALES DEL DISTRITO DE FUENCARRAL-EL PARDO;1208;34201;62599;11;DEPORTES, JUVENTUD  Y ESPARCIMIENTO;1;POLIDEPORTIVOS;208;FUENCARRAL-EL PARDO;5.000,00
2017/001286;DEPORTIVO BÁSICO MINGORRUBIO. ACONDICIONAMIENTO DE PISTAS;1208;34201;63200;11;DEPORTES, JUVENTUD  Y ESPARCIMIENTO;2;PISTAS DEPORTIVAS ELEMENTALES;208;FUENCARRAL-EL PARDO;350.000,00
2020/000029;OBRAS DE CONSERVACION INSTALACIONES DEPORTIVAS DISTRITO DE FUENCARRAL-EL PARDO;1208;34201;63200;11;DEPORTES, JUVENTUD  Y ESPARCIMIENTO;1;POLIDEPORTIVOS;208;FUENCARRAL-EL PARDO;50.000,00
2020/000001;EQUIPAMIENTO SERVICIOS ADMINISTRATIVOS DISTRITO FUENCARRAL-EL PARDO;1208;92001;62500;0;INVERSIONES DE CARÁCTER GENERAL;2;SERVICIOS ADMINISTRATIVOS  TERRITORIALES;208;FUENCARRAL-EL PARDO;46.000,00
2020/000061;OBRAS DE CONSERVACION EDIFICIOS DISTRITO FUENCARRAL-EL PARDO;1208;93302;63200;0;INVERSIONES DE CARÁCTER GENERAL;3;EDIFICIOS PARA EL USO GENERAL;208;FUENCARRAL-EL PARDO;50.000,00
2019/000438;PARQUE DE BEGOÑA. ACONDICIONAMIENTO (PLAN INTEGRAL BARRIO DE BEGOÑA);1208;17102;61999;9;MEDIO AMBIENTE;0;PARQUES;208;FUENCARRAL-EL PARDO;250.000,00
2020/000166;PLACAS CONMEMORATIVAS DISTRITO MONCLOA-ARAVACA. INSTALACIÓN;1209;33401;60999;10;CULTURA;5;PROMOCIÓN DE LA CULTURA;209;MONCLOA-ARAVACA;6.000,00
2020/000058;EQUIPAMIENTO SERVICIOS ADMINISTRATIVOS DISTRITO MONCLOA-ARAVACA;1209;92001;62302;0;INVERSIONES DE CARÁCTER GENERAL;2;SERVICIOS ADMINISTRATIVOS  TERRITORIALES;209;MONCLOA-ARAVACA;1.000,00
2020/000058;EQUIPAMIENTO SERVICIOS ADMINISTRATIVOS DISTRITO MONCLOA-ARAVACA;1209;92001;62500;0;INVERSIONES DE CARÁCTER GENERAL;2;SERVICIOS ADMINISTRATIVOS  TERRITORIALES;209;MONCLOA-ARAVACA;9.000,00
2020/000058;EQUIPAMIENTO SERVICIOS ADMINISTRATIVOS DISTRITO MONCLOA-ARAVACA;1209;92001;62599;0;INVERSIONES DE CARÁCTER GENERAL;2;SERVICIOS ADMINISTRATIVOS  TERRITORIALES;209;MONCLOA-ARAVACA;1.500,00
